,Headline,Positive,Negative,Neutral,date,article_id
206,corrections january 27 2015,0.02295668050646782,0.07011838257312775,0.9069249629974365,27/01/2015,5684
207,quotation of the day,0.03285898268222809,0.06459265947341919,0.9025484323501587,27/01/2015,5683
208,whats on tv tuesday,0.027607697993516922,0.05148667097091675,0.9209056496620178,27/01/2015,5680
209,MEDIADAY,0.03879278525710106,0.0530819334089756,0.9081253409385681,27/01/2015,5888
210,gas still not as cheap as it used to be,0.20075549185276031,0.12032441794872284,0.6789200901985168,27/01/2015,5677
211,word of the day euthanasia,0.04958885908126831,0.06858174502849579,0.8818294405937195,27/01/2015,5675
212,robert kraft defends patriots amid uproar over deflated footballs,0.13505712151527405,0.4048698842525482,0.46007296442985535,27/01/2015,5674
213,27 fisc foia documents,0.02858915738761425,0.04360542073845863,0.9278054237365723,27/01/2015,5673
214,edgar froese leader of tangerine dream dies at 70,0.030853819102048874,0.27291762828826904,0.6962285041809082,27/01/2015,5672
215,white house to propose allowing oil drilling off atlantic coast,0.5399529933929443,0.01676475629210472,0.44328221678733826,27/01/2015,5671
216,new york city commuters hurry home to beat the storm,0.2701418995857239,0.08479076623916626,0.6450673341751099,27/01/2015,5670
217,sal polisi master woodcarver at south street seaport museum dies at 79,0.06525268405675888,0.07033096253871918,0.8644164204597473,27/01/2015,5669
218,reid is home after surgery for injuries,0.14109161496162415,0.5128692984580994,0.34603914618492126,27/01/2015,5668
219,joan riverss daughter files malpractice suit against manhattan clinic,0.020234528928995132,0.8688772916793823,0.11088821291923523,27/01/2015,5667
220,winning lottery numbers for jan 26 2015,0.0281944889575243,0.0655694231390953,0.9062361121177673,27/01/2015,5666
221,treatment of overdose will cost cities less,0.16854500770568848,0.01812712661921978,0.8133278489112854,27/01/2015,5664
222,wikileaks assails google and the us,0.014027543365955353,0.8105538487434387,0.1754186898469925,27/01/2015,5663
223,a nigerian city long under siege survives an audacious militant assault,0.05222312733530998,0.8086126446723938,0.13916422426700592,27/01/2015,5662
224,times squares crushing success raises questions about its future,0.14471636712551117,0.310729056596756,0.5445545315742493,27/01/2015,5661
225,us aid agency suspends group from new contracts,0.015256517566740513,0.8987733721733093,0.08597009629011154,27/01/2015,5660
226,saudi succession hinting at shift in foreign role,0.2965995669364929,0.1632966846227646,0.5401037335395813,27/01/2015,5659
227,fired fox employee kills himself outside news corp building,0.017268748953938484,0.8558452129364014,0.12688609957695007,27/01/2015,5658
228,plan to protect refuge has alaskans offended and fearful over money,0.0156245157122612,0.9520074725151062,0.0323680117726326,27/01/2015,5657
229,jdcom chinas other e commerce giant follows its own path,0.1089228093624115,0.009974098764359951,0.8811030983924866,27/01/2015,5612
230,greeces agonized cry to europe,0.10420416295528412,0.11011068522930145,0.7856851816177368,27/01/2015,5611
231,kurds isis syria kobani,0.02619263529777527,0.513572096824646,0.46023523807525635,27/01/2015,5608
232,budget forecast sees end to steep declines in federal deficit,0.06976460665464401,0.9135524034500122,0.01668296568095684,27/01/2015,5607
233,ukraine heavy fighting rebels donetsk,0.026279758661985397,0.7585498094558716,0.21517044305801392,27/01/2015,5548
234,27qna,0.0343286395072937,0.05583985894918442,0.9098314642906189,27/01/2015,5547
235,study suggests earlier use of tools by hominids,0.053572993725538254,0.027842143550515175,0.9185848832130432,27/01/2015,5546
236,steven brill tackles health care in americas bitter pill,0.08796457201242447,0.06737858802080154,0.8446568250656128,27/01/2015,5545
237,even in affluent towns rising tax bills mean angst and appeals,0.013259174302220345,0.9483300447463989,0.03841076418757439,27/01/2015,5544
238,skymall stumbles as airlines hone their sales pitches,0.010616244748234749,0.9674012660980225,0.021982615813612938,27/01/2015,5543
239,supreme court rules against retirees in health benefits case,0.036528050899505615,0.3483327627182007,0.6151392459869385,27/01/2015,5542
240,australian open madison keys to face her childhood idol venus williams next,0.08876212686300278,0.030195677652955055,0.8810421824455261,27/01/2015,5538
241,manhattan democratic leader calls on silver to quit post,0.02437649667263031,0.7054178714752197,0.27020561695098877,27/01/2015,5533
242,bryan stockton resigns as ceo from a reeling mattel,0.017860518768429756,0.7789753675460815,0.20316407084465027,27/01/2015,5529
243,the surprise isnt that an extreme party won in greece its that it took this long,0.1599847823381424,0.026759373024106026,0.8132558465003967,27/01/2015,5526
244,facebook said to block pages on muhammad to avoid ban in turkey,0.016964402049779892,0.6924053430557251,0.2906302213668823,27/01/2015,5521
245,so happy together,0.15078400075435638,0.03505240008234978,0.8141636252403259,27/01/2015,5519
246,autism diagnosis in siblings serves as poor indicator of risk,0.02335965447127819,0.6347596645355225,0.3418807089328766,27/01/2015,5509
247,after vote in greece alexis tsipras seeks to address debt,0.2949559986591339,0.01656467281281948,0.6884793043136597,27/01/2015,5508
248,marshawn lynchs gestures evoke jim mcmahons headband,0.03264559805393219,0.058577828109264374,0.9087766408920288,27/01/2015,5507
249,millions paid by x prize foundation for progress toward trip to moon,0.6300815939903259,0.011439820751547813,0.3584786355495453,27/01/2015,5502
250,how the smell of rain bubbles from the ground,0.04610408842563629,0.04499000683426857,0.9089059233665466,27/01/2015,5501
251,mubaraks sons are released from jail in egypt,0.10514338314533234,0.40472298860549927,0.4901336431503296,27/01/2015,5494
252,streetwear a little older and wiser at oamc,0.25014886260032654,0.03053007647395134,0.719321072101593,27/01/2015,5493
253,us envoy urges thailand to lift martial law,0.4010137915611267,0.13472440838813782,0.46426185965538025,27/01/2015,5491
254,new york blizzard,0.035343557596206665,0.04204939678311348,0.9226070642471313,27/01/2015,5481
255,revisiting andrea chenier,0.026537936180830002,0.047100476920604706,0.9263615608215332,27/01/2015,5479
256,church of england consecrates rev libby lane bishop,0.06991257518529892,0.02129558101296425,0.9087918996810913,27/01/2015,5550
257,the yale student and the policeman,0.08462866395711899,0.028938153758645058,0.8864331841468811,27/01/2015,5687
258,nets and knicks home games postponed by storm,0.017713075503706932,0.5542399287223816,0.4280470311641693,27/01/2015,5554
259,da hugh leonards 1978 tony winner via irish rep,0.1370687037706375,0.022807303816080093,0.8401240110397339,27/01/2015,5557
260,your letters end of life decisions and writing your story,0.04255056381225586,0.04485397785902023,0.9125953912734985,27/01/2015,5606
261,american experience explores the mastery of thomas edison,0.1257629245519638,0.01352375652641058,0.8607133626937866,27/01/2015,5604
262,marc cary brings his jazz specialty to ginnys supper club,0.0817466527223587,0.01881629042327404,0.8994370698928833,27/01/2015,5603
263,nevermore a musical biography of edgar allan poe,0.046716317534446716,0.060261089354753494,0.8930225968360901,27/01/2015,5602
264,marissa mayer and the fight to save yahoo by nicholas carlson,0.07602586597204208,0.02075696364045143,0.9032171964645386,27/01/2015,5600
265,cleaning up water by running it through dirt,0.030744431540369987,0.05636753514409065,0.9128881096839905,27/01/2015,5597
266,kochs plan to spend 900 million on 2016 campaign,0.34140685200691223,0.00867094099521637,0.649922251701355,27/01/2015,5596
267,releases from jamie cullum and charlie wilson,0.04066946730017662,0.033414363861083984,0.9259161949157715,27/01/2015,5595
268,hold the drug go straight to the source,0.032515183091163635,0.02423204481601715,0.9432527422904968,27/01/2015,5594
269,shove over cornish pasty balti curry vies for a spot on britains culinary honor roll,0.5798213481903076,0.039108287543058395,0.38107043504714966,27/01/2015,5592
270,wright foundation names architecture dean,0.0543513260781765,0.012951374985277653,0.9326973557472229,27/01/2015,5590
271,mariinsky ballet concludes brooklyn run with chopin,0.16338522732257843,0.05237532779574394,0.7842394709587097,27/01/2015,5589
272,20150127CHOPIN,0.053437355905771255,0.040424641221761703,0.906138002872467,27/01/2015,5588
273,cia officer in leak case jeffrey sterling is convicted of espionage,0.08451623469591141,0.42721015214920044,0.48827362060546875,27/01/2015,5585
274,3 charged with working as agents for russia in new york,0.032392717897892,0.21402671933174133,0.7535805702209473,27/01/2015,5581
275,snow leads met opera to cancel a premiere all broadway shows canceled,0.009245462715625763,0.9375138878822327,0.05324062332510948,27/01/2015,5580
276,post holdings buying mom brands for 1 15 billion,0.04769453778862953,0.016600102186203003,0.9357053637504578,27/01/2015,5577
277,robyn orlin and compagnie jant bi evoke senegalese tradition,0.055047616362571716,0.02572733722627163,0.9192250370979309,27/01/2015,5576
278,amphion string quartet at alice tully hall,0.06710689514875412,0.04611777141690254,0.8867753148078918,27/01/2015,5566
279,dominic ongwen lords resistance army war crimes court hague,0.0697740837931633,0.2824787199497223,0.6477472186088562,27/01/2015,5565
280,off the 3 d printer practice parts for the surgeon,0.10533683747053146,0.47306516766548157,0.42159798741340637,27/01/2015,5563
281,bill cleggs debut novel is did you ever have a family,0.043500322848558426,0.031030679121613503,0.9254689812660217,27/01/2015,5562
282,miranda cuckson at spectrum and paul huang at lincoln center,0.05578668415546417,0.02619628794491291,0.9180169701576233,27/01/2015,5560
283,cia drone yemen qaeda,0.03136255592107773,0.051939524710178375,0.9166979193687439,27/01/2015,5556
284,diagnosis the view of the psychiatric association,0.05188785493373871,0.034907400608062744,0.9132047295570374,27/01/2015,5688
285,amazon investigated in japan over child pornography,0.020137807354331017,0.9174472093582153,0.062415074557065964,27/01/2015,5679
286,david brooks how to leave a mark,0.04911356419324875,0.052622728049755096,0.898263692855835,27/01/2015,5690
287,gchq britain prank caller,0.026334645226597786,0.5819249749183655,0.3917403817176819,27/01/2015,5464
288,artist profile parker ito,0.03077906183898449,0.03277541324496269,0.9364455342292786,27/01/2015,5817
289,on discrimination the mormon church gives and takes away,0.04037178307771683,0.07004047185182571,0.8895877599716187,27/01/2015,5814
290,snowstorm juno timelapse,0.03551224619150162,0.2807947099208832,0.683692991733551,27/01/2015,5812
291,paris couture week bouchra jarrar spring summer 2015,0.03976534307003021,0.08135052770376205,0.8788841366767883,27/01/2015,5805
292,trying to lose her fashion inhibitions,0.04947624355554581,0.1583552211523056,0.7921685576438904,27/01/2015,5804
293,senate democrats bowing to obama put off iran vote,0.10323899984359741,0.676989734172821,0.21977131068706512,27/01/2015,5802
294,scott walker our american revival president 2016,0.07664655894041061,0.02129734493792057,0.9020560383796692,27/01/2015,5798
295,sundance 2015 the strange tale of an amputated leg brought to you by kickstarter,0.09382723271846771,0.03760456666350365,0.8685681819915771,27/01/2015,5797
296,chris brown postpones tour,0.018904929980635643,0.5720550417900085,0.4090399742126465,27/01/2015,5796
297,ways yahoo could sell its alibaba shares without a big tax bill,0.1848912537097931,0.009418431669473648,0.805690348148346,27/01/2015,5793
298,mta blizzard reaction,0.07127635926008224,0.0679398849606514,0.8607837557792664,27/01/2015,5792
299,1915 indian receives victoria cross,0.19890445470809937,0.12336742877960205,0.6777281165122986,27/01/2015,5791
300,20150128NESTORM,0.04223545268177986,0.030370304360985756,0.9273942112922668,27/01/2015,5790
301,drones at the white house and in yemen,0.03125732019543648,0.09148884564638138,0.8772538304328918,27/01/2015,5789
302,joe nocera is vaping worse than smoking,0.060627054423093796,0.686606764793396,0.2527661621570587,27/01/2015,5689
303,most new york theaters and concert halls will reopen tuesday,0.07411391288042068,0.021345915272831917,0.9045401811599731,27/01/2015,5783
304,sundance 2015 amid the hipsters a perch for aging stars,0.18274666368961334,0.04077771678566933,0.7764756679534912,27/01/2015,5778
305,new greek debt deal will mean more brinkmanship,0.7647027969360352,0.026005471125245094,0.20929165184497833,27/01/2015,5777
306,27scene bouchra,0.04858629032969475,0.03343502804636955,0.9179787039756775,27/01/2015,5776
307,paris couture week alexis mabille spring summer 2015,0.035075023770332336,0.0771450474858284,0.887779951095581,27/01/2015,5772
308,paris couture giorgio armani prive ponytails,0.057073552161455154,0.026486923918128014,0.9164395332336426,27/01/2015,5824
309,armani prive spring 2015 couture,0.06163647770881653,0.029836855828762054,0.908526599407196,27/01/2015,5826
310,a new zealand festival coming to la mama,0.0938110202550888,0.03200488165020943,0.8741841316223145,27/01/2015,5827
311,inside a harvey weinstein story reporters notebook,0.030380945652723312,0.044978827238082886,0.9246402382850647,27/01/2015,5828
312,sugary drinks tied to earlier menstruation,0.0335659421980381,0.49050021171569824,0.47593384981155396,27/01/2015,5881
313,in dupont fight activist investor picks a strong target,0.31118375062942505,0.08467845618724823,0.6041377782821655,27/01/2015,5880
314,20150128oil ss,0.04013606905937195,0.02523937076330185,0.9346246123313904,27/01/2015,5879
315,new phase of space travel hopes to set sail on sunlight,0.22595195472240448,0.010710862465202808,0.7633371353149414,27/01/2015,5459
316,20150127 lens ross,0.03628062084317207,0.03292863816022873,0.9307907223701477,27/01/2015,5872
317,report sheds light on transgender sex workers in china,0.05670277029275894,0.2437148243188858,0.6995823979377747,27/01/2015,5870
318,27NYTNOW EVENINGSS,0.03199658915400505,0.08798132836818695,0.8800220489501953,27/01/2015,5868
319,historic gold nuggets stolen from wells fargo museum,0.046505775302648544,0.0795246958732605,0.873969554901123,27/01/2015,5866
320,jan 27 2015 photos of the day,0.03684650734066963,0.04867611080408096,0.9144774079322815,27/01/2015,5863
321,a climate hawk separates energy thought experiments from road maps,0.028653839603066444,0.038668833673000336,0.9326773285865784,27/01/2015,5862
322,sundance 2015 jane fonda and lily tomlin on women in hollywood,0.04153568297624588,0.048585195094347,0.9098791480064392,27/01/2015,5769
323,20150127POD,0.03482341393828392,0.04636602848768234,0.9188105463981628,27/01/2015,5861
324,paris couture week armani prive spring summer 2015,0.048415277153253555,0.05325542390346527,0.8983293175697327,27/01/2015,5853
325,27scene armani prive,0.09294930845499039,0.03125367686152458,0.8757970333099365,27/01/2015,5852
326,27scene armani,0.059176068753004074,0.038332272320985794,0.9024916887283325,27/01/2015,5850
327,how yahoos spinoff of its alibaba stake will work,0.024715280160307884,0.025029253214597702,0.9502554535865784,27/01/2015,5849
328,what were reading 25,0.03309609368443489,0.06252525746822357,0.9043787121772766,27/01/2015,5847
329,romney to be inducted into washingtons alfalfa club,0.08114130049943924,0.015188127756118774,0.903670608997345,27/01/2015,5843
330,even elusive animals leave dna and clues behind,0.033198367804288864,0.05978885665535927,0.9070127606391907,27/01/2015,4661
331,couture chanel flowers spring summer 2015,0.056764356791973114,0.03764083608984947,0.9055948257446289,27/01/2015,5840
332,house republicans ready to resume fight on immigration,0.1826220601797104,0.11224434524774551,0.7051336169242859,27/01/2015,5835
333,can this treatment help me theres a statistic for that,0.1564311534166336,0.015663236379623413,0.8279055953025818,27/01/2015,5463
334,los angeles opera season to open with domingo singing gianni schicchi,0.1693679392337799,0.026140902191400528,0.8044911623001099,27/01/2015,5856
335,a data science lender takes on student debt,0.0282042995095253,0.5957678556442261,0.37602782249450684,27/01/2015,5767
336,paris couture week chanel spring summer 2015,0.03698909282684326,0.051832299679517746,0.9111785888671875,27/01/2015,5785
337,bain capital to buy auto parts maker ti automotive,0.08473207801580429,0.01257016509771347,0.9026978015899658,27/01/2015,5764
338,close but not quite 9,0.2200338989496231,0.10451117902994156,0.6754549145698547,27/01/2015,5727
339,sleepy hollow recap karoake and henry knoxs vault,0.04033827781677246,0.02827991545200348,0.93138188123703,27/01/2015,5725
340,morning agenda subprime auto loans spun into gold,0.11867523193359375,0.07943995296955109,0.8018848299980164,27/01/2015,5722
341,first draft focus obama in saudi arabia,0.036211419850587845,0.02167125977575779,0.9421173334121704,27/01/2015,5765
342,chanel spring 2015 couture,0.052955467253923416,0.028629543259739876,0.9184150099754333,27/01/2015,5721
343,today in politics 83,0.0594954751431942,0.023597270250320435,0.9169071912765503,27/01/2015,5719
344,apologies all around after watch is presented as gift in taiwan,0.09828124940395355,0.014306128025054932,0.8874126672744751,27/01/2015,5718
345,daily report seeking e commerce supremacy in china one delivery at a time,0.173979714512825,0.01613684743642807,0.8098834753036499,27/01/2015,5717
346,new york today live updates on the winter storm,0.041485000401735306,0.025692572817206383,0.9328224062919617,27/01/2015,5713
347,latest news winter storm obama in saudi arabia apple earnings,0.08803567290306091,0.11779146641492844,0.7941728234291077,27/01/2015,5712
348,psychotherapy as a kind of art,0.036043114960193634,0.04344906657934189,0.9205077886581421,27/01/2015,5708
349,staying put and bearing witness to the holocaust,0.08071275055408478,0.03536903113126755,0.883918285369873,27/01/2015,5707
350,what would you do on a snow day,0.025876477360725403,0.10868248343467712,0.8654410243034363,27/01/2015,5706
351,i p o could value sunrise communications of switzerland at 3 7 billion,0.05514534190297127,0.01179479155689478,0.9330599308013916,27/01/2015,5705
352,aer lingus receptive to latest offer from british airways parent,0.9336099028587341,0.01263053622096777,0.05375964567065239,27/01/2015,5702
353,test yourself looking to uplift with navajo rez metal,0.3745522201061249,0.00910176057368517,0.616346001625061,27/01/2015,5700
354,dentons to merge with dacheng of china to create worlds largest law firm,0.20641840994358063,0.00861375592648983,0.784967839717865,27/01/2015,5699
355,an outage big but brief hits facebook and instagram,0.0156367477029562,0.9364305138587952,0.04793279990553856,27/01/2015,5698
356,who was flying that drone,0.029380369931459427,0.07788483798503876,0.8927348256111145,27/01/2015,5697
357,6 qs about the news learning from animal friendships,0.05572391301393509,0.022190479561686516,0.9220855832099915,27/01/2015,5696
358,q and a luigi tomba on privatized housing and political legitimacy in china,0.1024404913187027,0.01751774176955223,0.8800417184829712,27/01/2015,5695
359,bernard henri levi george soros save the new ukraine,0.16121099889278412,0.035717517137527466,0.8030714988708496,27/01/2015,5694
360,investing in our future at community colleges,0.21641521155834198,0.009080457501113415,0.7745043635368347,27/01/2015,5693
361,the humane death penalty charade,0.15790046751499176,0.06563141942024231,0.7764680981636047,27/01/2015,5692
362,20150127nytnow auschwitz,0.03407560661435127,0.061691828072071075,0.9042325615882874,27/01/2015,5729
363,in performance jonny donahoe of every brilliant thing,0.1054680198431015,0.03236867114901543,0.8621633648872375,27/01/2015,5728
364,the debt non spiral,0.057245947420597076,0.05138193443417549,0.8913721442222595,27/01/2015,5733
365,lattice semiconductor to buy silicon image,0.1378781795501709,0.010556761175394058,0.8515650629997253,27/01/2015,5763
366,verbatim boehner on his party,0.06166685000061989,0.07851006835699081,0.8598231077194214,27/01/2015,5762
367,a busy spring for charles lloyd,0.41198545694351196,0.18366412818431854,0.4043504297733307,27/01/2015,5761
368,27scene chanel,0.0458858460187912,0.06902468949556351,0.8850894570350647,27/01/2015,5758
369,27scene mabille,0.046302761882543564,0.06217131018638611,0.89152592420578,27/01/2015,5756
370,paris couture week giambattista valli spring summer 2015,0.05114477500319481,0.06266729533672333,0.8861879110336304,27/01/2015,5755
371,after year of growth prosper buys a surgical procedures lender,0.29956933856010437,0.008112266659736633,0.6923183798789978,27/01/2015,5754
372,27scene valli,0.08618177473545074,0.05270924046635628,0.8611090183258057,27/01/2015,5752
373,bouchra jarrar spring 2015 couture,0.04568598419427872,0.04784103110432625,0.9064729809761047,27/01/2015,5751
374,f t c calls for strong data and privacy protection with connected devices,0.5128300189971924,0.009901156648993492,0.47726887464523315,27/01/2015,5750
375,photographing the border the landscape behind the politics,0.06457658857107162,0.04086348041892052,0.894559919834137,27/01/2015,5747
376,daily clip report 110,0.025121910497546196,0.049527086317539215,0.9253509640693665,27/01/2015,5731
377,sundance 2015 a role worth dying for,0.1150054782629013,0.054588980972766876,0.8304055333137512,27/01/2015,5746
378,lyft now in talks for more funding pushes growth strategy,0.8266193270683289,0.010781265795230865,0.16259947419166565,27/01/2015,5743
379,s e c faces challenges over the constitutionality of some of its court proceedings,0.02207893133163452,0.9123228788375854,0.0655982568860054,27/01/2015,5741
380,totally prepared still freaking out,0.13262835144996643,0.2291533201932907,0.638218343257904,27/01/2015,5740
381,weekly news quiz jan 20 26 2015,0.025093091651797295,0.04839613661170006,0.926510751247406,27/01/2015,5739
382,the tyranny of greece over germany,0.03370296210050583,0.3969297409057617,0.5693672895431519,27/01/2015,5738
383,twitter adds group messaging and video recording,0.03814607858657837,0.04344448819756508,0.9184094667434692,27/01/2015,5737
384,1965 u k says farewell to churchill,0.12345611304044724,0.04182387515902519,0.8347200155258179,27/01/2015,5734
385,hillary clinton and her detractors reporters notebook,0.03017491288483143,0.08099661767482758,0.8888283967971802,27/01/2015,5744
386,president obama protects a valued wilderness,0.1841501146554947,0.029471250250935555,0.7863786816596985,27/01/2015,5691
387,the americans recap the problem with paige,0.1469229906797409,0.06192540004849434,0.7911516427993774,28/01/2015,6200
388,the people vs boko haram,0.04596533998847008,0.25684741139411926,0.6971871852874756,28/01/2015,6155
389,20150128 lens dust,0.03920256718993187,0.031299982219934464,0.929497480392456,28/01/2015,6150
390,bill belichick wore flip flops,0.02880493737757206,0.10257817804813385,0.8686169385910034,28/01/2015,6156
391,on long island a different scene,0.047058168798685074,0.08072301000356674,0.8722187876701355,28/01/2015,6191
392,after alibaba spinoff yahoo may become a takeover target,0.027859235182404518,0.029366694390773773,0.9427741169929504,28/01/2015,6168
393,buy or sell direct,0.02948116697371006,0.027447562664747238,0.9430713057518005,28/01/2015,6188
394,hungry city lolos seafood shack in harlem,0.036821234971284866,0.046537499874830246,0.9166412949562073,28/01/2015,4655
395,feta brine improves roast chicken,0.036356594413518906,0.03365054726600647,0.9299928545951843,28/01/2015,4939
396,20140128 HUNGRY,0.0335993692278862,0.04461625590920448,0.9217843413352966,28/01/2015,4657
397,crimeapark,0.04663655161857605,0.044342003762722015,0.9090214371681213,28/01/2015,7366
398,loretta lynch revisits an ultra long prison sentence,0.09390956908464432,0.23769766092300415,0.6683927178382874,28/01/2015,6136
399,gmo food labels,0.03316416218876839,0.0347544364631176,0.9320814609527588,28/01/2015,6611
400,special savings accounts for disabled people,0.02945876121520996,0.05247851833701134,0.918062686920166,28/01/2015,6621
401,the romance of wine,0.06749797612428665,0.044639088213443756,0.8878629207611084,28/01/2015,4988
402,28BIOFUELS,0.06183415651321411,0.0240673515945673,0.9140985012054443,28/01/2015,6204
403,28NYTNOW EVENINGSS,0.030394172295928,0.08104238659143448,0.8885635137557983,28/01/2015,6129
404,amazons got mail,0.10155259072780609,0.02323366142809391,0.8752137422561646,28/01/2015,6127
405,thomas friedman czar putins next moves,0.03088606707751751,0.0510990209877491,0.9180148839950562,28/01/2015,5946
406,viktor rolf spring 2015 couture,0.06928171217441559,0.032313719391822815,0.8984045386314392,28/01/2015,6034
407,20150128 REST,0.027845876291394234,0.05461755767464638,0.9175365567207336,28/01/2015,5819
408,texas chili makes a welcome guest,0.1857660859823227,0.012955965474247932,0.8012778759002686,28/01/2015,5524
409,martin brodeur to retire after 22 year career,0.02728990837931633,0.07546091824769974,0.8972492218017578,28/01/2015,5815
410,israeli opposition takes aim at netanyahu over planned speech to congress,0.01717756874859333,0.885116457939148,0.09770594537258148,28/01/2015,5813
411,sundance 2015 writers made photogenic crazy tales made poignant,0.04146959260106087,0.06732837855815887,0.8912020921707153,28/01/2015,6040
412,new cruises for single travelers,0.23760484158992767,0.010286668315529823,0.7521084547042847,28/01/2015,6041
413,missing bare chested celtic god last seen in northern ireland,0.04563238099217415,0.10662085562944412,0.847746729850769,28/01/2015,5811
414,seahawks pete carroll allows marshawn lynch to be himself,0.02794545888900757,0.04160560667514801,0.9304490089416504,28/01/2015,5810
415,reader idea student opinion questions as e l l writing prompts,0.03525010496377945,0.04144557937979698,0.9233042597770691,28/01/2015,6044
