,Headline,Positive,Negative,Neutral,date,article_id
411,versace fall 2015 rtw,0.06220861151814461,0.021088125184178352,0.9167032837867737,27/02/2015,13122
412,ted cruz and jeb bush on pot,0.041195087134838104,0.028028450906276703,0.9307764768600464,27/02/2015,13124
413,How a Bill Becomes a Law Or Not,0.025037234649062157,0.04118530452251434,0.9337775111198425,27/02/2015,13127
414,20150227POD,0.03344423323869705,0.044225212186574936,0.9223304986953735,27/02/2015,13132
415,feb 27 2015 pictures of the day,0.0379907563328743,0.04342098534107208,0.9185882806777954,27/02/2015,13133
416,27chicago callout,0.04559045284986496,0.09248500317335129,0.8619245290756226,27/02/2015,13142
417,27scene versace,0.05581500008702278,0.021315861493349075,0.922869086265564,27/02/2015,13144
418,milan fashion week versace fall winter 2015,0.044665537774562836,0.049457479268312454,0.9058769345283508,27/02/2015,13146
419,cpac reception is mixed for jeb bush despite bused in backers,0.014285242184996605,0.9583353400230408,0.02737945318222046,27/02/2015,13112
420,house of cards season 3 episode 4 recap solicitor general blues,0.023790014907717705,0.07936912775039673,0.8968408703804016,27/02/2015,13147
421,how serious was the brooklyn isis plot,0.03815731406211853,0.6047020554542542,0.35714057087898254,27/02/2015,13161
422,what were reading 33,0.033567413687705994,0.060802049934864044,0.9056304693222046,27/02/2015,13165
423,uber driver database breached by someone outside company,0.009479246102273464,0.9312427043914795,0.05927806347608566,27/02/2015,13167
424,20150227 lens barker,0.04117527976632118,0.028672808781266212,0.9301519393920898,27/02/2015,13180
425,in iowa a new john wayne museum,0.09400014579296112,0.01610456593334675,0.8898953199386597,27/02/2015,13185
426,friday night music forever young,0.04056861624121666,0.04099150747060776,0.9184398651123047,27/02/2015,13187
427,british bit of headwear,0.06907996535301208,0.05504022538661957,0.8758798837661743,27/02/2015,13210
428,for net neutrality advocates a moment to celebrate,0.11754953861236572,0.016829298809170723,0.8656211495399475,27/02/2015,13215
429,ryder ripps on putting virtual reality into a box,0.04630950838327408,0.025752848014235497,0.9279376268386841,27/02/2015,13219
430,venmo was ordered in july by california regulators to address security issues,0.03952285274863243,0.32835716009140015,0.63211989402771,27/02/2015,13220
431,RUNNERS,0.09729747474193573,0.049693427979946136,0.853009045124054,27/02/2015,13226
432,your passwords revealed,0.027155719697475433,0.03731295093894005,0.9355313181877136,27/02/2015,15426
433,20150227nytnow hoodslam,0.02703273668885231,0.03473858907818794,0.9382286667823792,27/02/2015,13378
434,27NYTNOW EVENINGSS,0.03199658915400505,0.08798132836818695,0.8800220489501953,27/02/2015,13148
435,don johnson a yankees sensation who fizzled out dies at 88,0.05356074869632721,0.09861383587121964,0.8478253483772278,27/02/2015,13028
436,a dolly parton show makeover,0.04707872495055199,0.033679597079753876,0.9192416667938232,27/02/2015,13109
437,group backing netanyahu will air ad attacking hillary clinton,0.04430817440152168,0.022338369861245155,0.9333534836769104,27/02/2015,13107
438,etro fall 2015 rtw,0.03475036099553108,0.04412531480193138,0.921124279499054,27/02/2015,13032
439,is introversion still a liability in politics,0.03293941915035248,0.260529488325119,0.7065311074256897,27/02/2015,13036
440,at cpac rick perry remembers his memory loss of 2012,0.058782726526260376,0.157431498169899,0.7837857604026794,27/02/2015,13038
441,as rubio eyes white house floridian eyes his senate seat,0.05417664349079132,0.09410696476697922,0.8517163395881653,27/02/2015,13040
442,sophia ahrens etro model morph,0.05247349292039871,0.026980126276612282,0.9205464124679565,27/02/2015,13041
443,trust your matchmaking mother she only wants whats best,0.03694657236337662,0.02777051366865635,0.9352829456329346,27/02/2015,13043
444,01books_pod,0.051141440868377686,0.06742218136787415,0.8814364075660706,27/02/2015,13045
445,01books_pod blog,0.03253858536481857,0.046210650354623795,0.9212507605552673,27/02/2015,13047
446,20150228 NIMONY HP,0.04526558145880699,0.03712937608361244,0.9176051020622253,27/02/2015,13052
447,leonard nimoy spock of star trek dies at 83,0.030857712030410767,0.24259112775325775,0.7265511751174927,27/02/2015,13054
448,leonard nimoy was not only spock,0.050720445811748505,0.09261927008628845,0.8566603064537048,27/02/2015,13057
449,myth reality and the underground railroad,0.036535829305648804,0.046880777925252914,0.9165834188461304,27/02/2015,13059
450,milan fashion week fall 2015 giamba shoes,0.05655769631266594,0.06339677423238754,0.8800455331802368,27/02/2015,13061
451,tom sachs boomboxes,0.042596764862537384,0.04912934824824333,0.9082739353179932,27/02/2015,13108
452,my dad strict my daughters papa not so much,0.05112956464290619,0.060986682772636414,0.887883722782135,27/02/2015,13065
453,marco de vincenzo fall 2015 rtw,0.04252798855304718,0.030880829319357872,0.9265912175178528,27/02/2015,13068
454,milan fashion week marco de vincenzo fall winter 2015,0.039152976125478745,0.06826052814722061,0.8925864696502686,27/02/2015,13074
455,what were reading now 26,0.03062252514064312,0.06522314250469208,0.9041543006896973,27/02/2015,13076
456,rick santorum talking tough says u s needs wartime president,0.18145617842674255,0.07963282614946365,0.738910973072052,27/02/2015,13081
457,first draft video a conservative future,0.17338544130325317,0.015619883313775063,0.8109946846961975,27/02/2015,13082
458,f c c moves to free up community broadband services,0.22329841554164886,0.010213262401521206,0.7664883732795715,27/02/2015,13083
459,video reviews of 71 the hunting ground and maps to the stars,0.05587836727499962,0.02960222214460373,0.9145193696022034,27/02/2015,13084
460,inside the new york times book review elliot ackermans green on blue,0.054909251630306244,0.039280667901039124,0.9058101177215576,27/02/2015,13085
461,google unveils plan for new corporate campus,0.10609809309244156,0.012490118853747845,0.8814117312431335,27/02/2015,13087
462,leonard nimoy is remembered by a constellation from star trek and beyond,0.09512969851493835,0.03692467138171196,0.867945671081543,27/02/2015,13089
463,lupita oscar gown white gold dress rip mani cam fashion news,0.03506182134151459,0.04577571898698807,0.9191625118255615,27/02/2015,13097
464,house of cards season 3 episode 3 recap when men were men,0.028454599902033806,0.08546921610832214,0.8860761523246765,27/02/2015,13099
465,a chant that rand paul could get used to,0.23991705477237701,0.020396074280142784,0.7396868467330933,27/02/2015,13105
466,milan fashion week fall 2015 blumarine makeup,0.051844533532857895,0.04322144016623497,0.9049339890480042,27/02/2015,13066
467,house of cards season 3 episode 2 recap balancing the eggs,0.04864326864480972,0.0542915016412735,0.897065281867981,27/02/2015,12910
468,27scene vincenzo,0.04628712311387062,0.0238165445625782,0.929896354675293,27/02/2015,13073
469,review in bluebird momentary distraction sets off a chain of misery,0.10802043974399567,0.3627626597881317,0.5292169451713562,27/02/2015,12853
470,zuckerman says he will explore selling daily news,0.050886135548353195,0.016964184120297432,0.9321497082710266,27/02/2015,12749
471,27NOTTHEKNICKS,0.03423885628581047,0.05049626901745796,0.915264904499054,27/02/2015,12751
472,ernest cote canada,0.06296288222074509,0.047295670956373215,0.8897414803504944,27/02/2015,12843
473,review in 71 young green and behind enemy lines,0.046779364347457886,0.06293879449367523,0.8902818560600281,27/02/2015,12842
474,alex rodriguez is back on the field with the yankees,0.11533602327108383,0.025003114715218544,0.8596609234809875,27/02/2015,12716
475,senate panel clears auto safety bill to reward whistle blowers,0.3186812996864319,0.1152050644159317,0.5661135911941528,27/02/2015,12841
476,spare times for children for feb 27 march 5,0.02830865979194641,0.06981450319290161,0.9018768072128296,27/02/2015,12840
477,review the new york philharmonic celebrates the chinese new year,0.08769010007381439,0.045979976654052734,0.8663298487663269,27/02/2015,12713
478,the city tournament for the city game,0.054781097918748856,0.02097751758992672,0.9242413640022278,27/02/2015,12752
479,american express turns to its core customers the affluent,0.21493488550186157,0.007776129525154829,0.7772890329360962,27/02/2015,12739
480,review in the lazarus effect young scientists play god,0.05109541118144989,0.03254684433341026,0.916357696056366,27/02/2015,12837
481,museum gallery listings for feb 27 march 5,0.020604507997632027,0.08026139438152313,0.89913409948349,27/02/2015,12835
482,dance listings for feb 27 march 5,0.02158825471997261,0.07108350098133087,0.9073282480239868,27/02/2015,12834
483,pentagon looking for edge in the future checks in with silicon valley,0.3216416835784912,0.018987465649843216,0.6593708395957947,27/02/2015,12759
484,opera classical music listings for feb 27 march 5,0.024080125615000725,0.04332628846168518,0.9325935244560242,27/02/2015,12833
485,jazz listings for feb 27 march 5,0.026991434395313263,0.05211006850004196,0.9208984971046448,27/02/2015,12832
486,spare times listings for feb 27 march 5,0.022255251184105873,0.07743526995182037,0.9003094434738159,27/02/2015,12838
487,review joey arias incarnates billie holiday in the american songbook,0.07134473323822021,0.051776401698589325,0.8768788576126099,27/02/2015,12760
488,once upon a time in italy milan fashion week 2015,0.0550164170563221,0.03565886616706848,0.9093247652053833,27/02/2015,12711
489,20150227ALDUS,0.0379929393529892,0.028920723125338554,0.9330863952636719,27/02/2015,12561
490,rebels accuse saudis of inciting unrest to divide yemen,0.022872140631079674,0.8711599111557007,0.10596798360347748,27/02/2015,12859
491,judge in batistas insider trading trial in brazil is removed from case,0.017750224098563194,0.7599501609802246,0.22229966521263123,27/02/2015,12858
492,review young bodies heal quickly follows brothers on the run,0.2139526754617691,0.036719195544719696,0.749328076839447,27/02/2015,12857
493,global deal to release new albums on fridays,0.34141528606414795,0.010003088042140007,0.6485816240310669,27/02/2015,12856
494,review in eastern boys a train station pickup gone wrong,0.0604996532201767,0.6376621127128601,0.3018382787704468,27/02/2015,12855
495,in unusual step regulators invite public to open meeting on bank merger,0.054879531264305115,0.03147967904806137,0.9136408567428589,27/02/2015,12854
496,canada survivor of home invasion dies,0.0808747261762619,0.5501553416252136,0.36896994709968567,27/02/2015,12849
497,california convicts are out of prison after third strike and staying out,0.02437598444521427,0.8500972390174866,0.1255267709493637,27/02/2015,12709
498,review in the salvation a hero lays waste western style danish too,0.0733446404337883,0.09215284138917923,0.8345025181770325,27/02/2015,12847
499,senate panel votes to approve loretta lynch as attorney general,0.278205007314682,0.04442426189780235,0.6773707270622253,27/02/2015,12699
