,Headline,Positive,Negative,Neutral,date,article_id
416,28DYNASTY_show,0.047430235892534256,0.03870236873626709,0.9138673543930054,28/01/2015,5809
417,houthi leader blames separatists in south yemen for political stalemate,0.013967268168926239,0.9246916770935059,0.061340995132923126,28/01/2015,5808
418,below the line visual effects of guardians of the galaxy,0.03630232438445091,0.06487981975078583,0.8988178968429565,28/01/2015,6033
419,shutting down new yorks subways is very expensive,0.009810945950448513,0.8988900184631348,0.09129896759986877,28/01/2015,5807
420,how 2014s huge market moves are affecting the economy in 2015,0.027331791818141937,0.5818073153495789,0.3908608555793762,28/01/2015,5801
421,obama plan calls for oil and gas drilling in the atlantic,0.1937984824180603,0.008724047802388668,0.7974774837493896,28/01/2015,5800
422,fidel castro breaks silence over thaw in us cuba relations,0.09941659867763519,0.5621092319488525,0.33847418427467346,28/01/2015,5799
423,28childrens,0.025472085922956467,0.09122253209352493,0.8833053708076477,28/01/2015,6045
424,a food sisterhood flourishes in north carolina,0.11686228215694427,0.021636992692947388,0.8615006804466248,28/01/2015,5795
425,20150128 CAROLINA,0.03069639950990677,0.05386463552713394,0.9154390096664429,28/01/2015,5794
426,from buzz to bombs a dispatch from the sundance film festival,0.031190212815999985,0.0406440868973732,0.9281657338142395,28/01/2015,6046
427,jams to join the california cooking comeback,0.09175952523946762,0.03607677295804024,0.8721636533737183,28/01/2015,5787
428,isis threatens kenji goto and moaz al kasabeh,0.015585615299642086,0.7692480087280273,0.21516641974449158,28/01/2015,5786
429,28firstdraft crowley,0.032098375260829926,0.045881565660238266,0.9220200777053833,28/01/2015,6049
430,whitewashing the crazy fed edition,0.04470249265432358,0.12813904881477356,0.827158510684967,28/01/2015,6050
431,verbatim scott walker on being boring,0.048320624977350235,0.04917891323566437,0.9025004506111145,28/01/2015,6051
432,sheldon silver to be replaced as speaker of new york state assembly,0.01779080741107464,0.6695586442947388,0.312650591135025,28/01/2015,5806
433,restaurant review blue smoke and north end grill,0.03621570020914078,0.02668341062963009,0.9371009469032288,28/01/2015,5820
434,another standardized test this time of citizenship,0.06066039204597473,0.01827682927250862,0.9210628271102905,28/01/2015,6032
435,keystone pipeline votes add wrinkle to lynch hearing,0.02062676101922989,0.9191791415214539,0.060194116085767746,28/01/2015,6030
436,obama will drop proposal to end 529 college savings plans,0.01773614063858986,0.7798656821250916,0.20239822566509247,28/01/2015,5857
437,angelina jolie on the syrians and iraqis who cant go home,0.028086388483643532,0.22035057842731476,0.7515630125999451,28/01/2015,5855
438,parsons dance performs at the joyce theater,0.04613978788256645,0.03987232223153114,0.9139878749847412,28/01/2015,5854
439,timbuktu an abderrahmane sissako film about radical islam,0.07345419377088547,0.044556040316820145,0.8819897174835205,28/01/2015,5851
440,apple quarterly earnings,0.025099661201238632,0.09166114777326584,0.8832391500473022,28/01/2015,5848
441,1915 telephone call across america,0.08509600907564163,0.016599709168076515,0.898304283618927,28/01/2015,6016
442,smithsonian considers opening london location,0.07918006181716919,0.014556185342371464,0.9062637090682983,28/01/2015,5845
443,kazuo shiraga foot painter gutai art,0.04535342752933502,0.052313558757305145,0.9023329615592957,28/01/2015,6112
444,shake shack pumps up i p o to 95 million,0.33618301153182983,0.011829150840640068,0.6519878506660461,28/01/2015,6018
445,yahoo earnings alibaba spinoff,0.020381523296236992,0.23616795241832733,0.7434505224227905,28/01/2015,5841
446,suits usas dramedy about corporate lawyers,0.031723666936159134,0.10318692028522491,0.865089476108551,28/01/2015,5837
447,firefight kills 4 in kashmir,0.033557504415512085,0.8290305137634277,0.13741205632686615,28/01/2015,5836
448,the americans returns to fx with season 3,0.09785003960132599,0.013139689341187477,0.8890102505683899,28/01/2015,5834
449,ben franklins bones on pbs illuminates grave robbing,0.03229411691427231,0.05577167123556137,0.9119341969490051,28/01/2015,5833
450,sorority support for lynch,0.3025684952735901,0.09218385815620422,0.6052476167678833,28/01/2015,6019
451,kathryn garcia new york sanitation commissioner faced first major test,0.042419932782649994,0.06855554133653641,0.889024555683136,28/01/2015,5830
452,36 hours belfast interactive map,0.03768669813871384,0.033613868057727814,0.9286994934082031,28/01/2015,6020
453,a push for a greater government role in housing finance,0.3643917739391327,0.01143825426697731,0.6241699457168579,28/01/2015,6024
454,regulators crack down on marketers of unlimited data plans,0.012845066376030445,0.8889604806900024,0.09819450229406357,28/01/2015,6025
455,jan 28 2015 pictures of the day,0.04042728245258331,0.05223364010453224,0.9073390364646912,28/01/2015,6109
456,snowstorms forecasters were mostly right,0.053011905401945114,0.24228952825069427,0.7046985626220703,28/01/2015,5825
457,jean paul gaultier spring 2015 couture,0.04535061493515968,0.04722585901618004,0.9074235558509827,28/01/2015,6026
458,a way to hasten bank reform in greece,0.21312566101551056,0.013703903183341026,0.7731704115867615,28/01/2015,6027
459,questions about blown blizzard forecasts and the gender of blizzard forecasters,0.021225910633802414,0.1756768822669983,0.8030971884727478,28/01/2015,6028
460,rand paul and ted cruz join forces against the fed,0.14549781382083893,0.26350879669189453,0.5909934043884277,28/01/2015,6029
461,s o s poems 1961 2013 works by amiri baraka,0.10180947184562683,0.05120643228292465,0.8469840288162231,28/01/2015,5822
462,aer lingus deal could spur airline consolidation in europe,0.8946020007133484,0.019906258210539818,0.08549175411462784,28/01/2015,5821
463,ok go video and volcano journey make the cut for drone film festival,0.03876208886504173,0.037783168256282806,0.9234547019004822,28/01/2015,6053
464,my name is hmmm a french road movie,0.041602205485105515,0.05567624792456627,0.9027215838432312,28/01/2015,5858
465,momofuku milk bar pops up,0.11749190092086792,0.029804475605487823,0.8527035713195801,28/01/2015,5553
466,20150128POD,0.031382203102111816,0.049182116985321045,0.9194357395172119,28/01/2015,6108
467,snow storm new england,0.03429089114069939,0.5583464503288269,0.407362699508667,28/01/2015,5724
468,signs for hope in basels bank regulation agenda,0.7388525009155273,0.01717507839202881,0.24397240579128265,28/01/2015,6082
469,india on a griddle a savory dosa recipe worth the effort,0.3053293824195862,0.023226844146847725,0.6714438199996948,28/01/2015,4957
470,28viktor rolf,0.06267626583576202,0.032741524279117584,0.9045822024345398,28/01/2015,6103
471,officer shoots man holding woman at knife point in lower manhattan police say,0.033236924558877945,0.6938153505325317,0.27294766902923584,28/01/2015,5723
472,house hearing iran nuclear talks sanctions,0.051500845700502396,0.12742282450199127,0.8210762739181519,28/01/2015,5720
473,king charles iii a hit in london is aiming at broadway,0.14920292794704437,0.02681688964366913,0.8239802122116089,28/01/2015,6085
474,thom browne and saint laurent mens fashion fall 2015,0.03092239238321781,0.04217981919646263,0.9268978238105774,28/01/2015,5716
475,flydubai jet hit by gunfire as it lands at baghdad airport,0.0180071871727705,0.9361971020698547,0.04579572379589081,28/01/2015,5715
476,natalie portman makes her couture debut at dior,0.09596167504787445,0.019656121730804443,0.8843821883201599,28/01/2015,5714
477,ulyana sergeenko couture beauty advice,0.029914719983935356,0.04246682673692703,0.9276185035705566,28/01/2015,6089
478,beppe severgnini gomorrah italys criminally great tv show,0.09831912815570831,0.10258638113737106,0.7990944981575012,28/01/2015,5711
479,islamic state tripoli libya terror attack,0.027764704078435898,0.5887701511383057,0.38346514105796814,28/01/2015,5726
480,new york blizzard,0.035343557596206665,0.04204939678311348,0.9226070642471313,28/01/2015,5710
481,patrick chappatte on the greek election,0.05884751304984093,0.04204469174146652,0.8991077542304993,28/01/2015,5709
482,obama ends visit with challenge to india on climate change,0.19241438806056976,0.05905740335583687,0.7485281825065613,28/01/2015,5704
483,siemens quarterly profit down 25 on weak economy and lower oil prices,0.011202198453247547,0.9716733694076538,0.017124397680163383,28/01/2015,5703
484,france counterterrorism raid,0.03448590263724327,0.12256617099046707,0.8429479002952576,28/01/2015,5701
485,alexander litvinenko robert owen britain inquiry,0.0849752128124237,0.03686811029911041,0.8781566619873047,28/01/2015,5686
486,paris couture week viktor rolf spring summer 2015,0.03345174714922905,0.06754552572965622,0.899002730846405,28/01/2015,6101
487,sharapova romps into australian open semifinals,0.10807257145643234,0.13895657658576965,0.7529709339141846,28/01/2015,5682
488,australian open rafael nadal tomas berdych,0.03690167888998985,0.03282361477613449,0.9302747249603271,28/01/2015,5681
489,documents show nsas wiretap moves before congresss approval,0.03107338957488537,0.06105417758226395,0.9078724384307861,28/01/2015,5678
490,charles blow reducing our obscene level of child poverty,0.2605172395706177,0.17855572700500488,0.5609270334243774,28/01/2015,5947
491,walkabout tourism in tripoli creates optimism,0.9022975564002991,0.04018145799636841,0.057520996779203415,28/01/2015,6100
492,adoptees sought their roots and readers reacted,0.060988765209913254,0.018158800899982452,0.9208523631095886,28/01/2015,6091
493,referees and underinflated footballs,0.019236396998167038,0.3169536292552948,0.6638100147247314,28/01/2015,6090
494,obama leading a high powered delegation to saudi arabia,0.16909246146678925,0.012091964483261108,0.8188155293464661,28/01/2015,5676
495,expensive drugs work better than cheap ones,0.14891143143177032,0.018289990723133087,0.8327985405921936,28/01/2015,6078
496,paris couture hair viktor rolf spring summer 2015,0.040774956345558167,0.05059061199426651,0.9086344838142395,28/01/2015,6075
497,workers at londons national gallery plan five day strike,0.022195691242814064,0.6057971715927124,0.3720071315765381,28/01/2015,6058
498,perfectly reasonable questions gender of letter writers,0.05050067603588104,0.04182372987270355,0.907675564289093,28/01/2015,6059
499,1890 horrible sufferings at sea,0.033369291573762894,0.7661246061325073,0.2005060762166977,28/01/2015,6060
