,Headline,Positive,Negative,Neutral,date,article_id
413,smartphones dont make us dumb,0.04869857802987099,0.03910622373223305,0.9121952056884766,21/01/2015,4210
414,did patriots deflate footballs nfl analyst casts doubt,0.051168300211429596,0.04409968480467796,0.9047319889068604,21/01/2015,4129
415,photos show mohamed soltan american held in egypt badly bruised and ill,0.04625803232192993,0.7944112420082092,0.15933066606521606,21/01/2015,4180
416,new york today snow but not like last years,0.10195451229810715,0.0670914500951767,0.8309540152549744,21/01/2015,4296
417,beijing investigating detention of 100 chinese in myanmar,0.02691049687564373,0.8717288374900818,0.10136059671640396,21/01/2015,4022
418,anne hathaway and julie taymor team up for grounded,0.04160766676068306,0.020399941131472588,0.9379924535751343,21/01/2015,4452
419,20150121 lens pod,0.03419504687190056,0.032602909952402115,0.9332020282745361,21/01/2015,4453
420,kinder morgan to buy oil pipeline company from harold hamm for 3 billion,0.10268189013004303,0.010146534070372581,0.8871715664863586,21/01/2015,4454
421,free of gluten but not of arsenic or of guilt,0.04998529702425003,0.02635464072227478,0.9236600995063782,21/01/2015,4456
422,jan 21 2015 pictures of the day,0.04106331244111061,0.05298827588558197,0.9059484601020813,21/01/2015,4459
423,next question please,0.03213772177696228,0.05355829745531082,0.9143039584159851,21/01/2015,4376
424,bankers raise concerns about impact of end of easy money policies,0.01937822438776493,0.9340384602546692,0.04658333212137222,21/01/2015,4375
425,a cocktail week for paris,0.11401528865098953,0.050031136721372604,0.8359535336494446,21/01/2015,4374
426,thirty minute interview helmut jahn,0.03145230934023857,0.03267689049243927,0.9358708262443542,21/01/2015,4187
427,animals suffer in meat industry profit quest reporters notebook,0.05574105307459831,0.8267890810966492,0.11746985465288162,21/01/2015,4372
428,0121NYTNOW EVENINGSS,0.024673942476511,0.05306755006313324,0.9222584962844849,21/01/2015,4467
429,twitter now helps you catch up on missed tweets,0.05516994744539261,0.024467702955007553,0.9203624129295349,21/01/2015,4468
430,from gluten free beer to kombucha alcohol options for health conscious drinkers,0.11963950842618942,0.011089562438428402,0.869270920753479,21/01/2015,4190
431,new york attorney general adds to lawsuit over barclays dark pool,0.021390734240412712,0.8964958786964417,0.08211341500282288,21/01/2015,4470
432,this is your grandmother,0.04655367136001587,0.03129592910408974,0.9221503138542175,21/01/2015,4471
433,holding the democratic convention in brooklyn fuhgeddaboudit,0.0510140098631382,0.029625291004776955,0.9193606376647949,21/01/2015,4370
434,all about the middle class obamas goal for the speech,0.07572852075099945,0.0227049607783556,0.9015665650367737,21/01/2015,4191
435,color guard is david byrnes new project yes color guard,0.03465654328465462,0.02423853799700737,0.9411048889160156,21/01/2015,4349
436,state of the union state of the presidency,0.0637885257601738,0.03790885582566261,0.8983026742935181,21/01/2015,4351
437,20 wines for under 20 dollars,0.06192876026034355,0.029637852683663368,0.9084333777427673,21/01/2015,3084
438,how warmest ever headlines and debates can obscure what matters about climate change,0.045418765395879745,0.037261396646499634,0.9173198342323303,21/01/2015,4355
439,22FIRE_ss,0.04900543764233589,0.060285162180662155,0.8907093405723572,21/01/2015,4356
440,tell me your party and ill tell you how you feel,0.02233830839395523,0.060736265033483505,0.9169254302978516,21/01/2015,4359
441,reading the times with phil klay,0.042101141065359116,0.0430021658539772,0.9148966670036316,21/01/2015,4451
442,1940 russians abandon positions,0.05914636328816414,0.40689486265182495,0.5339587926864624,21/01/2015,4360
443,washingtons role in oil prices recent fall,0.05038325861096382,0.02836395986378193,0.9212527871131897,21/01/2015,4193
444,montclairs city suburb conflict surfaces in new developments,0.02363164722919464,0.8410520553588867,0.13531626760959625,21/01/2015,4192
445,when should antiquities be repatriated to their country of origin,0.02233576402068138,0.04763238504528999,0.9300318360328674,21/01/2015,4479
446,a kinder gentler investor activism,0.23498527705669403,0.03325563669204712,0.7317590713500977,21/01/2015,4365
447,hillary clinton gives her own state of the union,0.048322126269340515,0.02353198267519474,0.9281459450721741,21/01/2015,4477
448,dropbox buys cloudon a microsoft document start up,0.07454348355531693,0.013439408503472805,0.9120170474052429,21/01/2015,4368
449,Euro Style Bond Buying,0.04655260220170021,0.021001972258090973,0.9324454069137573,21/01/2015,4361
450,when measles spreads from disneyland its a small world after all,0.09616050124168396,0.035514917224645615,0.8683246374130249,21/01/2015,4450
451,classical playlist puccini mendelssohn wagner and more,0.036940038204193115,0.03965141624212265,0.923408567905426,21/01/2015,4380
452,protesters stage die in at capitol,0.04040442779660225,0.7320175766944885,0.22757799923419952,21/01/2015,4448
453,20150121 IHH,0.03678498789668083,0.033685728907585144,0.9295293092727661,21/01/2015,4188
454,nfl investigation patriots deflated footballs,0.024621671065688133,0.6780329346656799,0.2973453402519226,21/01/2015,4420
455,a theme at davos fear of financial instability,0.024497399106621742,0.5903963446617126,0.38510623574256897,21/01/2015,4419
456,have questions about winter cooking,0.028736254200339317,0.13652847707271576,0.8347352743148804,21/01/2015,4418
457,below the line shooting the grand budapest hotel,0.02958822436630726,0.04112209007143974,0.929289698600769,21/01/2015,4396
458,QUEENMARY_SS,0.04885105788707733,0.03051360510289669,0.9206352829933167,21/01/2015,4416
459,uber closes a 1 6 billion financing,0.11018024384975433,0.03815082460641861,0.8516688942909241,21/01/2015,4423
460,belgian artists painting infringes upon photographers work court rules,0.01255007553845644,0.842693567276001,0.14475643634796143,21/01/2015,4413
461,whats on tv wednesday,0.028089022263884544,0.053683921694755554,0.9182270169258118,21/01/2015,4411
462,flaunting guns in the washington statehouse,0.0503939613699913,0.057596705853939056,0.8920093178749084,21/01/2015,4410
463,where is the governor of georgia his office wont say,0.025078777223825455,0.048790737986564636,0.9261304140090942,21/01/2015,4408
464,predictions pet peeves and random musings from davos,0.026490023359656334,0.2117263525724411,0.7617835998535156,21/01/2015,4406
465,credit suisse previews effect of rise in swiss franc on profit,0.3697485327720642,0.36018696427345276,0.27006447315216064,21/01/2015,4405
466,live cuomo delivers state of the state address,0.05669598653912544,0.027421513572335243,0.9158824682235718,21/01/2015,4403
467,amid the chattering of the global elite a silent interlude,0.1553145796060562,0.13084684312343597,0.713838517665863,21/01/2015,4412
468,rare alan turing document outlining mathematical thought to be auctioned,0.06910602748394012,0.021825507283210754,0.9090684056282043,21/01/2015,4496
469,first draft focus a dusting for washington,0.04804026708006859,0.01748577691614628,0.9344739317893982,21/01/2015,4424
470,ideas for e l l s teaching about weather and seasons,0.04906410723924637,0.021800871938467026,0.9291350245475769,21/01/2015,4426
471,a plan for a chapel in chile is based on designs by gaud,0.0681408941745758,0.015394536778330803,0.9164645671844482,21/01/2015,4381
472,venture capital outpaces buyouts in investment returns,0.6652297973632812,0.038981806486845016,0.295788437128067,21/01/2015,4384
473,in williamsburg a wedding salon for very brooklyn brides,0.08864420652389526,0.027427682653069496,0.883928120136261,21/01/2015,4444
474,new paris boutique small x japan,0.06801161915063858,0.02013305015861988,0.9118553400039673,21/01/2015,4385
475,cannes winners selected for new directorsnew films,0.06396810710430145,0.03787609934806824,0.8981558084487915,21/01/2015,4386
476,meghan trainor opens at no 1,0.20318667590618134,0.029570994898676872,0.7672422528266907,21/01/2015,4441
477,paris mens fashion week christophe lemaire fall winter 2015,0.035206206142902374,0.0959634855389595,0.8688303232192993,21/01/2015,4425
478,36 hours denver interactive map,0.029201358556747437,0.04196305572986603,0.9288356304168701,21/01/2015,4389
479,spacex is a throwback to the 1990s,0.06686875969171524,0.04791008308529854,0.8852211833000183,21/01/2015,4436
480,reid to have eye surgery on monday,0.07186225056648254,0.5609686970710754,0.3671690821647644,21/01/2015,4435
481,a drink a day to lower heart failure risk,0.20417863130569458,0.017567327246069908,0.7782540321350098,21/01/2015,4434
482,rubio treads carefully on another romney run,0.13720820844173431,0.10291000455617905,0.7598817348480225,21/01/2015,4433
483,21scene lemaire,0.04155286028981209,0.05464404076337814,0.9038031101226807,21/01/2015,4432
484,new plays by churchill shawn will be part of national theater season,0.10426157712936401,0.012956040911376476,0.8827823996543884,21/01/2015,4430
485,recent commercial transactions,0.024882541969418526,0.04174041002988815,0.9333770871162415,21/01/2015,4189
486,verbatim biden on the patriots scandal,0.1080559715628624,0.02613344043493271,0.8658105134963989,21/01/2015,4347
487,argentine leader criticizes alberto nisman dead prosecutor,0.03681625425815582,0.8579022884368896,0.10528142750263214,21/01/2015,4214
488,obama heads west after his address,0.09384471923112869,0.06438124924898148,0.8417739868164062,21/01/2015,4344
489,biden opens door to clinton challenge,0.2539716362953186,0.05577479302883148,0.6902536153793335,21/01/2015,4315
490,document bostons 2024 olympic bid,0.10407503694295883,0.020122667774558067,0.8758023381233215,21/01/2015,4537
491,daily clip report 106,0.02638065256178379,0.05806851014494896,0.9155508279800415,21/01/2015,4314
492,20150121 lens romania,0.03259288892149925,0.039682820439338684,0.9277242422103882,21/01/2015,4499
493,decoder ring for short,0.0335065983235836,0.04455298185348511,0.9219404458999634,21/01/2015,4540
494,the state of the style union,0.06427495181560516,0.06495506316423416,0.8707699775695801,21/01/2015,4313
495,keystone debate leads to some table talk,0.11975505948066711,0.018203727900981903,0.8620412349700928,21/01/2015,4311
496,north korea uses defectors partial retraction to lash out at washington,0.022277003154158592,0.8792347311973572,0.09848825633525848,21/01/2015,4000
497,stressed at work try a lunchtime walk,0.06380517780780792,0.6467475295066833,0.2894473075866699,21/01/2015,4309
498,6 qs about the news in state of the union speech obama defiantly sets an ambitious agenda,0.28983402252197266,0.021784991025924683,0.688381016254425,21/01/2015,4307
499,peter hessler china daily article,0.05122755840420723,0.04150201007723808,0.9072704315185547,21/01/2015,4305
