,Headline,Positive,Negative,Neutral,date,article_id
211,20NYTNOW EVENINGSS,0.029472993686795235,0.08543320745229721,0.8850938677787781,20/01/2015,4184
212,daily report a seismic political shift in the net neutrality debate,0.24633008241653442,0.2502302825450897,0.5034396052360535,20/01/2015,4011
213,how xbox could help microsoft and windows 10,0.15676869451999664,0.011637487448751926,0.8315938115119934,20/01/2015,4185
214,xi gets a raise but beijing apartments still out of his reach,0.0512269102036953,0.37979447841644287,0.5689786672592163,20/01/2015,4009
215,new york today airbnb debates,0.05368562415242195,0.019312001764774323,0.9270024299621582,20/01/2015,4008
216,as i lay lying the web fixes faulkner,0.027739612385630608,0.04779001697897911,0.9244703650474548,20/01/2015,4006
217,latest news state of the union the colorado trial american sniper,0.05841303616762161,0.07035250961780548,0.8712344765663147,20/01/2015,4004
218,european official urges google to offer greater concessions in antitrust inquiry,0.8954914808273315,0.020214824005961418,0.08429376780986786,20/01/2015,4003
219,what america thinks of the 2015 state of the union address,0.039028242230415344,0.044890813529491425,0.9160809516906738,20/01/2015,4186
220,today in politics 78,0.06116073951125145,0.024450089782476425,0.9143891334533691,20/01/2015,4012
221,millennials set to outnumber baby boomers,0.2595991790294647,0.026697847992181778,0.7137029767036438,20/01/2015,3894
222,chip maker to review options,0.02478695847094059,0.04646230861544609,0.92875075340271,20/01/2015,4026
223,roberto cavalli fall 2015 menswear,0.04327978193759918,0.06960523873567581,0.8871150016784668,20/01/2015,4028
224,in vienna a new pass to see the sights,0.3315454423427582,0.012034095823764801,0.6564204096794128,20/01/2015,4159
225,mark ronson michael chabon uptown special,0.035368531942367554,0.085462287068367,0.8791691064834595,20/01/2015,4160
226,20scene armani,0.08498311042785645,0.044456999748945236,0.8705598711967468,20/01/2015,4049
227,how your facebook likes could cost you a job,0.030654262751340866,0.6538808941841125,0.3154648542404175,20/01/2015,4048
228,milan mens fashion week giorgio armani fall winter 2015,0.038701195269823074,0.07787976413965225,0.8834190368652344,20/01/2015,4047
229,20150120POD,0.03067261353135109,0.0533716157078743,0.9159557819366455,20/01/2015,4163
230,hong kong tycoon li ka shing to buy british passenger train provider,0.2283610701560974,0.011943992227315903,0.7596949338912964,20/01/2015,4046
231,1890 prince bismarcks policy,0.047677814960479736,0.03261842578649521,0.9197037816047668,20/01/2015,4045
232,the gucci reality tv show,0.04172907769680023,0.04737630486488342,0.9108946323394775,20/01/2015,4027
233,among snowden leaks details of chinese cyberespionage,0.02700609527528286,0.17315411567687988,0.7998397946357727,20/01/2015,4044
234,jan 20 2015 pictures of the day,0.04272684082388878,0.05552259087562561,0.9017506241798401,20/01/2015,4164
235,a prisoner and his beard win at the supreme court,0.1832476407289505,0.37101486325263977,0.44573748111724854,20/01/2015,4165
236,obama to visit selma to commemorate marches,0.28986629843711853,0.027059750631451607,0.6830739378929138,20/01/2015,4169
237,that fake baby and other american sniper issues,0.02926703728735447,0.21275176107883453,0.7579811811447144,20/01/2015,4040
238,activist investor to step up push for a staples office depot merger,0.770443856716156,0.018345605581998825,0.21121062338352203,20/01/2015,4039
239,a run on arrack at the liquor store,0.09606509655714035,0.10928811877965927,0.7946467995643616,20/01/2015,4035
240,twitter acquires indian start up,0.15350207686424255,0.011481918394565582,0.8350159525871277,20/01/2015,4030
241,coinbase a bitcoin start up raises 75 million in vote of confidence,0.21679078042507172,0.00933764223009348,0.7738716006278992,20/01/2015,4029
242,sycamore ends its effort to acquire express,0.03471820801496506,0.21087725460529327,0.7544045448303223,20/01/2015,4041
243,russell wilson stands proudest in 2012 quarterback class,0.27014192938804626,0.021688370034098625,0.70816969871521,20/01/2015,3893
244,exposure offers clarity in the risky world of investing,0.17187125980854034,0.012734133750200272,0.8153946399688721,20/01/2015,4106
245,2015LivelyMorgueTumblr51b,0.0575304813683033,0.03431534022092819,0.9081541299819946,20/01/2015,4195
246,though we long for control chance plays a powerful role in the biology of cancer and the evolution of life,0.11528559029102325,0.010576563887298107,0.8741378784179688,20/01/2015,3882
247,amazon to start theatrical movie operation with a quick streaming tie in,0.21498772501945496,0.007515894249081612,0.7774964570999146,20/01/2015,3865
248,the top sports books from the new york times best seller list,0.05340014025568962,0.027333784848451614,0.9192660450935364,20/01/2015,3881
249,ex cuba captive and astronaut will be among guests at state of the union speech,0.06277530640363693,0.023936403915286064,0.9132882952690125,20/01/2015,3844
250,microscopy stretches limits of conventional microscopes,0.10534854978322983,0.03688026964664459,0.8577712178230286,20/01/2015,3880
251,max scherzer nationals place early bet that aces will bring october successs,0.5768696665763855,0.027069780975580215,0.3960604965686798,20/01/2015,3877
252,carmat artificial heart,0.10449928790330887,0.025681277737021446,0.8698194026947021,20/01/2015,3829
253,extreme migration geese hug the himalayas,0.10554726421833038,0.11721151322126389,0.7772412896156311,20/01/2015,3867
254,shareholders face quandary in battle for family dollar,0.0271840151399374,0.7922937273979187,0.18052218854427338,20/01/2015,4202
255,20OILPATCH,0.03541035205125809,0.037651754915714264,0.9269378781318665,20/01/2015,3883
256,complexities of choosing an end game for dementia,0.031868092715740204,0.03799126669764519,0.9301406145095825,20/01/2015,3869
257,chinese civilians said to be trapped by fighting in myanmar,0.03608289733529091,0.8580167889595032,0.1059003472328186,20/01/2015,3832
258,iran says one of its generals was killed in israeli strike in syria,0.029400832951068878,0.7797049880027771,0.19089417159557343,20/01/2015,3858
259,amir reza koohestanis timeloss at the public theater,0.04042530432343483,0.04518044739961624,0.9143942594528198,20/01/2015,3874
260,facebook knows you better than anyone else,0.059334706515073776,0.024796152487397194,0.9158691167831421,20/01/2015,3872
261,us support for syria peace plans demonstrates shift in priorities,0.6907749772071838,0.17947454750537872,0.12975053489208221,20/01/2015,3871
262,live coverage of the state of the union address,0.04176541417837143,0.017719170078635216,0.9405153393745422,20/01/2015,4201
263,accountable care organizations like hmos but different,0.025628527626395226,0.07053316384553909,0.9038382768630981,20/01/2015,3835
264,europe foreign ministers security terrorism,0.0315527580678463,0.057362738996744156,0.9110844731330872,20/01/2015,3837
265,in year 2 of affordable care act premiums diverge widely,0.0502614788711071,0.8237216472625732,0.12601688504219055,20/01/2015,3842
266,a lab is trying to keep china from dodging us tariffs on honey,0.10286428779363632,0.11808601021766663,0.7790497541427612,20/01/2015,3876
267,tom brady laughs at nfl inquiry into deflated footballs,0.04168648645281792,0.34915095567703247,0.6091625690460205,20/01/2015,3864
268,no college degree maybe you can still be president,0.0655047595500946,0.03761846944689751,0.8968768119812012,20/01/2015,3849
269,what a rise in obamas approval rating means for 2016,0.5012099742889404,0.015886269509792328,0.48290377855300903,20/01/2015,3870
270,with an eyesores demolition brooklyn loses a piece of history,0.08748624473810196,0.3567940890789032,0.5557196140289307,20/01/2015,3853
271,budapest festival orchestra plays avery fisher hall,0.036169733852148056,0.047525737434625626,0.9163045883178711,20/01/2015,3890
272,police chief arrested in turkey in murder of hrant dink,0.06970379501581192,0.672329843044281,0.25796636939048767,20/01/2015,3888
273,study suggests way to fight asian tiger mosquito,0.2530454695224762,0.01240575686097145,0.7345487475395203,20/01/2015,3862
274,max scherzer and nationals reach lucrative deal,0.8376351594924927,0.020376451313495636,0.14198829233646393,20/01/2015,3860
275,in texas hunkering down for the oil bust,0.032257139682769775,0.47164401412010193,0.4960988461971283,20/01/2015,3863
276,yemen houthi fighting,0.0468171127140522,0.5971789360046387,0.356003999710083,20/01/2015,3818
277,4 killed in clashes in northeastern india,0.027867987751960754,0.85964435338974,0.11248774826526642,20/01/2015,3891
278,indonesias execution of foreigners prompts diplomatic storm,0.013324374333024025,0.9414541721343994,0.04522137716412544,20/01/2015,3824
279,after police slowdown arrests and summonses continue to rise in new york,0.015180669724941254,0.9573935866355896,0.027425697073340416,20/01/2015,3892
280,chinese police kill 2 uighurs fleeing to vietnam reports say,0.02245091274380684,0.8961419463157654,0.0814070999622345,20/01/2015,3812
281,patriots vs seahawks super bowl symmetry,0.08138058334589005,0.04680003598332405,0.8718194365501404,20/01/2015,3857
282,alberto nisman found dead argentina amia,0.04568348452448845,0.4994674623012543,0.454848974943161,20/01/2015,3859
283,australian open tennis,0.03423413261771202,0.05672739818692207,0.9090384840965271,20/01/2015,3825
284,martin luther king day,0.05966440960764885,0.048750877380371094,0.8915846347808838,20/01/2015,3884
285,milan street style,0.030263224616646767,0.049727991223335266,0.9200087785720825,20/01/2015,4194
286,scalia lands at top of sarcasm index of justices shocking,0.17847776412963867,0.017567286267876625,0.8039550185203552,20/01/2015,3855
287,a sci fi inspired music video from a buzzy indie band,0.10541156679391861,0.038112178444862366,0.8564763069152832,21/01/2015,4271
288,resort looks with a masculine twist,0.15258796513080597,0.016964180395007133,0.8304478526115417,21/01/2015,4270
289,why joni ernst talked about her tough upbringing,0.05687595531344414,0.08928236365318298,0.8538416028022766,21/01/2015,4268
290,2 teenagers shot near brooklyn high school police say,0.035264987498521805,0.7966638803482056,0.16807107627391815,21/01/2015,4207
291,in afghanistan a tumultuous effort to select a cabinet,0.03699479252099991,0.809075653553009,0.15392959117889404,21/01/2015,4162
292,wolfblood from the bbc features young werewolves,0.07109533250331879,0.05491066351532936,0.8739939332008362,21/01/2015,4156
293,kenya schoolchildren tear gassing under investigation,0.021504871547222137,0.8579750061035156,0.12052004039287567,21/01/2015,4051
294,new texas governor greg abbott expected to continue on perrys path,0.10847097635269165,0.0821661651134491,0.8093628287315369,21/01/2015,4052
295,case on judicial campaign donations turns personal for justices,0.06808304786682129,0.3369893729686737,0.5949276089668274,21/01/2015,4161
296,obamas realistic aim changing the conversation not minds,0.08582514524459839,0.03685882315039635,0.8773159980773926,21/01/2015,4206
297,pope francis amuses and insults with remark on parenting,0.040265750139951706,0.24010494351387024,0.7196292877197266,21/01/2015,4205
298,isis has executed scores in iraq this month un says,0.038490843027830124,0.5775847434997559,0.3839243948459625,21/01/2015,4053
299,paris mayor plans to sue over news of no go zones,0.012652143836021423,0.9265762567520142,0.060771651566028595,21/01/2015,4266
300,lot of leather in morningside operas pergolesi power games,0.0768025666475296,0.02339521050453186,0.8998022675514221,21/01/2015,4158
301,james holmes jury selection begins in colorado theater shootings,0.02329588495194912,0.05369332432746887,0.9230107665061951,21/01/2015,4155
302,through art and forensics students give unknown victims an identity,0.05000583827495575,0.024541256949305534,0.9254529476165771,21/01/2015,4157
303,auto collectibles that you can wear,0.04047970846295357,0.018656522035598755,0.9408637881278992,21/01/2015,4054
304,for states 48 million to help cut emissions,0.4357743561267853,0.019333356991410255,0.5448923707008362,21/01/2015,4213
305,at ferragamo fendi and etro mens fashion 2015,0.09024584293365479,0.015247668139636517,0.8945064544677734,21/01/2015,4056
306,greeces tourism industry unsettled by talk in election campaign,0.015278332866728306,0.9538623690605164,0.030859341844916344,21/01/2015,4042
307,20150121 HUNGRY,0.03535512089729309,0.05088266357779503,0.9137622714042664,21/01/2015,3069
308,brawl disrupts drafting of constitution in nepal,0.01918722316622734,0.8638334274291992,0.11697932332754135,21/01/2015,4037
309,philadelphia union leader is convicted of extortion,0.038693562150001526,0.774658739566803,0.18664775788784027,21/01/2015,4176
310,mrs mayfields fifth grade class of 93 20 year reunion,0.08614987879991531,0.0252163615077734,0.8886337876319885,21/01/2015,4177
311,larry wilmore makes debut as comedy central host,0.060338061302900314,0.03661556541919708,0.9030463695526123,21/01/2015,4036
312,tom hewitt in another medea,0.06526213139295578,0.037361036986112595,0.8973768353462219,21/01/2015,4178
313,hungry city plant love house in elmhurst queens,0.04335446655750275,0.038624852895736694,0.9180207252502441,21/01/2015,3070
314,koch seminar is early proving ground for gop hopefuls,0.8405566215515137,0.014998359605669975,0.1444450467824936,21/01/2015,4038
315,the sun page 3 women,0.02635221742093563,0.05622859299182892,0.9174191951751709,21/01/2015,4031
316,21pour,0.03457508981227875,0.06096537038683891,0.904459536075592,21/01/2015,3083
317,david kynastons modernity britain 1957 1962,0.04929882287979126,0.03668823838233948,0.9140129685401917,21/01/2015,4179
318,test yourself snapchat stories,0.04686511307954788,0.03327542915940285,0.9198594689369202,21/01/2015,4286
319,obama urges congress not to leave a trade vacuum for china,0.08448197692632675,0.26885342597961426,0.646664559841156,21/01/2015,4287
320,why is binge drinking so common among young people in the united states,0.027876337990164757,0.39513319730758667,0.57699054479599,21/01/2015,4288
321,frank bruni college president obama and the common core,0.21123673021793365,0.07167056947946548,0.7170926928520203,21/01/2015,4203
322,a suspicious death in argentina,0.026187652722001076,0.7496026158332825,0.2242097705602646,21/01/2015,4284
323,word of the day transitory,0.19081881642341614,0.018937984481453896,0.7902432084083557,21/01/2015,4272
324,the verge to run ad during super bowl,0.05243802070617676,0.02216210961341858,0.9253998398780823,21/01/2015,4175
325,line drawn on purported corruption in calligraphy,0.04444819688796997,0.22818920016288757,0.7273625731468201,21/01/2015,4282
326,obama says family leave is an economic necessity not just a womens issue,0.042619455605745316,0.10734875500202179,0.8500317335128784,21/01/2015,4274
327,2 yemeni men are charged with conspiring to attack american soldiers,0.03785718232393265,0.6718326210975647,0.29031023383140564,21/01/2015,4204
328,cuomos education agenda sets battle lines with teachers unions,0.09629448503255844,0.04952182620763779,0.8541836738586426,21/01/2015,4043
329,police investigate death of man in midtown,0.03070024773478508,0.8182685971260071,0.15103121101856232,21/01/2015,4276
330,quotation of the day,0.03285898268222809,0.06459265947341919,0.9025484323501587,21/01/2015,4277
331,corrections january 21 2015,0.023040568456053734,0.059345684945583344,0.917613685131073,21/01/2015,4278
332,the woodsman tells the tin mans tale,0.05667876824736595,0.07624654471874237,0.867074728012085,21/01/2015,4174
333,on the town producers keep faith in their investment,0.12708453834056854,0.022825198248028755,0.8500902652740479,21/01/2015,4166
334,20150121 lens baby nytnow,0.05749709531664848,0.02668631263077259,0.915816605091095,21/01/2015,5059
335,iranian commander threatens thunderbolt against israel after generals death in airstrike,0.03691399097442627,0.7784745097160339,0.1846114993095398,21/01/2015,4170
336,nate wooleys for kenneth gaburo manipulates a sentence,0.031228143721818924,0.22192244231700897,0.7468494176864624,21/01/2015,4171
337,to a gamer minimalism is a virtue,0.04883258417248726,0.04999873787164688,0.901168704032898,21/01/2015,4172
338,italy goes global in search for museum directors,0.11148614436388016,0.020124057307839394,0.8683897852897644,21/01/2015,4173
339,totally tubular,0.22773276269435883,0.02638915739953518,0.7458781599998474,21/01/2015,4281
340,20150121 WYG,0.03297595679759979,0.06297240406274796,0.9040516018867493,21/01/2015,4168
341,jets hire chan gailey as offensive coordinator,0.08761107921600342,0.09367161989212036,0.8187172412872314,21/01/2015,4263
342,valentino fall 2015 menswear,0.05832590162754059,0.04422936588525772,0.8974447250366211,21/01/2015,4402
343,eating while driving brings a ticket in georgia,0.08488200604915619,0.024821555241942406,0.890296459197998,21/01/2015,4153
344,state of the union speech leaves questions about usefulness of unlikely goals,0.04749540239572525,0.4649812579154968,0.4875233769416809,21/01/2015,4225
345,cia report found value of brutal interrogation was inflated,0.058526020497083664,0.18599513173103333,0.7554789185523987,21/01/2015,4226
346,the personal and the political intersect,0.029778942465782166,0.05350201949477196,0.9167190194129944,21/01/2015,4227
347,republicans have one word for presidents proposals and veto threats no,0.027573805302381516,0.10797463357448578,0.8644515872001648,21/01/2015,4228
348,airasia jets climb before crash was unusually fast investigators say,0.2549450099468231,0.09003221988677979,0.6550227403640747,21/01/2015,4099
349,jets hiring of todd bowles leaves nfl far short of goal on diversity,0.012700330466032028,0.9437977075576782,0.043502017855644226,21/01/2015,4229
350,for freshmen congressmen presidents state of the union address is rite of passage,0.033341772854328156,0.03169615939259529,0.9349620938301086,21/01/2015,4224
351,obamas state of the union 2015 address,0.06001950800418854,0.02710961364209652,0.9128708839416504,21/01/2015,4230
352,tempering a worldview with freedom and fairness,0.07820490747690201,0.01710633747279644,0.9046887755393982,21/01/2015,4097
353,to invest or not as china shifts,0.049488361924886703,0.015566883608698845,0.9349448084831238,21/01/2015,4096
354,israel hamas gaza strip war investigation,0.03754720836877823,0.5055602192878723,0.4568924903869629,21/01/2015,4095
355,tournaments lawn is a place to knock the froth off,0.056218188256025314,0.10268571972846985,0.8410961031913757,21/01/2015,4232
356,family seeks release of a guantanamo detainee turned author,0.08774327486753464,0.5212283730506897,0.39102840423583984,21/01/2015,4233
357,cuomo proposes train link to la guardia airport,0.48107585310935974,0.012225543148815632,0.5066986680030823,21/01/2015,4090
358,state of the union biggest obstacle for obama is publics lack of attention,0.130681112408638,0.16422244906425476,0.705096423625946,21/01/2015,4231
359,reflections of a student protester who became a police sergeant,0.032602012157440186,0.288466215133667,0.6789317727088928,21/01/2015,4223
360,new party harnesses discontent in greece,0.049356602132320404,0.8764985203742981,0.07414481788873672,21/01/2015,4222
361,traces of montana oil spill are found in drinking water,0.028914548456668854,0.4233520030975342,0.5477334856987,21/01/2015,4211
362,faith seidenberg 91 dies took onmcsorleys an all male haven,0.10153103619813919,0.041932329535484314,0.8565366268157959,21/01/2015,4215
363,447000 seized by government will be returned to business,0.021309733390808105,0.044171690940856934,0.934518575668335,21/01/2015,4216
364,safety unit broadens its scrutiny of a recall,0.5543845891952515,0.01715860702097416,0.42845675349235535,21/01/2015,4217
365,state of the union obama ambitious agenda to help middle class,0.6475162506103516,0.01293803472071886,0.33954566717147827,21/01/2015,4110
366,thomas friedman say it like it is,0.0360318161547184,0.039978157728910446,0.92399001121521,21/01/2015,4218
367,20150121 CRITIC,0.030319638550281525,0.055115193128585815,0.9145652055740356,21/01/2015,4112
368,brennans in new orleans walks the tightrope of tradition,0.07807006686925888,0.16648221015930176,0.7554477453231812,21/01/2015,4113
369,20150121 lens baby,0.034500449895858765,0.038400571793317795,0.9270990490913391,21/01/2015,4730
370,better but still troubled our take on the state of the union,0.22108545899391174,0.13005031645298004,0.6488642692565918,21/01/2015,4114
371,pope francis september visit to new york is expected to be just one day,0.024491475895047188,0.03266773745417595,0.9428407549858093,21/01/2015,4219
372,butter and scotch combines cupcakes and cocktails,0.03874000161886215,0.022647682577371597,0.9386122822761536,21/01/2015,4104
373,sororities should throw parties,0.03376306965947151,0.11512324959039688,0.8511136770248413,21/01/2015,4116
374,cooking with kimchi,0.052706848829984665,0.029723182320594788,0.9175699353218079,21/01/2015,4117
375,rare moment of consensus for senate on keystone pipeline,0.3243328630924225,0.02672465890645981,0.6489424705505371,21/01/2015,4212
376,who are the houthis of yemen,0.020454905927181244,0.09557323902845383,0.8839718103408813,21/01/2015,4102
377,us outpost in cuba to step out of the shadows,0.22576314210891724,0.11422600597143173,0.6600109338760376,21/01/2015,4234
378,mcconnells allies establish fund to keep senate in gop hands,0.38125789165496826,0.03549760952591896,0.5832445025444031,21/01/2015,4261
379,domes at uc davis counterculture spirit thrives,0.19819723069667816,0.014950854703783989,0.7868519425392151,21/01/2015,4089
380,indias rebounding tiger population grows 30 percent in 4 years,0.937741219997406,0.01606474630534649,0.046194031834602356,21/01/2015,4130
381,hearing pits tenants who denounce airbnb against those who profit from it,0.03903717175126076,0.7753267288208008,0.18563604354858398,21/01/2015,4249
382,at sites honoring victims of paris attacks concerns about the future,0.03973091393709183,0.8407934308052063,0.11947564035654068,21/01/2015,4209
383,can capitalists save capitalism,0.09115434437990189,0.019741641357541084,0.8891040682792664,21/01/2015,4253
384,with rick nash pacing action rangers beatsenators in overtime,0.06503905355930328,0.06517112255096436,0.8697898387908936,21/01/2015,4254
385,presidential residence in yemen is attacked,0.022149553522467613,0.09574924409389496,0.8821012377738953,21/01/2015,4062
386,a century on the chinatown water feud ebbs,0.10796748846769333,0.044766124337911606,0.8472663760185242,21/01/2015,4255
387,obama calls for more internet service options for consumers,0.7257805466651917,0.00896777119487524,0.26525166630744934,21/01/2015,4247
388,at the state of the union a president outgunned in congress is still combative,0.09413086622953415,0.6502087712287903,0.2556603252887726,21/01/2015,4257
389,an immigrants dream for a better life,0.2287592887878418,0.05864030867815018,0.7126004099845886,21/01/2015,4290
390,super bowl patriots offense has been just as dominant as seahawks defense,0.27023112773895264,0.023074522614479065,0.7066943049430847,21/01/2015,4149
391,ibm earnings,0.03917771205306053,0.024988282471895218,0.9358339905738831,21/01/2015,4150
392,more progress made toward learning contents of herculaneum scrolls,0.5802091360092163,0.008867396973073483,0.4109235107898712,21/01/2015,4061
393,hogan a revived club maker returns to its roots,0.5897138118743896,0.021654129028320312,0.3886320888996124,21/01/2015,4208
394,republican response to obamas 2015 state of the union address,0.18399889767169952,0.0580262690782547,0.7579748630523682,21/01/2015,4260
395,the latest on travel to cuba,0.04114087298512459,0.02391304261982441,0.9349460601806641,21/01/2015,4146
396,yankees to return to wpix tv 20 times a year,0.12766773998737335,0.01525371428579092,0.857078492641449,21/01/2015,4245
397,im gonna pray for you so hard with reed birney,0.11862995475530624,0.026674067601561546,0.8546959161758423,21/01/2015,4244
398,patrick lynch will face election challenge,0.03860108554363251,0.10067909210920334,0.8607197999954224,21/01/2015,4141
399,palestinian authority gives partial salaries to employees,0.03180522844195366,0.14547301828861237,0.8227217197418213,21/01/2015,4131
400,guyana president announces date for elections,0.036799028515815735,0.06146908551454544,0.9017319083213806,21/01/2015,4236
401,potential buyers of new york city opera hold a bidding war in court,0.1178550124168396,0.04290967807173729,0.839235246181488,21/01/2015,4237
402,zuma mixing east and west is opening on madison avenue,0.05510029196739197,0.01478067971765995,0.9301190376281738,21/01/2015,4134
403,prison beard ban gregory holt ruling,0.11013303697109222,0.5240581631660461,0.3658088147640228,21/01/2015,4088
404,britain man pleads guilty to terrorism charges,0.08192892372608185,0.3489401638507843,0.5691308975219727,21/01/2015,4238
405,winning lottery numbers for jan 20 2015,0.02713075838983059,0.06292876601219177,0.9099404215812683,21/01/2015,4239
406,one shot at boston hospital police say,0.06238846480846405,0.7600574493408203,0.17755407094955444,21/01/2015,4086
407,why the guests because heartwarming stories work,0.08296988159418106,0.0524335652589798,0.8645965456962585,21/01/2015,4240
408,george washingtons yuta watanabe hopes to inspire players in japan,0.6309885382652283,0.0100893285125494,0.35892218351364136,21/01/2015,4241
409,lra commander ongwen heads to face charges in hague,0.025944845750927925,0.8185096979141235,0.15554548799991608,21/01/2015,4136
410,michigan governor backs measure raising sales tax,0.7624208927154541,0.03584669530391693,0.20173244178295135,21/01/2015,4242
411,in philadelphia juniper commons offers comfort grub of the 80s with a soundtrack,0.17698760330677032,0.013810697011649609,0.809201717376709,21/01/2015,4138
412,us charges manhattan man with trying to buy ricin,0.03134430944919586,0.7431671619415283,0.2254885733127594,21/01/2015,4139
