,Headline,Positive,Negative,Neutral,date,article_id
209,in mock attack iranian navy blasts away at replica us aircraft carrier,0.034207623451948166,0.706914484500885,0.25887784361839294,26/02/2015,12465
210,review kate weare company celebrates 10th anniversary at bam fisher,0.29578134417533875,0.017547139897942543,0.6866714954376221,26/02/2015,12526
211,20150226HOMETECH,0.029934709891676903,0.03649606183171272,0.9335692524909973,26/02/2015,12534
212,limited high speed internet choices underlie net neutrality rules,0.024597380310297012,0.06311371177434921,0.9122889041900635,26/02/2015,12476
213,alpaca blankets from the rug company,0.08189580589532852,0.019141679629683495,0.8989624381065369,26/02/2015,12548
214,turkish police accused of wiretapping recep tayyip erdogan in feud with fethullah gulen,0.031565044075250626,0.7566869854927063,0.2117479145526886,26/02/2015,12426
215,real estate in italy,0.03681168332695961,0.026723487302660942,0.936464786529541,26/02/2015,12399
216,cushman wakefield is up for sale,0.06829401105642319,0.014874407090246677,0.9168315529823303,26/02/2015,12406
217,brearley school after considering a move will stay put,0.06197250261902809,0.025815598666667938,0.9122119545936584,26/02/2015,12413
218,fast track attacks on cancer accelerate hopes,0.20943614840507507,0.08775853365659714,0.7028053402900696,26/02/2015,12560
219,an outspoken voice for women in tech foiled by his tone,0.04939863830804825,0.5618434548377991,0.3887579143047333,26/02/2015,12417
220,otter box a sunday party for hirsute gays,0.03365159034729004,0.059708092361688614,0.906640350818634,26/02/2015,12558
221,palm springs modern architecture tours,0.09146827459335327,0.016673820093274117,0.891857922077179,26/02/2015,12419
222,at gucci a new philosophy fashion week 2015,0.0905718207359314,0.02607267163693905,0.8833554983139038,26/02/2015,12428
223,campbell soup 2q results,0.033550918102264404,0.08937066048383713,0.8770784139633179,26/02/2015,12421
224,retirement plan an airbnb travel adventure,0.05247889459133148,0.01781647838652134,0.9297046661376953,26/02/2015,12556
225,for derrick rose another knee surgery is another loss,0.06883568316698074,0.12000282853841782,0.8111615180969238,26/02/2015,12554
226,sales at crate barrel zinc details global table an minam,0.038609664887189865,0.04250726476311684,0.9188830852508545,26/02/2015,12553
227,food waste is becoming serious economic and environmental issue report says,0.024041462689638138,0.7022923827171326,0.2736661434173584,26/02/2015,12552
228,new york city ballet applies a surreal touch to build audiences,0.1643543392419815,0.016986055299639702,0.8186595439910889,26/02/2015,12551
229,20150226YELLIN,0.031692299991846085,0.05279083922505379,0.9155168533325195,26/02/2015,12550
230,lawmakers seek information on funding for climate change critics,0.0780191496014595,0.018611902371048927,0.9033689498901367,26/02/2015,12549
231,review ronald k browns evidence presents 30th anniversary season,0.14597059786319733,0.01896168850362301,0.8350677490234375,26/02/2015,12557
232,bulls derrick rose is out again needs knee surgery,0.043749772012233734,0.7802692651748657,0.17598097026348114,26/02/2015,12396
233,kelly links get in trouble and five other works,0.017033131793141365,0.8600077033042908,0.12295912951231003,26/02/2015,12525
234,jpmorgans less than stellar plan to boost earnings,0.9148525595664978,0.013517110608518124,0.07163030654191971,26/02/2015,12429
235,video skiing with the sports next generation,0.05324595794081688,0.020310189574956894,0.9264438152313232,26/02/2015,12500
236,germany sells five year debt at a negative yield for the first time,0.0122230164706707,0.9326645731925964,0.05511242151260376,26/02/2015,12440
237,season 3 of house of cards starts with more policy than chicanery,0.04288950935006142,0.02400081977248192,0.9331096410751343,26/02/2015,12442
238,christopher epps former mississipi prisons chief pleads guilty in corruption case,0.0675635114312172,0.5382182002067566,0.3942182958126068,26/02/2015,12494
239,public pensions once unassailable start to look vulnerable,0.16058534383773804,0.7361195683479309,0.10329511016607285,26/02/2015,12492
240,blackstone considers a lower return longer term approach to private equity,0.0790824145078659,0.013799033127725124,0.907118558883667,26/02/2015,12488
241,review david ives in lives of the saints mixes gags and philosophy,0.02779407799243927,0.12924455106258392,0.8429613709449768,26/02/2015,12487
242,for bill oreilly and fox news a symbiotic relationship,0.08868664503097534,0.02151992917060852,0.8897934556007385,26/02/2015,12438
243,house republicans press janet yellen on stimulus campaign,0.19343838095664978,0.0702897310256958,0.7362719178199768,26/02/2015,12443
244,sillerman of sfx proposes taking the concert company private,0.03127491846680641,0.02064775675535202,0.9480773210525513,26/02/2015,12445
245,france gets more time to meet eu budget rules,0.18244779109954834,0.01400620024651289,0.8035460114479065,26/02/2015,12481
246,deutsche bank poaches senior banker from jpmorgan,0.022893767803907394,0.7600584030151367,0.2170478105545044,26/02/2015,12455
247,european leaders push for energy union,0.23377318680286407,0.013605345040559769,0.7526214718818665,26/02/2015,12480
248,holding homeland security hostage,0.03214143216609955,0.1961716264486313,0.7716869115829468,26/02/2015,12453
249,hsbc executives with a lot to explain give it a shot,0.060598280280828476,0.017543701454997063,0.9218579530715942,26/02/2015,12451
250,greek energy official opposes privatization,0.054057903587818146,0.16718006134033203,0.7787620425224304,26/02/2015,12477
251,chicago mayor rahm emanuel jesus garcia,0.08008690923452377,0.02889215759932995,0.8910208940505981,26/02/2015,12444
252,20150226NOMADS,0.04885523393750191,0.028280135244131088,0.9228646755218506,26/02/2015,12524
253,gail collins adieu chris christie adieu,0.02704889513552189,0.07984081655740738,0.8931102752685547,26/02/2015,12623
254,20150226SHOP,0.03131786733865738,0.04881029576063156,0.9198718667030334,26/02/2015,12506
255,cheerleading for milan fashion week 2015,0.036882851272821426,0.0613798089325428,0.9017373323440552,26/02/2015,12431
256,boris bidjan saberis mad method,0.11505413800477982,0.03759748116135597,0.8473483324050903,26/02/2015,12523
257,flume rises in the edm world,0.6260926127433777,0.18293002247810364,0.19097737967967987,26/02/2015,12522
258,video feature apps for meditation and calming on iphone and android,0.06439974159002304,0.013279099948704243,0.9223212003707886,26/02/2015,12521
259,rory mcilroy says he can handle being that guy in golf this time,0.15893609821796417,0.011133668012917042,0.8299302458763123,26/02/2015,12519
260,congress republicans homeland security,0.030159134417772293,0.04338458925485611,0.9264563322067261,26/02/2015,12436
261,review paulo szots commanding take on bossa nova at 54 below,0.09855282306671143,0.03773726150393486,0.8637099266052246,26/02/2015,12518
262,coyotes mark arcobello reflects on playing for four nhl teams this season,0.05310943350195885,0.039770763367414474,0.9071197509765625,26/02/2015,12502
263,review in mo yans frog a chinese abortionist embodies state power,0.09534882009029388,0.16450615227222443,0.7401450872421265,26/02/2015,12517
264,strippers go undercover on snapchat,0.0188363716006279,0.06522057205438614,0.9159430861473083,26/02/2015,12514
265,researchers call for more study of anesthesia risks to young children,0.4102998375892639,0.013038890436291695,0.5766612887382507,26/02/2015,12513
266,review the jack and the calder quartet in concert,0.04863198474049568,0.030791739001870155,0.9205763339996338,26/02/2015,12510
267,20150226LOCATION,0.032255589962005615,0.0457642562687397,0.9219801425933838,26/02/2015,12508
268,for scott walker a consistent approach under tough questioning,0.24523767828941345,0.01898263581097126,0.7357797026634216,26/02/2015,12464
269,justices overturn a fishermans conviction for tossing undersize catch,0.13208936154842377,0.7714251279830933,0.09648553282022476,26/02/2015,12461
270,santander consumer reaches 9 35 million settlement over car repossessions,0.1547241359949112,0.8164485692977905,0.028827348724007607,26/02/2015,12507
271,future brown confident song collective cooks new stews,0.06606903672218323,0.0343494638800621,0.8995814919471741,26/02/2015,12515
272,20150226LINCOLN,0.038849588483572006,0.028086520731449127,0.9330638647079468,26/02/2015,12562
273,3 men in brooklyn charged supporting isis,0.07264187932014465,0.7370393872261047,0.19031871855258942,26/02/2015,12446
274,basketball standout from egypt makes impact at minnesota state,0.7082793116569519,0.02351973205804825,0.2682010233402252,26/02/2015,12394
275,review brooklynite a superhero musical with matt doyle and nicolette robinson,0.08236900717020035,0.030216965824365616,0.8874140381813049,26/02/2015,12590
276,inquiry into working families party spurs charges against officials ex aides,0.01904294081032276,0.9319472312927246,0.0490097850561142,26/02/2015,12589
277,talk toughens as us israel relations fray,0.38190600275993347,0.199015811085701,0.41907811164855957,26/02/2015,12588
278,george clooney on sudans rape of darfur,0.05885143205523491,0.5769999027252197,0.36414867639541626,26/02/2015,12363
279,tie liu gets suspended sentence in china for publishing memoirs of maos victims,0.02941153757274151,0.8150278925895691,0.15556050837039948,26/02/2015,12364
280,greece george papaconstantinou finance minister lagarde list swiss accounts,0.020952194929122925,0.07803364843130112,0.9010142087936401,26/02/2015,12366
281,senate panel expected to endorse lynch as attorney general,0.07078223675489426,0.02353816106915474,0.9056795835494995,26/02/2015,12612
282,private equity firm leaders offer differing views on industrys future,0.030036740005016327,0.6496803760528564,0.3202829658985138,26/02/2015,12368
283,winning lottery numbers for feb 25 2015,0.027207644656300545,0.05555959418416023,0.9172327518463135,26/02/2015,12587
284,south korean island grows wary after welcoming the chinese,0.04320763051509857,0.8560422658920288,0.1007501408457756,26/02/2015,12586
285,whats on tv thursday,0.02849620208144188,0.05735064670443535,0.9141532182693481,26/02/2015,12613
286,eugenie clark scholar of the life aquatic dies at 92,0.025432610884308815,0.12133414298295975,0.853233277797699,26/02/2015,12585
287,google plans new headquarters and a city fears being overrun,0.04742029681801796,0.04369799792766571,0.908881664276123,26/02/2015,12371
288,jordan us warns of threat to malls,0.0651422068476677,0.6493182182312012,0.28553956747055054,26/02/2015,12584
289,walker is set to deliver new blow to labor and bolster credentials,0.5486015677452087,0.03859996795654297,0.41279855370521545,26/02/2015,12583
290,as vermont tackles heroin addiction progress is measured in baby steps,0.15723751485347748,0.011624465696513653,0.831138014793396,26/02/2015,12372
291,springs quiet leather kicks,0.07611630856990814,0.07214482873678207,0.8517388105392456,26/02/2015,12606
292,target tjx lowes q4 earnings,0.024814030155539513,0.07562251389026642,0.8995634317398071,26/02/2015,12395
293,at gucci a messy exit for one designer opens an unlikely door for another,0.11614236235618591,0.6187556982040405,0.26510193943977356,26/02/2015,12168
294,obama hopes to score points in miami on immigration,0.6971056461334229,0.021909069269895554,0.28098535537719727,26/02/2015,12362
295,as vote nears watchdog agency criticizes netanyahu on housing costs,0.027382226660847664,0.8831250667572021,0.08949272334575653,26/02/2015,12593
296,filing away gmail messages,0.02126048319041729,0.3294410705566406,0.6492984294891357,26/02/2015,12199
297,susan rice calls netanyahus planned visit destructive to us israel ties,0.07524913549423218,0.15819966793060303,0.7665512561798096,26/02/2015,12335
298,after twitter outburst knicks are still awful,0.07882744818925858,0.5209428668022156,0.40022963285446167,26/02/2015,12602
299,stainless steel mens watches,0.06804577261209488,0.015826815739274025,0.9161274433135986,26/02/2015,12607
300,aaron stern jordan sullivan dialogues photography poetry,0.028784938156604767,0.05421511456370354,0.9169999361038208,26/02/2015,12608
301,word of the day insubordination,0.0490647554397583,0.8074315786361694,0.14350362122058868,26/02/2015,12609
302,gemalto says nsa tried to take sim encryption codes,0.027656756341457367,0.2997668981552124,0.6725763082504272,26/02/2015,12336
303,what is middle class economics,0.027453411370515823,0.12108787894248962,0.851458728313446,26/02/2015,12610
304,death toll from bacteria is raised,0.03814511001110077,0.5069441199302673,0.4549107551574707,26/02/2015,12601
305,massachusetts opening is set in boston marathon bombings trial,0.04175504669547081,0.05955454707145691,0.898690402507782,26/02/2015,12599
306,after deadly infections fda asks device makers about cleaning methods,0.037175945937633514,0.1490766406059265,0.8137474060058594,26/02/2015,12598
307,hong kong protests color budget plans,0.02279452607035637,0.8961573243141174,0.08104818314313889,26/02/2015,12354
308,mta chief tries to ease alarm on budget gap but warns of risks to projects,0.03420174866914749,0.9175289273262024,0.0482693687081337,26/02/2015,12597
309,mets noah syndergaard looks to build on disappointing season,0.909436821937561,0.015278009697794914,0.07528515160083771,26/02/2015,12596
310,mark teixeira changes his plate philosophy but only when it comes to meals,0.040141861885786057,0.034057773649692535,0.9258003830909729,26/02/2015,12595
311,back in the ussr,0.15862418711185455,0.07673220336437225,0.764643669128418,26/02/2015,12611
312,reconsidering notion of mercy after a basketball rout in brooklyn,0.18829989433288574,0.1375615894794464,0.6741384863853455,26/02/2015,12594
313,de blasio in albany to discuss budget faces competition from cuomo,0.0780077576637268,0.40592214465141296,0.5160701274871826,26/02/2015,12591
314,despite the promise of technology the mysteries of sleep lie unsolved,0.04862749204039574,0.10725748538970947,0.8441150784492493,26/02/2015,12161
315,taking aim at icicles to keep trains moving into and out of new york,0.033528245985507965,0.18781054019927979,0.7786612510681152,26/02/2015,12582
316,boy is found dead in familys brooklyn home,0.03290301561355591,0.6386642456054688,0.32843273878097534,26/02/2015,12604
317,senators are announcing retirements earlier fund raising plays a big role,0.037617966532707214,0.04337962344288826,0.9190024137496948,26/02/2015,12384
318,hp said in talks to buy aruba networks,0.15433619916439056,0.008344561792910099,0.8373191952705383,26/02/2015,12569
319,a back and forth view of the presidents executive power,0.03511398285627365,0.025785518810153008,0.9391005039215088,26/02/2015,12390
320,the chicken at kfc is ok but the cups are delicious,0.3181605637073517,0.029484812170267105,0.6523546576499939,26/02/2015,12574
321,q and a jiang rong on wolf totem the novel and now the film,0.07478838413953781,0.023617103695869446,0.9015945792198181,26/02/2015,12614
322,arrest warrant issued for bangladesh opposition leader khaleda zia,0.08418963849544525,0.6359338760375977,0.2798765301704407,26/02/2015,12385
323,drones spotted over paris landmarks for 2nd night,0.16606321930885315,0.024659721180796623,0.8092770576477051,26/02/2015,12391
324,shale gas project encounters determined foes deep in algerian sahara,0.0838169977068901,0.8131778836250305,0.10300512611865997,26/02/2015,12573
325,craig spencer new york ebola doctor speaks out,0.06397128105163574,0.034711774438619614,0.9013169407844543,26/02/2015,12572
326,arms control for a cyberage,0.06617841869592667,0.14509958028793335,0.788722038269043,26/02/2015,12618
327,how wayne state police helped breathe life into a blighted detroit strip,0.09630954265594482,0.040813688188791275,0.8628767132759094,26/02/2015,12386
328,the fashion world remembers louise wilson,0.08100765198469162,0.032397180795669556,0.8865951895713806,26/02/2015,11473
329,gun rights for terrorists,0.11960567533969879,0.08327485620975494,0.7971194982528687,26/02/2015,12619
330,kerry reminds congress netanyahu advised us to invade iraq,0.12223688513040543,0.025332465767860413,0.8524306416511536,26/02/2015,12571
331,justices find antitrust law valid against dental board,0.12480660527944565,0.3424014151096344,0.5327919721603394,26/02/2015,12570
332,the chronically homeless,0.017771419137716293,0.894246518611908,0.08798210322856903,26/02/2015,12620
333,morgan stanley in 2 6 billion mortgage settlement,0.04650304466485977,0.028840787708759308,0.9246561527252197,26/02/2015,12568
334,in a case of religious dress justices explore the obligations of employers,0.030880099162459373,0.07491692900657654,0.8942030072212219,26/02/2015,12576
335,at packed utah womens gymnastics meets marketing earns high scores too,0.2915763556957245,0.018525967374444008,0.6898976564407349,26/02/2015,12376
336,marijuana farm found at a cherry business in brooklyn,0.034049756824970245,0.4427107572555542,0.5232394933700562,26/02/2015,12581
337,lunar new year casualties include siberian tiger,0.023393969982862473,0.8153528571128845,0.1612531542778015,26/02/2015,12615
338,insanity defense fails in killing of sniper,0.05587811395525932,0.42195165157318115,0.5221701860427856,26/02/2015,12579
339,abuse of detainees remains widespread in afghanistan un says,0.021969137713313103,0.808856189250946,0.16917464137077332,26/02/2015,12378
340,dori j maynard who sought diversity in journalism dies at 56,0.03924723342061043,0.1108282208442688,0.8499245047569275,26/02/2015,12575
341,quotation of the day,0.03285898268222809,0.06459265947341919,0.9025484323501587,26/02/2015,12617
342,corrections february 26 2015,0.02490105852484703,0.06854520738124847,0.9065536856651306,26/02/2015,12616
343,at vanity fair oscars party jay z and beyonce steal the show,0.048759181052446365,0.03754257783293724,0.9136982560157776,26/02/2015,11988
344,next goal for walmart workers more hours,0.10492150485515594,0.018123356625437737,0.8769550919532776,26/02/2015,12578
345,shopping sales and events in new york city,0.02065049298107624,0.07926689088344574,0.9000826478004456,26/02/2015,12566
346,1850000 homes in texas arizona and wisconsin,0.02860119752585888,0.03677823767066002,0.9346204996109009,26/02/2015,12393
347,state closes an illegal hotel in manhattan that was hiding in plain sight,0.019650302827358246,0.7105051875114441,0.26984456181526184,26/02/2015,12577
348,russia ukraine crimea annexation,0.023953665047883987,0.06927014887332916,0.9067761301994324,26/02/2015,12382
349,fashion says goodbye to lincoln center,0.09279000759124756,0.05108439549803734,0.8561255931854248,26/02/2015,12564
350,a cheer for james dolan and madison square garden,0.08096958696842194,0.027916135266423225,0.8911142945289612,26/02/2015,12621
351,choosing between amazons tv streaming hardware,0.04384078085422516,0.020257966592907906,0.9359012246131897,27/02/2015,12990
352,milan fashion week sportmax fall winter 2015,0.03536980226635933,0.04336089640855789,0.9212692379951477,27/02/2015,12989
353,milan fashion week etro fall winter 2015,0.03406430408358574,0.06134682893753052,0.9045888781547546,27/02/2015,12998
354,27scene_giamba,0.06556163728237152,0.022398706525564194,0.9120396971702576,27/02/2015,12992
355,the closed minds problem,0.048378512263298035,0.11092977970838547,0.8406917452812195,27/02/2015,13006
356,laura ingraham implores republicans to look beyond jeb bush,0.1368841528892517,0.025111792609095573,0.8380040526390076,27/02/2015,13005
357,ask well are fatty liver and sleep apnea related,0.046986375004053116,0.19861596822738647,0.7543976902961731,27/02/2015,12995
358,lessons in family ties from a french baby swap,0.11315606534481049,0.03136152774095535,0.8554823994636536,27/02/2015,13003
359,1915 fire destroys moulin rouge,0.02595711685717106,0.450044184923172,0.5239987373352051,27/02/2015,13002
360,charlie dent a republican moderate gasp,0.09294316917657852,0.082786425948143,0.8242703676223755,27/02/2015,13001
361,cnns bill weir explores the worlds threatened wonders,0.08713483065366745,0.0603024885058403,0.852562665939331,27/02/2015,13000
362,27scene_etro,0.04364556819200516,0.019177095964550972,0.9371773600578308,27/02/2015,12997
363,1890 cholera in persia,0.03018365427851677,0.7829548716545105,0.18686148524284363,27/02/2015,12999
364,the trouble with boyhood,0.04053330048918724,0.21507373452186584,0.744392991065979,27/02/2015,12991
365,milan fashion week giamba fall winter 2015,0.04416504502296448,0.06496038287878036,0.8908746242523193,27/02/2015,12993
366,today in politics 105,0.05876518040895462,0.02508915401995182,0.9161456823348999,27/02/2015,12959
367,your turn a weekend thread open for comments 47,0.038576144725084305,0.0336262583732605,0.9277976155281067,27/02/2015,12987
368,test yourself younger audiences warm up to ballet,0.13436181843280792,0.01627962291240692,0.8493585586547852,27/02/2015,12930
369,how liberalism and racism are wed,0.03516877442598343,0.07463320344686508,0.8901979923248291,27/02/2015,12927
370,a town where a school bus is more than a bus,0.044285714626312256,0.031256627291440964,0.9244576096534729,27/02/2015,12925
371,community colleges that work,0.028365282341837883,0.03685500845313072,0.9347796440124512,27/02/2015,12924
372,sit sparky stay good dog can i dream,0.06576617062091827,0.026861200109124184,0.9073725938796997,27/02/2015,12923
373,long term care policies let the buyer beware,0.058409642428159714,0.018017079681158066,0.9235732555389404,27/02/2015,12913
374,marco rubio at cpac an immigrant success story,0.4985508620738983,0.015051479451358318,0.4863976538181305,27/02/2015,13024
375,north koreas nuclear expansion,0.048394203186035156,0.01915840432047844,0.9324473738670349,27/02/2015,12921
376,food waste grows with the middle class,0.3502673804759979,0.03335093706846237,0.6163816452026367,27/02/2015,12920
377,paul krugman what greece won,0.0446636825799942,0.022652840241789818,0.9326834082603455,27/02/2015,12919
378,nothing is wrong with your sex drive,0.03371536731719971,0.43062394857406616,0.5356606245040894,27/02/2015,12918
379,happy talk history,0.07397716492414474,0.055857136845588684,0.8701657056808472,27/02/2015,12917
380,david brooks converting the ayatollahs,0.07345917075872421,0.02457420341670513,0.9019666314125061,27/02/2015,12916
381,stopping the violence on rikers island,0.09748446941375732,0.17313483357429504,0.7293806672096252,27/02/2015,12915
382,a plea on western sahara,0.09892409294843674,0.06891796737909317,0.8321579098701477,27/02/2015,12914
383,6 qs about the news in france a baby switch and a lesson in maternal love,0.12263999879360199,0.01936335861682892,0.8579965829849243,27/02/2015,12931
384,27scene_sportmax,0.03389691188931465,0.023729270324110985,0.9423737525939941,27/02/2015,12988
385,what should be the purpose of prison,0.027468280866742134,0.039399899542331696,0.9331318736076355,27/02/2015,12933
386,making old vegetables new again,0.08763930201530457,0.030136585235595703,0.8822240233421326,27/02/2015,12939
387,anarchy state and dread pirate roberts,0.027533551678061485,0.3243195712566376,0.6481468081474304,27/02/2015,12986
388,hillary clinton aides in talks to fill top campaign roles,0.028624162077903748,0.06062415987253189,0.9107517004013062,27/02/2015,12980
389,sportmax fall 2015 rtw,0.045693617314100266,0.025210514664649963,0.9290958642959595,27/02/2015,12978
390,ericsson again sues apple over wireless patents,0.012905453331768513,0.9491680860519409,0.03792655095458031,27/02/2015,12977
391,madonna of batchelder street 1969,0.03671291470527649,0.07962063699960709,0.8836665153503418,27/02/2015,12975
392,small successful steps toward finding your groove,0.40102842450141907,0.010812814347445965,0.5881587266921997,27/02/2015,12971
393,daily clip report 132,0.02654198370873928,0.053704530000686646,0.9197534918785095,27/02/2015,12969
394,emporio armani fall 2015 rtw,0.05036703497171402,0.06154213100671768,0.8880908489227295,27/02/2015,12967
395,whats on this week around the world 12,0.043061330914497375,0.06446327269077301,0.8924753665924072,27/02/2015,12963
396,morning agenda hedge fund sues u s prosecutor,0.04113933444023132,0.8033525347709656,0.15550808608531952,27/02/2015,12960
397,10 intriguing photographs to teach close reading and visual thinking skills,0.061733510345220566,0.019668452441692352,0.9185980558395386,27/02/2015,12957
398,Netstalgia,0.030335143208503723,0.026953913271427155,0.9427109956741333,27/02/2015,12947
399,daily report f c c passes net neutrality rules,0.11175867915153503,0.01906455121934414,0.8691768050193787,27/02/2015,12944
400,new york today twilight of the ice age,0.07147173583507538,0.0779142677783966,0.8506140112876892,27/02/2015,12943
401,latest news homeland security cuba talks house of cards,0.03957466408610344,0.055294908583164215,0.9051304459571838,27/02/2015,12940
402,beijing courts address the right to criticize public figures,0.026453375816345215,0.1064828485250473,0.8670637607574463,27/02/2015,12936
403,libraries of life,0.035708725452423096,0.03782088682055473,0.9264704585075378,27/02/2015,12922
404,boehner invites afghan president to address congress,0.1371224969625473,0.016051923856139183,0.8468255996704102,27/02/2015,13120
405,the secrets of filming sex scenes,0.03051457554101944,0.06149626895785332,0.9079892039299011,27/02/2015,13030
406,quinn kelsey baritone wins beverly sills artist award,0.33036720752716064,0.0651080384850502,0.6045247316360474,27/02/2015,13113
407,for grimms house seat new york democrats settle on city councilman,0.11256854236125946,0.16968391835689545,0.7177475094795227,27/02/2015,13116
408,finding joy in my fathers death,0.13082964718341827,0.021802835166454315,0.847367525100708,27/02/2015,13118
409,thank our veterans for serving its complicated,0.3027198612689972,0.012249032966792583,0.6850311160087585,27/02/2015,12912
410,milan fashion week fall 2015 tods hair,0.04372266307473183,0.05129113420844078,0.9049862623214722,27/02/2015,13121
