,Headline,Positive,Negative,Neutral,date,article_id
385,cyclone chapala gathering strength heads toward oman and yemen,0.43690821528434753,0.2221415936946869,0.3409501016139984,2015-10-31,65964
386,south china sea philippines hague,0.03302972391247749,0.07334621995687485,0.8936240673065186,2015-10-31,65706
387,one child rule china,0.03321611508727074,0.04292159155011177,0.9238623380661011,2015-10-31,65800
388,chinese tycoon wang jianlin defends xis relatives and himself on business deal,0.018875760957598686,0.8694183230400085,0.1117059662938118,2015-10-31,65731
389,the link between parenting and leadership,0.06378445029258728,0.027332164347171783,0.9088833332061768,2015-10-31,65837
390,bangladesh isis terrorism warnings,0.021936867386102676,0.5510367155075073,0.4270264506340027,2015-10-31,65726
391,china will feel one child policys effects for decades experts say,0.088324636220932,0.4986768364906311,0.41299861669540405,2015-10-31,65673
392,charlie hebdo kosher supermarket hostage crisis,0.02227489836513996,0.548798680305481,0.42892637848854065,2015-11-01,2021
393,south korea to deport american over warm words about north korea,0.6909385323524475,0.1590626984834671,0.1499987542629242,2015-11-01,1951
394,paris terrorist attacks,0.02654394693672657,0.5760183334350586,0.3974376916885376,2015-11-01,1946
395,paris attacks anwar al awlaki,0.027594443410634995,0.5777995586395264,0.39460593461990356,2015-11-01,1978
396,for us stocks at least a solid finish,0.9215708374977112,0.017608577385544777,0.060820572078228,2015-11-01,1813
397,jon stewart seamlessly mixing analysis politics and humor,0.07371411472558975,0.021830761805176735,0.9044551253318787,2015-11-02,9062
398,taiwanese official in charge of ties with mainland china steps down,0.0171187911182642,0.8190422654151917,0.1638389527797699,2015-11-02,8882
399,rapper deso dogg shaped by tumultuous german youth is designated a global terrorist,0.15639115869998932,0.029427029192447662,0.8141818046569824,2015-11-02,9078
400,tesla seeks a stronger foothold in china,0.8731302618980408,0.010121786966919899,0.1167478859424591,2015-11-02,8962
401,maria loi is back in business,0.11954399198293686,0.02547486126422882,0.8549811244010925,2015-11-02,8971
402,terrorists claims about saudis put 9 11 families lawsuit back in spotlight,0.06745614856481552,0.8160966634750366,0.1164470985531807,2015-11-02,8927
403,on youtube vivid evidence of wars horror in ukraine,0.12585553526878357,0.4126717746257782,0.46147269010543823,2015-11-02,9050
404,in thailand the ghost business thrives,0.2781411409378052,0.014036262407898903,0.7078226208686829,2015-11-02,9051
405,about last night jon stewart signing off,0.06924358755350113,0.05857338756322861,0.872183084487915,2015-11-02,9141
406,readying to run jeb bush severs more business ties,0.0937170758843422,0.04186251387000084,0.8644204139709473,2015-11-03,15772
407,spain says arrested pair were part of terrorist plot,0.023514622822403908,0.5276142954826355,0.44887107610702515,2015-11-03,15486
408,isis seizes opportunity in libyas turmoil,0.0379936508834362,0.5399692058563232,0.42203715443611145,2015-11-03,15479
409,france olympians helicopter crash dropped,0.01872672513127327,0.7624552249908447,0.2188180387020111,2015-11-03,15432
410,philippines battling rebels on 2 fronts setting off refugee crisis,0.11556670069694519,0.47418731451034546,0.41024595499038696,2015-11-03,15422
411,qatar starts project to rebuild homes hit by war in gaza strip,0.6126481294631958,0.07590683549642563,0.311445027589798,2015-11-03,15554
412,with foreign leaders obama keeps it mostly business,0.038833994418382645,0.03654767572879791,0.9246183037757874,2015-11-03,15412
413,bbc suspends jeremy clarkson host of top gear after string of warnings,0.013484527356922626,0.8957430720329285,0.09077242016792297,2015-11-03,15597
414,irs tax extension pros and cons,0.024130191653966904,0.05979566276073456,0.9160740971565247,2015-11-04,22420
415,environmental order in china to prevent building of contested dam,0.05249993875622749,0.12476733326911926,0.82273268699646,2015-11-04,22364
416,general electric to sell bulk of its finance unit,0.03381859138607979,0.021033013239502907,0.9451484084129333,2015-11-04,22379
417,china is rapidly adding coast guard ships us navy says,0.5274754166603088,0.019642386585474014,0.45288220047950745,2015-11-04,22372
418,the lessons for finance in the ge capital retreat,0.0704018771648407,0.02145998738706112,0.90813809633255,2015-11-04,22570
419,un says yarmouk palestinian crisis worsens sends envoy to damascus,0.1723913699388504,0.3490050435066223,0.4786035418510437,2015-11-04,22625
420,document ruling on mortgage fraud in 2008 crisis,0.06630777567625046,0.1879580318927765,0.7457342147827148,2015-11-05,29276
421,russia tests distant waters resurfacing cold war fears,0.43546751141548157,0.09619145840406418,0.46834102272987366,2015-11-05,29033
422,a chasm divides david cameron and nicola sturgeon leaders of a kingdom still united,0.11377864331007004,0.5539981126785278,0.33222320675849915,2015-11-05,29017
423,4 countries ground airbus military transport planes after crash,0.06238517165184021,0.4027145802974701,0.5349002480506897,2015-11-05,28959
424,china cuts rates to halt a slide in its economy,0.03969048336148262,0.908513605594635,0.051795899868011475,2015-11-05,28957
425,china envisions network of national parks with us as a model,0.2048291712999344,0.007396775763481855,0.7877740263938904,2015-11-06,35667
426,vladimir putin on visit to italy criticizes ukraine sanctions,0.019122524186968803,0.9122728705406189,0.06860458105802536,2015-11-06,35716
427,jordan syria tourism conflict,0.03453840687870979,0.18823987245559692,0.7772216796875,2015-11-06,35708
428,changing leadership at fox,0.05960169807076454,0.05230214446783066,0.8880961537361145,2015-11-06,36105
429,germanwings crash victims remains 44 home,0.029550809413194656,0.4993290305137634,0.4711202085018158,2015-11-06,35654
430,today in politics mitt romney conference promises donors and early morning hikes,0.33445802330970764,0.0346866212785244,0.6308553218841553,2015-11-06,35911
431,after week of turmoil chinese stocks post further gains,0.5660197734832764,0.3849756121635437,0.049004681408405304,2015-11-07,42112
432,china detains rights lawyers prompting talk of a crackdown,0.039153456687927246,0.8533718585968018,0.10747462511062622,2015-11-07,42172
433,un warning of migrant crisis in greece urges europe to take action,0.1813156008720398,0.2408977448940277,0.5777866840362549,2015-11-07,42173
434,ted cruz gets a boost in mississippi from a tea party stalwart,0.8812976479530334,0.03075128234922886,0.08795104920864105,2015-11-08,47691
435,china yuan devaluation in exports economy stock market,0.04123402386903763,0.16802339255809784,0.7907425165176392,2015-11-08,47730
436,drawings of police torturing a suspect captivate china,0.062107279896736145,0.31941941380500793,0.6184733510017395,2015-11-08,47480
437,china lowers value of its currency as economic slowdown raises concerns,0.018439006060361862,0.9545757174491882,0.026985324919223785,2015-11-08,47561
438,donald trump pivoting toward policy urges simpler tax code,0.11164934188127518,0.3937608003616333,0.4945898652076721,2015-11-08,47620
439,warren buffett bucks trends with precision castparts acquisition,0.2812749147415161,0.034972015768289566,0.6837531328201294,2015-11-08,47495
440,brazils economic crisis intensifies raising pressure on president,0.04699552059173584,0.9118835926055908,0.04112086817622185,2015-11-09,53901
441,a venezuelan in silicon valley finds a niche in finance,0.16584214568138123,0.017236560583114624,0.8169212937355042,2015-11-09,53898
442,donald trump says ukraine crisis reflects obamas weakness,0.04394037649035454,0.4534154236316681,0.5026441812515259,2015-11-09,54257
443,change to bank rules could spur political fight in a crisis,0.06670983135700226,0.6241016387939453,0.3091885447502136,2015-11-09,53793
444,migrant crisis hungary,0.017905166372656822,0.7932654023170471,0.1888294517993927,2015-11-09,53714
445,the refugee crisis in europe how is asylum granted,0.03250205144286156,0.07641886174678802,0.8910791277885437,2015-11-10,61114
446,message from chinas leader xi jinping to north korea may signal thaw,0.26408717036247253,0.4201144278049469,0.3157983720302582,2015-11-10,61107
447,letters finishing the business,0.06221424788236618,0.037576910108327866,0.9002088904380798,2015-11-10,60733
448,retirement investors riding out the panic,0.18918409943580627,0.21802234649658203,0.5927935838699341,2015-11-10,60952
449,in 3rd quarter investors rode the rapids after stocks plunged,0.3987378180027008,0.36967581510543823,0.23158638179302216,2015-11-10,60928
450,republican debate fox business,0.034957949072122574,0.03815213218331337,0.926889955997467,2015-11-11,68293
451,fox business networks debate is a step up in some ways,0.18426816165447235,0.04532615467905998,0.7704057097434998,2015-11-11,68305
452,united delta deal at newark opposed by justice department,0.06769637018442154,0.48298734426498413,0.4493163228034973,2015-11-11,68177
453,china markets xi jinping,0.04462576285004616,0.025039905682206154,0.9303343296051025,2015-11-11,68134
454,stabbing israeli palestinian conflict,0.04642165079712868,0.30592310428619385,0.6476553082466125,2015-11-11,68253
455,korean war memorial foundation wonders where the us corporate aid is,0.04950026795268059,0.02535390853881836,0.9251458048820496,2015-11-11,68212
456,fear of terrorism lifts donald trump in new york times cbs poll,0.06461740285158157,0.05511339753866196,0.8802691698074341,2015-11-12,74633
457,china smog face mask,0.02871789038181305,0.3476080894470215,0.6236740350723267,2015-11-12,74411
458,china smog challenge,0.02789025567471981,0.3026825785636902,0.6694270968437195,2015-11-12,74484
459,seeking to reduce debt glencore may pursue ipo of agricultural business,0.24152137339115143,0.012935890816152096,0.7455427050590515,2015-11-12,74506
460,chairman of fosun group of china is said to be missing,0.022233828902244568,0.07169695943593979,0.9060692191123962,2015-11-12,74543
461,russia airline crash egypt,0.02088710479438305,0.7876782417297363,0.19143462181091309,2015-11-12,74546
462,china pu zhiqiang trial,0.04719701409339905,0.04535161331295967,0.907451331615448,2015-11-12,74445
463,japanese americans imprisoned but unbowed during world war two,0.08705403655767441,0.4767821431159973,0.4361637830734253,2015-11-12,74707
464,Chinas Coastal Cities Underwater,0.05831385403871536,0.023417135700583458,0.9182690382003784,2015-11-12,74716
465,expecting warm embrace rei chief is harangued in reddit forum,0.046101585030555725,0.6278024911880493,0.3260958790779114,2015-11-13,68879
466,medal of honor awarded to army captain who tackled bomber in afghanistan,0.6253857612609863,0.058727093040943146,0.3158871531486511,2015-11-13,68699
467,a refugee crisis in lebanon hides in plain sight,0.02379753440618515,0.7784469127655029,0.19775556027889252,2015-11-13,68696
468,aung san suu kyis china and myanmar relations,0.0585637167096138,0.022667931392788887,0.9187684059143066,2015-11-13,68650
469,anheuser busch inbevs plan to finance beer deal,0.08113747835159302,0.008970001712441444,0.9098924398422241,2015-11-13,68731
470,volkswagen offering amnesty asks workers to come forward on emissions cheating,0.09082236140966415,0.04725098982453346,0.8619266748428345,2015-11-13,68678
471,nancy pelosi made rare visit to tibet china says,0.1476151943206787,0.01873108185827732,0.8336536884307861,2015-11-13,68630
472,china rights lawyers abuse amnesty international,0.04406886175274849,0.5080690979957581,0.44786202907562256,2015-11-13,68635
473,a global academys crash course makes angels out of investors,0.04647517949342728,0.5943171977996826,0.3592076301574707,2015-11-13,68774
474,us sanctions 4 north koreans including myanmar envoy,0.021451687440276146,0.8863835334777832,0.09216474741697311,2015-11-14,69039
475,china one child policy loneliest generation,0.05162477120757103,0.3714250922203064,0.5769501328468323,2015-11-14,68882
476,we should declare war in fight against islamic state jeb bush says,0.09334590286016464,0.04333820194005966,0.8633158802986145,2015-11-15,69327
477,invoking nazis marco rubio hits hillary clinton for not saying u s at war with radical islam,0.045265793800354004,0.7880086898803711,0.1667255163192749,2015-11-15,69319
478,attackers possible link to migrant trail heightens security fears,0.06114479526877403,0.8042224049568176,0.13463285565376282,2015-11-15,69251
479,parisians fear attacks will divide not unite the city,0.02628856711089611,0.8492262959480286,0.12448519468307495,2015-11-15,69240
480,egyptian leaders blame a familiar foe conspiracy but citizens are dubious,0.10939782857894897,0.5493637323379517,0.34123843908309937,2015-11-15,69205
481,attacks in paris add urgency to talks on ending syria war,0.2293354868888855,0.49414771795272827,0.27651679515838623,2015-11-15,69179
482,paris terrorist attacks,0.02654394693672657,0.5760183334350586,0.3974376916885376,2015-11-15,69167
483,measuring how financial advisers handle uncertainty,0.04100320488214493,0.02930217981338501,0.929694652557373,2015-11-16,69492
484,japan economy contracts 0 8 returning to recession,0.2234271764755249,0.697059690952301,0.07951311767101288,2015-11-16,69365
485,tensions in iran after nuclear deal grow in hostility,0.13853290677070618,0.7759053111076355,0.08556178212165833,2015-11-16,69363
486,blacks are challenged to buy from black owned businesses to close gap,0.01937248557806015,0.835973858833313,0.14465364813804626,2015-11-16,69356
487,retailers earnings the star wars battlefront video game and 2 technology ipos,0.10287678986787796,0.020958710461854935,0.8761645555496216,2015-11-16,69375
488,efforts to rein in arbitration come under well financed attack,0.3949177861213684,0.020711278542876244,0.5843709707260132,2015-11-16,69322
489,review incident at vichy an arthur miller tale set in world war ii,0.0876869484782219,0.07631143182516098,0.8360016942024231,2015-11-16,69389
490,on invading iraq bernie sanders takes a cue from howard dean,0.04150010272860527,0.05627546086907387,0.9022244811058044,2015-11-17,69754
491,the vile politics of the syrian refugee crisis,0.030288390815258026,0.21058529615402222,0.7591262459754944,2015-11-17,69727
492,china bends vow using prisoners organs for transplants,0.1380501389503479,0.022839320823550224,0.8391104936599731,2015-11-17,69530
493,after paris attacks a darker mood toward islam emerges in france,0.035314422100782394,0.8304538726806641,0.13423170149326324,2015-11-17,69557
494,japans economy feels the sting of chinas slowdown,0.05090510472655296,0.8727096915245056,0.07638518512248993,2015-11-17,69469
495,china faces sharp questioning by un panel on torture,0.049061328172683716,0.6094648838043213,0.3414737284183502,2015-11-18,69722
496,guinea last nation with ebola may soon be declared free of virus,0.08853345364332199,0.09512537717819214,0.8163411021232605,2015-11-18,69709
497,stethem us navy ship china,0.03645797818899155,0.042631663382053375,0.9209102988243103,2015-11-18,69655
498,obama philippines south china sea military aid ship,0.1699189990758896,0.027698654681444168,0.8023823499679565,2015-11-18,69646
499,a martha stewart store makes a leap to amazon,0.10945530235767365,0.016435639932751656,0.8741090893745422,2015-11-18,69822
