,Headline,Positive,Negative,Neutral,date,article_id
383,morning agenda bad behavior in finance persists study says,0.021761316806077957,0.9078589677810669,0.07037976384162903,2015-05-19,30902
384,chinas housing market shows signs of hope,0.9198811650276184,0.04983435198664665,0.03028441034257412,2015-05-19,30704
385,clinton friends libya role blurs lines of politics and business,0.025447921827435493,0.12666000425815582,0.8478920459747314,2015-05-19,30777
386,for greeks uncertainty on next paycheck and countrys future,0.020711403340101242,0.09647299349308014,0.8828155398368835,2015-05-19,30814
387,macedonias leaders unable to resolve festering crisis,0.01956735923886299,0.9166134595870972,0.06381922215223312,2015-05-19,30729
388,hillary clinton says law is hurting small banks and businesses,0.011268199421465397,0.9635257124900818,0.025206049904227257,2015-05-20,31042
389,palestinians plan new tack against israel soccer sanctions,0.17367194592952728,0.02003532089293003,0.806292712688446,2015-05-20,31023
390,document malaysia indonesia thailand statement on asia migrants crisis,0.058154501020908356,0.021520722657442093,0.9203248023986816,2015-05-20,31105
391,china is investing billions in the us despite tensions between the governments,0.8599429726600647,0.01216239482164383,0.12789462506771088,2015-05-20,31094
392,north korea claims it has built small nuclear warheads,0.13054785132408142,0.03233615309000015,0.837116003036499,2015-05-21,31179
393,china west africa fishing greenpeace,0.04218921810388565,0.026794591918587685,0.931016206741333,2015-05-21,31161
394,flash crash navinder singh sarao bail,0.048554982990026474,0.05243499577045441,0.8990099430084229,2015-05-21,31160
395,zipcap business loans based on loyalty,0.030444802716374397,0.01984114572405815,0.9497140645980835,2015-05-21,31188
396,clinton posts her business bona fides on linkedin,0.026842456310987473,0.0215002354234457,0.9516572952270508,2015-05-21,31405
397,guilty pleas and heavy fines seem to be cost of business for wall st,0.05713164061307907,0.6543034315109253,0.28856492042541504,2015-05-21,31251
398,chechen leaders advice on women lock them in,0.03596263751387596,0.3332540690898895,0.6307833194732666,2015-05-21,31322
399,hewlett packard sells 51 stake in china unit to tsinghua university,0.02901034615933895,0.024473823606967926,0.9465157985687256,2015-05-22,31440
400,myanmar rohingya migrant crisis malaysia thailand indonesia,0.021582258865237236,0.6678795218467712,0.31053823232650757,2015-05-22,31446
401,food companies fear avian flu may cause egg shortages,0.014037794433534145,0.8939319252967834,0.09203030914068222,2015-05-22,31411
402,nsa phone data collection extension splits senate,0.04402482882142067,0.03338082134723663,0.9225943684577942,2015-05-22,31584
403,americans start to leave air base in azores and locals fear economic impact,0.010679848492145538,0.9449504017829895,0.04436979442834854,2015-05-22,31576
404,hsbc considering strategic options for brazil business,0.13524667918682098,0.010035335086286068,0.8547179698944092,2015-05-23,31655
405,the risks and rewards of self managing investment portfolios,0.06825245171785355,0.016868343576788902,0.9148792028427124,2015-05-23,31761
406,tensions persist at eu meeting focused on ex soviet lands,0.03204445540904999,0.8875003457069397,0.08045519888401031,2015-05-23,31840
407,a drug smugglers times square visit for pleasure not business,0.09361646324396133,0.05224354565143585,0.8541399836540222,2015-05-23,31814
408,hillary clinton acutely aware of pitfalls avoids press on campaign trail,0.061350006610155106,0.42388346791267395,0.5147665143013,2015-05-23,31691
409,hong kong and china to connect investment fund markets,0.30632340908050537,0.007451826240867376,0.6862247586250305,2015-05-23,31673
410,scoping out a phantom recession,0.03371977433562279,0.10658536851406097,0.8596948385238647,2015-05-24,31941
411,with victories isis dispels hope of a swift decline,0.5013753771781921,0.060925938189029694,0.4376986026763916,2015-05-24,32000
412,a finance minister fit for a greek tragedy,0.09885458648204803,0.23920820653438568,0.6619371771812439,2015-05-24,31127
413,taliban and afghan peace officials have secret talks in china,0.09271541237831116,0.09468968212604523,0.8125948905944824,2015-05-26,32185
414,illinois pension crisis,0.026015542447566986,0.04041474312543869,0.9335697889328003,2015-05-26,32194
415,charter time warner cable deal,0.03710805997252464,0.022546686232089996,0.9403452277183533,2015-05-26,32193
416,fire kills 38 at seniors home in china,0.015839822590351105,0.8877196311950684,0.09644057601690292,2015-05-26,32255
417,charter communications agrees to acquire time warner cable,0.09548985958099365,0.01536353025585413,0.8891466856002808,2015-05-27,32292
418,supreme court rules on whistle blower case and bankruptcy judges,0.01881607435643673,0.18303771317005157,0.7981462478637695,2015-05-27,32378
419,electronic medical record sharing is hurt by business rivalries,0.008879542350769043,0.9678998589515686,0.023220635950565338,2015-05-27,32361
420,time warner cable finds that money covers charters flaws,0.11791342496871948,0.06333636492490768,0.818750262260437,2015-05-27,32348
421,china updating military strategy puts focus on projecting naval power,0.23649834096431732,0.01047475729137659,0.7530269026756287,2015-05-27,32395
422,myanmar bangladesh rohingya migrant crisis shows signs of ebbing,0.03076883591711521,0.9388525485992432,0.030378662049770355,2015-05-27,32308
423,france rejects iran leaders ban on unlimited nuclear inspections,0.10859174281358719,0.24144962430000305,0.6499586701393127,2015-05-28,32591
424,migrant crisis indonesia rohingya bangladesh,0.018111886456608772,0.7878715395927429,0.19401660561561584,2015-05-28,32549
425,us urges european leaders to solve greek crisis quickly,0.8516930937767029,0.029680054634809494,0.11862685531377792,2015-05-28,32565
426,chinas high hopes for growing those rubber tree plants,0.6175323128700256,0.0099678635597229,0.37249985337257385,2015-05-28,32676
427,us rebukes china on efforts to build artificial islands,0.028348533436655998,0.9114082455635071,0.06024323031306267,2015-05-28,32680
428,finance officials focus on economic growth at group of 7 meeting,0.137017160654068,0.028417766094207764,0.8345650434494019,2015-05-29,32837
429,chinas publishers court america as its authors scorn censorship,0.04196479544043541,0.6182510256767273,0.3397842347621918,2015-05-29,32959
430,families press for changes in policy on terrorist hostages,0.10513907670974731,0.20346367359161377,0.6913972496986389,2015-05-30,33288
431,obama warns the senate to pass surveillance law,0.28134623169898987,0.1842050403356552,0.5344487428665161,2015-05-30,33276
432,an award for bill clinton came with 500000 for his foundation,0.6851274371147156,0.014273199252784252,0.3005993664264679,2015-05-30,33008
433,indian university suspends student group accused of spreading hatred toward modi,0.016837090253829956,0.9006035923957825,0.08255936205387115,2015-05-30,33246
434,feared hollywood reporter turns to fiction,0.055243346840143204,0.05005328729748726,0.8947033286094666,2015-05-30,33267
435,edward p gilligan american express executive dies at 55,0.0234530009329319,0.23433107137680054,0.7422159910202026,2015-05-30,33190
436,ukrainian migrants fleeing conflict get a cool reception in europe,0.7264036536216736,0.0362386479973793,0.23735769093036652,2015-05-31,33388
437,building of islands is debated but china and us skirt conflict at talks,0.047454919666051865,0.48763468861579895,0.4649103283882141,2015-05-31,33390
438,vladimir katriuk accused of war crimes is dead at 93,0.03244473412632942,0.6300012469291687,0.33755406737327576,2015-05-31,33279
439,afghan police chief long a taliban target faces a new emotion fear,0.06060512363910675,0.5838900208473206,0.3555048108100891,2015-05-31,33357
440,cashing in on a charter time warner cable merger,0.11314418166875839,0.012591400183737278,0.8742644190788269,2015-05-31,33358
441,francois hollande says destabilizing sanctions on russia must stop now,0.0418204702436924,0.518146276473999,0.4400332272052765,2015-06-01,697
442,obama invites congressional leaders to white house,0.036772988736629486,0.029891017824411392,0.9333359599113464,2015-06-01,940
443,for mario cuomo no shunning of tension between faith and politics,0.21681106090545654,0.0325002446770668,0.7506887316703796,2015-06-01,652
444,indonesia cracks down on aviation sector after airasia crash,0.02093176357448101,0.9405838251113892,0.03848445415496826,2015-06-01,658
445,china issues complaint after north korean defector is said to kill 4,0.04399505630135536,0.8759557604789734,0.08004909753799438,2015-06-01,640
446,falling euro fans fears of a regional slowdown,0.07395331561565399,0.9062613844871521,0.019785357639193535,2015-06-01,750
447,finance ministers for greece and germany find little commonality,0.05409140884876251,0.43848660588264465,0.5074220299720764,2015-06-02,7867
448,obama budgets call for increased funding for nhtsa faces uncertainty,0.9360883831977844,0.01871388964354992,0.045197710394859314,2015-06-02,8029
449,china holds canadian on suspicion of stealing state secrets,0.04922809824347496,0.549324631690979,0.40144720673561096,2015-06-02,7863
450,transasia airways crash,0.043478500097990036,0.023623209446668625,0.932898223400116,2015-06-02,7824
451,kerry biden hollande merkel ukraine conflict,0.07750900089740753,0.12324225157499313,0.7992487549781799,2015-06-02,7834
452,us business group urges resistance to chinese policy,0.2776036858558655,0.13440868258476257,0.5879876017570496,2015-06-02,8048
453,abbvie wins bidding war for maker of cancer drug then goes on defensive,0.45024341344833374,0.015960345044732094,0.5337962508201599,2015-06-03,14516
454,as clinton stumbles conservatives stir democrats pot,0.105288065969944,0.7213737964630127,0.1733381152153015,2015-06-03,14792
455,mayor de blasio appeals to businesses to raise workers pay,0.7660479545593262,0.1315760761499405,0.10237591713666916,2015-06-03,14493
456,review in unfinished business vince vaughn and sienna miller are rivals,0.04428522288799286,0.112131766974926,0.8435829877853394,2015-06-03,14509
457,with nemtsovs killing a leadership void widens for russias opposition,0.019124388694763184,0.9080234169960022,0.07285220175981522,2015-06-03,14477
458,jeb bush listed himself as hispanic on voter form,0.03069334104657173,0.09462547302246094,0.8746811747550964,2015-06-04,21448
459,06chinadetain 3,0.04854261502623558,0.02069397270679474,0.9307634234428406,2015-06-04,21427
460,china escalates hollywood partnerships aiming to compete one day,0.09951791167259216,0.2025606334209442,0.6979214549064636,2015-06-04,21324
461,comcast recruits its beneficiaries to lobby for time warner deal,0.4420430660247803,0.010847760364413261,0.5471092462539673,2015-06-04,21326
462,hillary clinton puts white house in awkward position on immigration,0.020482981577515602,0.8573644161224365,0.12215263396501541,2015-06-05,28131
463,document preliminary report on the germanwings flight 9525 crash,0.03279062360525131,0.0199787188321352,0.9472306370735168,2015-06-05,28008
464,returning the spoils of world war ii taken by our side,0.13266199827194214,0.013362005352973938,0.8539760112762451,2015-06-05,27802
465,shanghai enacts curbs on business dealings of officials relatives,0.02266705222427845,0.5955653190612793,0.3817676603794098,2015-06-05,27784
466,palestinians unpaid electric bills in the west bank thicken tension with israel,0.01303080189973116,0.950664222240448,0.036304958164691925,2015-06-05,27925
467,bankers and regulators voice fears on bond market volatility,0.014890347607433796,0.9314854741096497,0.05362418666481972,2015-06-05,27918
468,us offers millions in rewards for information on isis leaders,0.7782191634178162,0.01834254339337349,0.20343828201293945,2015-06-05,27946
469,al jazeera network in turmoil is now the news,0.06615984439849854,0.17364352941513062,0.7601965665817261,2015-06-05,27936
470,excessive demands at work create a humanitarian crisis,0.011612707749009132,0.9255651235580444,0.06282204389572144,2015-06-06,34696
471,south korea mers virus st marys hospital,0.08063362538814545,0.03281865268945694,0.8865476846694946,2015-06-06,34601
472,high inflation exacerbates ukraines troubled situation,0.037368807941675186,0.9220656156539917,0.040565624833106995,2015-06-06,34584
473,arizona school budgets stretched by recession politics and policy,0.011642398312687874,0.9437928199768066,0.044564779847860336,2015-06-06,34582
474,video of mexican prison riot highlights a crisis as elections near,0.05582790449261665,0.657324492931366,0.28684762120246887,2015-06-06,34580
475,nepal more victims reported in helicopter crash,0.031769730150699615,0.7743580937385559,0.19387219846248627,2015-06-06,34808
476,ben carsons nascent campaign faces personnel turmoil,0.00929874274879694,0.9368528723716736,0.053848352283239365,2015-06-06,34927
477,china market turmoil,0.0371687076985836,0.1521967500448227,0.8106346130371094,2015-06-07,41538
478,chinas market rout is a double threat,0.03900337219238281,0.48250165581703186,0.4784950315952301,2015-06-07,41337
479,iran nuclear negotations john kerry warning,0.03901621326804161,0.07894445210695267,0.8820393681526184,2015-06-07,41349
480,war veterans lead the way in reconciling former enemies,0.23451006412506104,0.016620274633169174,0.7488696575164795,2015-06-07,41382
481,egypt warns journalists over coverage of militant attacks,0.0200700294226408,0.8805693984031677,0.09936060756444931,2015-06-07,41377
482,myanmar rohingya refugee crisis malaysia,0.016188452020287514,0.8296512365341187,0.15416021645069122,2015-06-07,41391
483,greek referendum debt crisis vote,0.021755922585725784,0.7183941006660461,0.25985002517700195,2015-06-07,41330
484,john kerry urges beijing to halt problematic actions in south china sea during asean meeting,0.07895895093679428,0.573824405670166,0.34721657633781433,2015-06-08,46358
485,us imposes sanctions on 2 qataris for qaeda ties,0.014633826911449432,0.9149357080459595,0.07043043524026871,2015-06-08,46546
486,jon stewart a sarcastic critic of politics and media signs off,0.04079335555434227,0.5452479720115662,0.41395872831344604,2015-06-08,46543
487,q and a the migrant crisis in calais,0.04596186801791191,0.13389548659324646,0.8201426267623901,2015-06-08,46378
488,conflicting claims cloud irans financial gain in nuclear deal,0.07320886105298996,0.6190727353096008,0.307718425989151,2015-06-08,46507
489,obama urges critics of iran deal to ignore drumbeat of war,0.0603691041469574,0.09346312284469604,0.846167802810669,2015-06-08,46453
490,france reimburses russia for warships as deal becomes casualty of ukraine sanctions,0.46586698293685913,0.41076499223709106,0.12336805462837219,2015-06-08,46493
491,disney time warner media investors worry about tvs future,0.01712011732161045,0.7996304035186768,0.18324953317642212,2015-06-08,46497
492,china ordains bishop joseph zhang yinlin,0.040299639105796814,0.029019391164183617,0.9306809306144714,2015-06-08,46393
493,rand paul associate jesse benton indicted on 2012 campaign finance charges,0.02871207520365715,0.8004704117774963,0.17081747949123383,2015-06-08,46452
494,tim blanks joins the industry website the business of fashion,0.047338321805000305,0.027759568765759468,0.9249021410942078,2015-06-08,46408
495,stephen schwarzman of blackstone feels the agony of victory,0.07372058928012848,0.10407225787639618,0.8222071528434753,2015-06-09,52553
496,migrant crisis austria hungary germany,0.022655127570033073,0.6652398705482483,0.3121050298213959,2015-06-09,52784
497,gulf monarchies bristle at criticism over response to syrian refugee crisis,0.013948386535048485,0.9523128867149353,0.033738747239112854,2015-06-09,52832
498,dispute over a burial reveals palestinian divisions,0.03009355068206787,0.7617634534835815,0.20814290642738342,2015-06-10,59928
499,american apparel files for bankruptcy,0.015426461584866047,0.7195911407470703,0.2649823725223541,2015-06-10,59687
