,Headline,Positive,Negative,Neutral,date,article_id
219,1967 business leaders involved in covert c i a operations,0.04359333962202072,0.03238413482904434,0.9240224957466125,2017-02-17,8164
220,best tax software reviews,0.11011423915624619,0.01847490295767784,0.8714108467102051,2017-02-17,8226
221,north korea china coal imports suspended,0.057889197021722794,0.02254621498286724,0.9195645451545715,2017-02-18,8389
222,china bird flu,0.0435708723962307,0.10818742960691452,0.8482416868209839,2017-02-18,8388
223,donald trump visits mar a lago businesses,0.08533941954374313,0.03016640990972519,0.8844941258430481,2017-02-19,8542
224,eu revisits greek crisis and the fed releases meeting details,0.02759500965476036,0.21128852665424347,0.7611163854598999,2017-02-19,8554
225,the rise and decline of the hedge fund billionaire,0.05664132162928581,0.2461882382631302,0.6971703767776489,2017-02-19,8462
226,fec elections ann ravel campaign finance,0.025446657091379166,0.04938312992453575,0.9251701831817627,2017-02-19,8485
227,xinjiang china police rallies,0.032214630395174026,0.3883727490901947,0.5794126987457275,2017-02-20,8673
228,climate change dispute john bates,0.1340017169713974,0.05680752545595169,0.8091907501220703,2017-02-20,8668
229,russia syria war,0.023688366636633873,0.09430743753910065,0.8820042014122009,2017-02-20,8619
230,donald trump trademarks china,0.022494586184620857,0.09448767453432083,0.8830177783966064,2017-02-21,8864
231,china traffic scam fraud,0.02003629505634308,0.39348527789115906,0.5864784121513367,2017-02-21,8729
232,china north korea trump talks,0.0532434843480587,0.06500302255153656,0.8817535042762756,2017-02-21,8733
233,australian plane crash,0.03500933572649956,0.31783342361450195,0.6471572518348694,2017-02-21,8796
234,anwar awlaki underwear bomber abdulmutallab,0.10839685052633286,0.4389544725418091,0.45264866948127747,2017-02-22,9056
235,hispanic leaders plan fight against trumps agenda,0.19783376157283783,0.023641446605324745,0.7785248160362244,2017-02-22,8938
236,china politics xi jinping,0.03295501321554184,0.04215076565742493,0.9248942732810974,2017-02-22,8905
237,china feminist weibo,0.04684989154338837,0.030309947207570076,0.9228401780128479,2017-02-22,8908
238,mexico city canals xochimilco chinampas,0.03154485300183296,0.05989370122551918,0.9085614681243896,2017-02-22,8946
239,north korea china,0.03790344297885895,0.04389670118689537,0.918199896812439,2017-02-23,9285
240,china green card stephon marbury,0.08276697993278503,0.04149924963712692,0.8757337331771851,2017-02-23,9109
241,warm weather hurts winter businesses,0.2143857479095459,0.2005803883075714,0.5850338935852051,2017-02-24,9500
242,china xinjiang gps vehicles,0.03484760969877243,0.025269843637943268,0.9398825764656067,2017-02-24,9501
243,china north korea relations kim jong un,0.12731516361236572,0.03168162330985069,0.8410032391548157,2017-02-24,9331
244,china banks guo shuqing,0.05606299638748169,0.028485851362347603,0.9154512286186218,2017-02-24,9295
245,in bulgaria a businessman who talks like trump acts like trump,0.03126821666955948,0.04610288515686989,0.9226288795471191,2017-02-24,9354
246,playing poker with world war ii and vietnam,0.044747244566679,0.08089656382799149,0.8743561506271362,2017-02-25,9584
247,warren buffett annual letter,0.03087720088660717,0.050623055547475815,0.918499767780304,2017-02-25,9560
248,trump press conflict,0.032890066504478455,0.04497649893164635,0.9221333861351013,2017-02-25,9563
249,after shootings indians are wary of move to us in age of trump,0.05456205829977989,0.16415122151374817,0.7812867164611816,2017-02-26,9663
250,academy awards ratings viewership abc,0.08578404039144516,0.07597963511943817,0.8382363319396973,2017-02-27,9868
251,china tibet buddhists larung gar,0.04782307520508766,0.04107663407921791,0.9111003279685974,2017-02-27,9874
252,ethereum alliance business banking security,0.03075615130364895,0.02277083694934845,0.9464730024337769,2017-02-27,9853
253,lse deutsche borse herbalife warren buffett,0.03161022439599037,0.04735454544425011,0.9210351705551147,2017-02-27,9775
254,united states travel restrictions 2026 world cup bid uefa,0.033641405403614044,0.03810369595885277,0.9282549023628235,2017-02-27,9734
255,addressing corporate conflicts in the trump era,0.07413364201784134,0.026217440143227577,0.899648904800415,2017-02-27,9816
256,united nations security council syria sanctions russia trump,0.029486697167158127,0.7050908207893372,0.265422523021698,2017-02-28,9986
257,bitcoin price soars fueled by speculation and global currency turmoil,0.0361052080988884,0.9210415482521057,0.042853206396102905,2017-03-01,316
258,donald trump business,0.04394135624170303,0.06817692518234253,0.8878817558288574,2017-03-02,5863
259,ukraine russia conflict avdiivka,0.04453536495566368,0.13874657452106476,0.8167181015014648,2017-03-02,5818
260,immigration order business iran iraq,0.020345432683825493,0.1406705677509308,0.838983952999115,2017-03-02,5832
261,iran sanctions trump,0.03401027247309685,0.29993322491645813,0.6660565137863159,2017-03-02,5724
262,arabella kushner ivanka trump china song,0.04445844888687134,0.041991859674453735,0.9135497212409973,2017-03-02,5730
263,schwarzenegger citing baggage to leave celebrity apprentice,0.02645915560424328,0.6506898999214172,0.32285088300704956,2017-03-03,10701
264,brazils leaders tout austerity just not for them,0.09146876633167267,0.04176013916730881,0.8667711019515991,2017-03-03,10672
265,syria civil war un talks mediator assad,0.05584675818681717,0.14303141832351685,0.8011218905448914,2017-03-03,10758
266,corner office deryl mckissack management leadership,0.020917203277349472,0.0851607620716095,0.8939220309257507,2017-03-03,10617
267,china fake news xie,0.026440588757395744,0.057520877569913864,0.9160385131835938,2017-03-03,10625
268,the three different flavors of family businesses,0.05953266844153404,0.032771967351436615,0.9076953530311584,2017-03-03,10642
269,china economic zone xiongan,0.036902401596307755,0.035584501922130585,0.927513062953949,2017-03-04,15883
270,maoists for trump in china fans admire his nationalist views,0.2473369687795639,0.03245452046394348,0.720208466053009,2017-03-04,15887
271,north korea nuclear trump china,0.027193685993552208,0.28288909792900085,0.689917266368866,2017-03-04,15853
272,study disputes success of chinas 100 billion forest effort,0.586299479007721,0.011875701136887074,0.4018247723579407,2017-03-05,20957
273,trump duterte xi south china sea,0.03418320044875145,0.04265327751636505,0.9231635332107544,2017-03-05,20976
274,china hna group,0.02832997590303421,0.032946694642305374,0.9387233257293701,2017-03-05,20932
275,markets vix volatility finsbury,0.0333574041724205,0.03863930329680443,0.9280033111572266,2017-03-05,20924
276,nytaustralia8 two different australias john howard ben shewry darwin,0.04575573652982712,0.05302208662033081,0.9012222290039062,2017-03-05,21062
277,china finance leeco debt shadow banking,0.016682341694831848,0.06297562271356583,0.920341968536377,2017-03-06,26384
278,trump plans to shift infrastructure funding to cities states and business,0.31293830275535583,0.010815552435815334,0.6762461066246033,2017-03-06,26426
279,afghanistan war trump,0.02730153314769268,0.5035672783851624,0.46913114190101624,2017-03-06,26444
280,republican leaders climate change,0.043117038905620575,0.03639964014291763,0.9204832911491394,2017-03-06,26424
281,1967 arab israeli war nuclear warning,0.03642561659216881,0.36915117502212524,0.594423234462738,2017-03-06,26422
282,india zika virus,0.05707884207367897,0.026578012853860855,0.916343092918396,2017-03-06,26401
283,trump xi jinping china north korea,0.03677944466471672,0.06370848417282104,0.899511992931366,2017-03-07,31398
284,germany bus crash,0.03337649255990982,0.3175848722457886,0.6490386724472046,2017-03-07,31431
285,britain brexit supermarket inflation,0.033014047890901566,0.6890295743942261,0.27795636653900146,2017-03-08,36382
286,virtual reality star wars attractions coming to disney malls,0.05512211471796036,0.025623593479394913,0.9192543029785156,2017-03-08,36383
287,china internet censorship,0.022643789649009705,0.04210403189063072,0.9352521896362305,2017-03-08,36390
288,amid store closings businesses protest a city tax on rents,0.013745547272264957,0.9444776773452759,0.041776809841394424,2017-03-08,36505
289,kushner eb 5 china green cards,0.14544975757598877,0.013916551135480404,0.8406336903572083,2017-03-08,36475
290,north korea nuclear test china xi jinping,0.03435621038079262,0.08236418664455414,0.8832796216011047,2017-03-09,41169
291,quillen small business michigan,0.02986845001578331,0.048745620995759964,0.9213859438896179,2017-03-09,41196
292,massacre of mankind sequel to war of worlds stephen baxter,0.035270437598228455,0.12919877469539642,0.8355308175086975,2017-03-09,41176
293,syria war crime,0.035470832139253616,0.4594184160232544,0.5051108002662659,2017-03-10,46305
294,states acting to protect buyers of seller financed homes,0.033119842410087585,0.04473597928881645,0.9221441745758057,2017-03-10,46289
295,gun stocks vegas shooting trump,0.04009602591395378,0.27533987164497375,0.6845641136169434,2017-03-10,46318
296,cma awards politics,0.04774533957242966,0.038831282407045364,0.9134233593940735,2017-03-11,51636
297,spain catalonia puigdemont warrant,0.03144512325525284,0.03299175947904587,0.9355631470680237,2017-03-11,51657
298,china opioid fentanyl trump,0.04753740131855011,0.035433534532785416,0.917029082775116,2017-03-11,51556
299,tax business winners losers,0.07462384551763535,0.03959343209862709,0.885782778263092,2017-03-11,51563
300,syria war rebuilding homs,0.04450204223394394,0.4327941834926605,0.5227038264274597,2017-03-12,56300
301,china artificial intelligence,0.034339889883995056,0.030810493975877762,0.9348496794700623,2017-03-12,56295
302,china internet censorship wang huning,0.0239302646368742,0.10709568858146667,0.8689740300178528,2017-03-12,56247
303,trudeau trade china nafta tpp,0.04918757453560829,0.021983742713928223,0.9288286566734314,2017-03-12,56276
304,australia us china alliances,0.04085215926170349,0.025127029046416283,0.9340208172798157,2017-03-12,56275
305,karl marx statue trier germany china,0.038597848266363144,0.02686411328613758,0.9345380663871765,2017-03-13,12345
306,raimondo rhode island economy new business,0.04355324059724808,0.050477806478738785,0.9059689044952393,2017-03-13,12336
307,puerto rico debt crisis oversight board,0.022558650001883507,0.09836459159851074,0.8790767192840576,2017-03-13,12321
308,nyc business improvement districts,0.04717608541250229,0.042808257043361664,0.9100156426429749,2017-03-13,12212
309,how to combine a business trip with a vacation,0.06505633890628815,0.017729157581925392,0.9172145128250122,2017-03-14,12384
310,iceland economy finance capital controls,0.06748377531766891,0.013513108715415001,0.9190031290054321,2017-03-14,12357
311,rival bid for moneygram puts jack ma in an awkward spot,0.028318414464592934,0.8488898277282715,0.12279172241687775,2017-03-14,12464
312,northeast snowstorm delays business,0.011720966547727585,0.9103773236274719,0.077901691198349,2017-03-14,12438
313,united states china north korea nuclear missiles,0.023863118141889572,0.12442678958177567,0.8517100214958191,2017-03-15,12588
314,1917 exhibit world war i jewish immigration,0.030273864045739174,0.10363680869340897,0.8660893440246582,2017-03-15,12602
315,china us li keqiang press conference,0.0348389595746994,0.04060962423682213,0.9245513677597046,2017-03-15,12554
316,richard burr mark warner trump wiretap,0.024111948907375336,0.08028435707092285,0.8956036567687988,2017-03-16,12958
317,federal reserve interest rates china mexico,0.06869231909513474,0.08497399091720581,0.8463336825370789,2017-03-16,13017
318,trump us china relations fitzgerald,0.032056935131549835,0.168131485581398,0.799811601638794,2017-03-16,12817
319,mexico trump pena nieto wall drug war,0.053836945444345474,0.6123487949371338,0.33381426334381104,2017-03-16,12815
320,all eyes on china as us signals new tack on north korea,0.22216032445430756,0.1257472038269043,0.6520925164222717,2017-03-17,13207
321,mortgage crisis consumer relief,0.028394022956490517,0.6198737025260925,0.3517322242259979,2017-03-17,13213
322,china tai chi unesco,0.049409832805395126,0.039626169949769974,0.9109639525413513,2017-03-17,13058
323,syria missiles israeli warplanes,0.036928728222846985,0.08093735575675964,0.8821339011192322,2017-03-17,13113
324,china economy debt shadow banking,0.019782857969403267,0.19366365671157837,0.7865535020828247,2017-03-18,13270
325,congo massacre war crimes,0.03856239840388298,0.5901197791099548,0.37131789326667786,2017-03-18,13287
326,donald trump jr business politics hunting twitter vanessa haydon,0.0329369492828846,0.043938133865594864,0.9231249094009399,2017-03-18,13265
327,china trade manufacturing miao wei,0.05999874696135521,0.05035686120390892,0.8896443843841553,2017-03-19,13359
328,volkswagen chief executive emissions warrant,0.050468072295188904,0.03850948065519333,0.911022424697876,2017-03-19,13389
329,china care center deaths,0.0710178017616272,0.019410036504268646,0.9095722436904907,2017-03-20,13572
330,china us trade tariffs,0.062746562063694,0.023476174101233482,0.9137772917747498,2017-03-20,13494
331,china toilet paper theft,0.032775282859802246,0.03325783088803291,0.9339668154716492,2017-03-20,13498
332,breakaway lawyers from kasowitz firm point to conflicts dispute,0.01230998057872057,0.937670111656189,0.05001990869641304,2017-03-21,13713
333,highly unusual the new business as usual,0.15796877443790436,0.01726621575653553,0.8247650861740112,2017-03-21,13720
334,after exiting capital controls iceland still wary of private investors,0.05502891540527344,0.740975022315979,0.20399604737758636,2017-03-21,13727
335,foreign movie box office china mpaa,0.1099846288561821,0.0679318979382515,0.8220834732055664,2017-03-22,13952
336,airbnb china tujia xiaozhu,0.05329611152410507,0.019495366141200066,0.9272085428237915,2017-03-22,13856
337,china to plant green necklace of trees around beijing to fight smog,0.3235642910003662,0.015870599076151848,0.6605651378631592,2017-03-23,14161
338,5 bodies found off libya amid fears that 200 migrants may have drowned,0.019572759047150612,0.924888551235199,0.055538736283779144,2017-03-23,14198
339,document Gorsuch DOJ War on Terror Documents,0.0325043722987175,0.06047845259308815,0.907017171382904,2017-03-23,14075
340,afghan children deprived of school tell of their deepest fears,0.0374094657599926,0.6627857089042664,0.29980480670928955,2017-03-23,14078
341,robert iger disneys ceo agrees to one year extension,0.03820279240608215,0.03056318499147892,0.9312340021133423,2017-03-23,14090
342,germanwings crash father defends andrea lubitz,0.046812087297439575,0.09127072244882584,0.8619171977043152,2017-03-24,14369
343,not leadership material good the world needs followers,0.0701100155711174,0.03222713991999626,0.8976628184318542,2017-03-24,14370
344,turkey human trafficking refugee crisis,0.016589216887950897,0.8019014000892639,0.1815093606710434,2017-03-24,14226
345,china air pollution smog climate change,0.022164981812238693,0.22794771194458008,0.7498872876167297,2017-03-24,14239
346,bill de blasio campaign finance,0.027410132810473442,0.06446926295757294,0.9081206321716309,2017-03-24,14289
347,reuters brevan howard injunction,0.03981786221265793,0.04130852222442627,0.91887366771698,2017-03-24,14334
348,china money outflows country garden,0.022521434351801872,0.8489419221878052,0.1285366714000702,2017-03-24,14363
349,china panda bao bao,0.06020420417189598,0.023731067776679993,0.9160647392272949,2017-03-24,14292
350,the perverse thrill of chaotic times world war ii baby boomers,0.05608056113123894,0.11220236867666245,0.8317170143127441,2017-03-25,14475
351,taiwan lee ming cheh missing china,0.04240785166621208,0.3768162429332733,0.5807758569717407,2017-03-25,14472
352,trump health care defeat gop civil war,0.09235232323408127,0.2952408492565155,0.612406849861145,2017-03-25,14493
353,uber suspends tests of self driving vehicles after arizona crash,0.011380084790289402,0.8818648457527161,0.1067550927400589,2017-03-25,14518
354,park geun hye arrest warrant south korea,0.04540109634399414,0.582189679145813,0.37240925431251526,2017-03-26,14624
355,australia professor feng chongyi china,0.04111166298389435,0.03855406120419502,0.9203343391418457,2017-03-26,14558
356,obamacare repeal small businesses,0.22875019907951355,0.10538613796234131,0.6658636331558228,2017-03-26,14585
357,in protests kremlin fears a young generation stirring,0.01599094085395336,0.8859050869941711,0.09810394048690796,2017-03-27,14778
358,syria crime torture assad war,0.0476086251437664,0.5148014426231384,0.4375899136066437,2017-03-27,14670
359,american airlines china southern deal,0.071762815117836,0.017590008676052094,0.9106472134590149,2017-03-27,14668
360,trump markets stocks dollar,0.025794554501771927,0.036418814212083817,0.9377865791320801,2017-03-27,14684
361,carlos the jackal terrorist paris drugstore attack ,0.026385296136140823,0.2763199210166931,0.6972948312759399,2017-03-28,14959
362,china osama bin laden compound xinjiang,0.024838551878929138,0.41131752729415894,0.5638439059257507,2017-03-28,14834
363,malcolm turnbull china extradition treaty,0.02674720250070095,0.45150065422058105,0.521752119064331,2017-03-28,14815
364,auschwitz antiwar protest sheep,0.044556573033332825,0.49327802658081055,0.4621654450893402,2017-03-28,14874
365,senate intelligence committee burr warner russia investigation,0.03350638225674629,0.03696088492870331,0.9295327067375183,2017-03-29,15117
366,us war footprint grows in middle east,0.4310297667980194,0.2563900351524353,0.3125802278518677,2017-03-29,15174
367,state department worker is accused of hiding ties to china,0.036626849323511124,0.7177450060844421,0.24562819302082062,2017-03-29,15155
368,china taiwan activist lee ming cheh,0.09475704282522202,0.08059973269701004,0.8246433138847351,2017-03-29,15030
369,blackrock fink stocks trading,0.026164589449763298,0.04331732913851738,0.9305181503295898,2017-03-29,15031
370,what cold war intrigue can tell us about the trump russia inquiry,0.03711497038602829,0.03165982663631439,0.9312252402305603,2017-03-29,15011
371,westinghouse toshiba nuclear bankruptcy,0.027898887172341347,0.0380450077354908,0.9340560436248779,2017-03-29,14998
372,trump climate change paris china,0.06809837371110916,0.020632121711969376,0.9112695455551147,2017-03-29,15002
373,china us investment bank cowen,0.056902091950178146,0.02368125133216381,0.9194166660308838,2017-03-29,15073
374,china walt disney fake,0.041884761303663254,0.027001358568668365,0.9311138987541199,2017-03-29,15076
375,ivory elephants china,0.03977752849459648,0.10499519854784012,0.8552272915840149,2017-03-29,15052
376,taiwan china kmt kuomintang,0.03359438106417656,0.036834005266427994,0.9295715689659119,2017-03-29,15054
377,trump business climate policy,0.0500565804541111,0.02187211997807026,0.9280712604522705,2017-03-30,15398
378,trump china xi mar a lago summit meeting,0.095018170773983,0.01672775112092495,0.8882541060447693,2017-03-30,15223
379,hong kong art political china,0.03697792813181877,0.03990492597222328,0.9231171011924744,2017-03-30,15207
380,cowens china bet involves more than just money,0.03891750052571297,0.01995581015944481,0.9411266446113586,2017-03-30,15292
381,edward lampert sears kmart,0.050812553614377975,0.026493409648537636,0.9226940274238586,2017-03-30,15283
382,ivanka trump and jared kushner still benefiting from business empire filings show,0.2290848195552826,0.07278614491224289,0.6981289982795715,2017-03-31,15606
383,world war ii fiction,0.027671068906784058,0.253826767206192,0.7185022234916687,2017-03-31,15456
384,myanmar china myitsone dam project,0.036640409380197525,0.05347165837883949,0.9098879098892212,2017-03-31,15450
385,in anatomy of an afghan bombing clues of a tangled war,0.10729975998401642,0.13186727464199066,0.7608329653739929,2017-03-31,15411
386,parachinar pakistan bombing,0.032482486218214035,0.044629476964473724,0.9228879809379578,2017-03-31,15532
387,irs extension adds time to file but you still have to pay,0.03558880835771561,0.05734890699386597,0.907062292098999,2017-03-31,15486
388,new york times apps apple china,0.03154105320572853,0.039375633001327515,0.9290833473205566,2017-04-01,459
389,nigerian leaders hymn,0.09412699937820435,0.16651783883571625,0.7393551468849182,2017-04-01,456
390,a new casualty of syrias war drinking water in damascus,0.030882462859153748,0.7546005249023438,0.21451698243618011,2017-04-01,465
391,macys jobs layoffs,0.008070540614426136,0.9441183805465698,0.04781107231974602,2017-04-01,510
392,tamara mellon jimmy choo new business,0.034847442060709,0.06799320131540298,0.8971593976020813,2017-04-01,477
393,medium job layoffs,0.007961846888065338,0.9574429988861084,0.034595225006341934,2017-04-01,496
394,china soccer xi jinping,0.03197257220745087,0.047697510570287704,0.9203298687934875,2017-04-01,370
395,china sichuan shooting,0.03625334054231644,0.05679891258478165,0.9069477319717407,2017-04-01,355
396,china xinhua donald trump twitter,0.054896920919418335,0.04937996342778206,0.8957231044769287,2017-04-01,352
397,china us jim mattis japan islands,0.025354765355587006,0.0763646587729454,0.8982806205749512,2017-04-02,5895
398,black site prisons cia terrorist,0.018806617707014084,0.12493237853050232,0.8562610745429993,2017-04-02,5907
399,china xi jinping economic reform,0.030941596254706383,0.05891495198011398,0.9101434350013733,2017-04-03,10824
400,china xi jinping economic reform scorecard,0.09695933014154434,0.03078964725136757,0.872251033782959,2017-04-03,10820
401,china to raise military spending but less than in recent years,0.9333925843238831,0.01912040263414383,0.047487031668424606,2017-04-03,10795
402,war south sudan,0.039364442229270935,0.37407955527305603,0.586556077003479,2017-04-03,10805
403,china economy national peoples congress,0.032472554594278336,0.0426492840051651,0.9248781800270081,2017-04-03,10863
404,matthew pottinger trump china,0.04763082042336464,0.07966692745685577,0.8727023005485535,2017-04-04,16137
405,china mar a lago guo wengui,0.1852140575647354,0.02400018647313118,0.7907857894897461,2017-04-04,16098
406,north korea nuclear weapons china,0.021316776052117348,0.22392067313194275,0.754762589931488,2017-04-05,21100
407,afghan warlord returns to city he left in ruins with hope for peace,0.1778971403837204,0.103224977850914,0.7188778519630432,2017-04-05,21224
408,terrorist attacks britain history,0.02526761405169964,0.5921095013618469,0.3826228976249695,2017-04-06,26564
409,harbin china russia architecture,0.03137288615107536,0.0379326269030571,0.9306944608688354,2017-04-06,26519
410,gabrielle giffords warship commission us navy,0.02497170679271221,0.08293807506561279,0.8920902013778687,2017-04-06,26521
411,china media climate trump,0.03078516572713852,0.04479621350765228,0.9244186282157898,2017-04-06,26522
412,for iran qatar crisis is a welcome distraction,0.5457655191421509,0.016486985608935356,0.43774741888046265,2017-04-07,31592
413,syria war crimes prosecution united nations,0.0352836437523365,0.5825645327568054,0.3821517527103424,2017-04-07,31629
414,liu xiaobo cancer treatment nobel china prison,0.10951405763626099,0.01853431761264801,0.8719516396522522,2017-04-07,31650
415,china bus road straddling,0.1229705885052681,0.017629988491535187,0.8593994379043579,2017-04-07,31578
416,leeco frozen assets china debt,0.02012781612575054,0.3088425099849701,0.6710296273231506,2017-04-07,31574
417,china india border tensions,0.032059669494628906,0.07365430146455765,0.894286036491394,2017-04-08,36532
418,china blogger lu yuyu prison sentence protests picking quarrels,0.05261252447962761,0.7852386832237244,0.1621488332748413,2017-04-08,36530
419,queens epa superfund radiation businesses,0.06704983115196228,0.03173975646495819,0.9012104272842407,2017-04-08,36606
420,vietnam south china sea repsol,0.0322648249566555,0.036181554198265076,0.9315536618232727,2017-04-08,36587
421,china central bank retirement,0.04859016090631485,0.043285392224788666,0.9081244468688965,2017-04-09,41265
422,trump china north korea trade,0.03796202689409256,0.037769973278045654,0.9242679476737976,2017-04-09,41240
423,daca dreamers trump business,0.062125008553266525,0.03755893185734749,0.9003161191940308,2017-04-09,41295
424,business travelers rogue,0.03884987160563469,0.04163902997970581,0.9195111393928528,2017-04-09,41278
425,new zealand china spy,0.039515841752290726,0.038212165236473083,0.9222720265388489,2017-04-10,46461
426,a nixon mask a crowd of thousands a lost business card,0.028350859880447388,0.47766923904418945,0.4939799904823303,2017-04-11,51755
427,china hong kong national anthem,0.029311425983905792,0.061009522527456284,0.9096790552139282,2017-04-11,51762
428,china taiwan military,0.03139617294073105,0.042210228741168976,0.9263936281204224,2017-04-11,51740
429,putin flynn kislyak sanctions,0.2382211536169052,0.21553541719913483,0.54624342918396,2017-04-12,56407
430,metropolitan diary a stranger in the building on official business,0.03820530325174332,0.2152421921491623,0.746552586555481,2017-04-13,17799
431,china north korea trade coal nuclear,0.0778450295329094,0.01716477982699871,0.9049902558326721,2017-04-13,17679
432,markets bank earnings stocks jpmorgan wells,0.027930274605751038,0.08498914539813995,0.8870805501937866,2017-04-13,17668
433,supreme court ruling draws a vague line in bankruptcy cases,0.0476498045027256,0.7844606637954712,0.16788950562477112,2017-04-14,17923
434,north korea china nuclear,0.0407404862344265,0.04351186007261276,0.9157477021217346,2017-04-14,17889
435,china currency manipulation trump,0.026960862800478935,0.49746787548065186,0.47557127475738525,2017-04-14,17999
436,dr mark wainberg microbiologist aids awareness dead,0.16016067564487457,0.04939894378185272,0.7904403805732727,2017-04-14,18025
