,Headline,Positive,Negative,Neutral,date,article_id
193,chinas economy puts new pressure on a changing job market,0.036647189408540726,0.9054386019706726,0.05791422724723816,2015-04-22,24712
194,elizabeth warren knocks obama over trade deal transparency,0.04158320277929306,0.7413705587387085,0.21704626083374023,2015-04-22,24926
195,xi jinping of china and shinzo abe of japan meet in indonesia,0.03204403445124626,0.04460664093494415,0.9233493208885193,2015-04-23,24892
196,trader charged in flash crash case to fight extradition to us,0.061736635863780975,0.5957431197166443,0.34252017736434937,2015-04-23,24889
197,flash crash case suggests small problems can cause systemic issues,0.023977460339665413,0.8472606539726257,0.12876199185848236,2015-04-23,24923
198,opening salvos in a condiment war and the hot dog is the battlefield,0.03385639563202858,0.04200861603021622,0.9241349697113037,2015-04-23,25051
199,as war grinds on yemenis share their anguish online,0.03921232372522354,0.6804693937301636,0.28031831979751587,2015-04-23,25049
200,aig bailout lawsuit trial ends as it began with most issues in dispute,0.02663528174161911,0.42823272943496704,0.5451319813728333,2015-04-23,25045
201,advice and sympathy for trader charged in flash crash case,0.07979638874530792,0.1146303117275238,0.8055732846260071,2015-04-24,25244
202,associate of zhou yongkang chinas fallen security chief admits taking bribes,0.043916039168834686,0.19102004170417786,0.7650639414787292,2015-04-24,25371
203,lindsey graham warns g o p not to sell hillary clinton short,0.05307663977146149,0.2540387511253357,0.692884624004364,2015-04-24,25509
204,at new york reception ted cruz is said to strike different tone toward gays,0.08445166796445847,0.31162017583847046,0.6039281487464905,2015-04-24,25214
205,warren weinstein aid worker killed in pakistan drone strike,0.044042184948921204,0.7420058846473694,0.21395188570022583,2015-04-24,25247
206,comcast time warner cable merger,0.026855194941163063,0.027620067819952965,0.9455246925354004,2015-04-24,25239
207,amazon reports big profits in its cloud computing business,0.9395139217376709,0.024682747200131416,0.03580329939723015,2015-04-24,25346
208,european leaders urged to strengthen minimalist approach to mediterranean migration crisis,0.7293914556503296,0.013652651570737362,0.2569558620452881,2015-04-24,25189
209,pentagon announces new cyberwarfare strategy,0.1391393542289734,0.0499100461602211,0.8109506368637085,2015-04-24,25344
210,warren weinsteins devotion to pakistan was part of a lifetime of service,0.12356849759817123,0.020423464477062225,0.856007993221283,2015-04-24,25206
211,indian authorities put restrictions on ford foundation,0.023806514218449593,0.7285522818565369,0.2476412057876587,2015-04-24,25336
212,turkey fear of reparations possibly in many billions is a factor in armenian genocide denials,0.034535668790340424,0.6913691759109497,0.27409517765045166,2015-04-24,25340
213,value of nsa warrantless spying is doubted in declassified reports,0.028454147279262543,0.07299293577671051,0.8985529541969299,2015-04-25,25657
214,europes migration crisis cannot be solved at sea analysts say,0.024221856147050858,0.8119556903839111,0.1638224869966507,2015-04-25,25524
215,chinas president to meet with head of taiwans governing party next month,0.0519808866083622,0.02174212597310543,0.9262769818305969,2015-04-25,25425
216,comcast time warner cable deal,0.031572360545396805,0.02577861398458481,0.9426490068435669,2015-04-25,25432
217,china suspends death sentence for li yan,0.021733636036515236,0.8200112581253052,0.15825507044792175,2015-04-25,25435
218,greece euro finance ministers meeting,0.03199632093310356,0.027871740981936455,0.9401319026947021,2015-04-25,25451
219,cia qaeda drone strikes warren weinstein giovanni lo porto deaths,0.04318711534142494,0.1889694780111313,0.7678434252738953,2015-04-25,25460
220,man says he flew drone onto japanese leaders office roof in nuclear protest,0.05255379155278206,0.3544873893260956,0.5929588079452515,2015-04-25,25596
221,gay businessman who hosted cruz event apologizes,0.022474629804491997,0.8776156306266785,0.0999097228050232,2015-04-26,25850
222,china lawsuit over banned li rui memoir censorship,0.03015265241265297,0.8171713352203369,0.15267595648765564,2015-04-26,25666
223,a curly haired girls global war on frizz,0.03214366361498833,0.1290874183177948,0.8387688994407654,2015-04-26,25687
224,katmandu nepal fear loss and devastation,0.02866169437766075,0.3690461218357086,0.6022922396659851,2015-04-27,25807
225,details emerge of china financed dam project in pakistan,0.0503268837928772,0.02489216811954975,0.9247809052467346,2015-04-27,25946
226,in rare remarks george w bush argues against the lifting of iran sanctions,0.2007054090499878,0.21772615611553192,0.5815684199333191,2015-04-27,25860
227,today in politics rand paul goes to new york to coax a wary bloc,0.1409117430448532,0.02699333056807518,0.8320948481559753,2015-04-27,25939
228,The Music Festival Business Who Owns What,0.02199367992579937,0.02923014387488365,0.948776125907898,2015-04-28,26329
229,wu rongrong interrogation china,0.06669435650110245,0.06898406893014908,0.8643215298652649,2015-04-28,25950
230,richard trumka a f l c i o chief warns candidates on inequality,0.0478791706264019,0.04289785400032997,0.9092230200767517,2015-04-28,26263
231,harvey r miller renowned bankruptcy lawyer dies at 82,0.04227713122963905,0.3400804102420807,0.6176425218582153,2015-04-28,25993
232,fear keeps traders on sidelines of drug mega deals,0.01908106543123722,0.8458201289176941,0.13509880006313324,2015-04-28,25991
233,un says israeli military actions killed 44 civilians in schools in gaza war,0.036644358187913895,0.7945243716239929,0.16883127391338348,2015-04-28,26021
234,uncertainty over impact of a default by greece,0.03953377902507782,0.315130352973938,0.645335853099823,2015-04-28,26090
235,china opens corruption inquiry into sinopec president,0.03792882710695267,0.4450642466545105,0.5170068740844727,2015-04-28,25975
236,once concerned china is quiet about trans pacific trade deal,0.06077781319618225,0.36358487606048584,0.5756374001502991,2015-04-29,26259
237,saudi arabia accuses 93 of terrorist links including to isis,0.045630183070898056,0.6121386289596558,0.3422311544418335,2015-04-29,26257
238,scientists and religious leaders discuss climate change at vatican,0.05591907352209091,0.020191345363855362,0.9238895773887634,2015-04-29,26250
239,turmoil in baltimore provides immediate test for new attorney general,0.2245633900165558,0.040861502289772034,0.734575092792511,2015-04-29,26245
240,events in baltimore reflect a slow rolling crisis across us obama says,0.04230814799666405,0.7503483295440674,0.20734350383281708,2015-04-29,26242
241,fearing for families after nepal quake thousands return to isolated villages,0.05413572117686272,0.6766920685768127,0.26917219161987305,2015-04-29,26237
242,as human crisis takes priority after nepal quake a nations treasures become its scrap,0.23721598088741302,0.036996640264987946,0.725787341594696,2015-04-29,26325
243,jeb bush visits puerto rico in hopes of reconnecting with hispanic voters,0.5645286440849304,0.013376129791140556,0.42209529876708984,2015-04-29,26355
244,african leaders are mute even as their people die at sea,0.05539020895957947,0.24143055081367493,0.7031792402267456,2015-04-29,26339
245,2 inflation rate target is questioned as fed policy panel prepares to meet,0.11728545278310776,0.42220786213874817,0.4605066776275635,2015-04-29,26146
246,wang jianlin abillionaire at the intersection of business and power in china,0.24346575140953064,0.01754649542272091,0.7389878034591675,2015-04-29,26153
247,ted cruz addresses hispanic group with rare we,0.08922605961561203,0.022438595071434975,0.8883354067802429,2015-04-30,26706
248,gay marriage backers to finance anti discrimination efforts,0.15809965133666992,0.014986658468842506,0.8269137144088745,2015-04-30,26851
249,germanwings crash looms large at lufthansa shareholders meeting,0.028904862701892853,0.8162669539451599,0.1548282504081726,2015-04-30,26497
250,navinder singh sarao flash crash bail,0.041786763817071915,0.10907043516635895,0.8491427898406982,2015-04-30,26420
251,empty streets new threat to businesses in baltimore,0.03542971983551979,0.8547671437263489,0.10980308800935745,2015-04-30,26616
252,ukraine russia seizes leaders assets,0.025672446936368942,0.5364897847175598,0.43783777952194214,2015-04-30,26629
253,healthier time warner cable emerges from quashed deal with far more options,0.6124173402786255,0.25930044054985046,0.12828217446804047,2015-04-30,26608
254,faa questioned andreas lubitz depression germanwings crash,0.0422799214720726,0.4636695981025696,0.49405044317245483,2015-04-30,26517
255,baltimore forces presidential hopefuls to confront a jarring crisis,0.12182941287755966,0.7309533357620239,0.14721722900867462,2015-04-30,26394
256,from the upshot gohmerts leadership pac,0.31950142979621887,0.0143501665443182,0.6661483645439148,2015-05-01,754
257,chinas maoists are revived as thought police,0.18653711676597595,0.0587737150490284,0.75468909740448,2015-05-01,564
258,ulrich beck sociologist who warned of dangers of technology is dead at 70,0.03262558951973915,0.20849737524986267,0.7588769793510437,2015-05-01,548
259,north korea criticizes us over new sanctions,0.017555467784404755,0.9427028298377991,0.03974170610308647,2015-05-01,524
260,london stock exchange looks to sell russell asset management business,0.048812054097652435,0.01474736724048853,0.9364405274391174,2015-05-02,7922
261,china to enforce tax collection from multinational companies,0.04834367707371712,0.1337638795375824,0.8178924322128296,2015-05-02,7612
262,argentinas president mocks chinese accents during visit to china,0.03329402953386307,0.7442641854286194,0.22244185209274292,2015-05-02,7649
263,cultural life goes on in donetsk war permitting,0.04388023167848587,0.05170372128486633,0.904416024684906,2015-05-02,7648
264,the wardrobe politics of greeces new prime minister,0.061094533652067184,0.0206562839448452,0.918249249458313,2015-05-02,7539
265,small passenger plane crashes into river in taiwan,0.011772634461522102,0.9266493320465088,0.06157807260751724,2015-05-02,7512
266,china moves to free up money in its economy,0.7087110877037048,0.015950394794344902,0.27533847093582153,2015-05-02,7546
267,trickle of liberian children returning to school reflects lingering ebola fears,0.014237944968044758,0.9646503329277039,0.021111786365509033,2015-05-03,14109
268,edward snowden ready to return home to united states lawyer says,0.15080997347831726,0.027726635336875916,0.8214633464813232,2015-05-03,14005
269,chinas military budget increasing 10 for 2015 official says,0.9151002764701843,0.03138749301433563,0.05351224169135094,2015-05-03,13979
270,china lowers official economic growth target,0.012162975035607815,0.955163300037384,0.0326736681163311,2015-05-03,14232
271,chinese premier warns of economic barriers to private enterprise,0.09186412394046783,0.6525495052337646,0.2555863857269287,2015-05-03,14262
272,a fashion magazines successful business model hint its free,0.7745147347450256,0.011083628982305527,0.21440163254737854,2015-05-03,14155
273,business owners in brooklyn heights start subtle lobbying of clinton campaign,0.034583546221256256,0.4475482404232025,0.517868161201477,2015-05-04,21278
274,europe moving toward single digital market,0.1426687091588974,0.017178261652588844,0.8401530385017395,2015-05-05,27626
275,britains campaign finance laws leave parties with idle money,0.009212667122483253,0.9151995182037354,0.07558788359165192,2015-05-05,27574
276,dozens killed in minibus crash madhya pradesh india,0.023294607177376747,0.8482016921043396,0.1285037100315094,2015-05-05,27589
277,berkshires warren buffett shows his teddy bear image has tough side,0.588446319103241,0.05963706597685814,0.351916640996933,2015-05-05,27709
278,south sudan worlds youngest nation is at grave risk kerry warns,0.033422477543354034,0.8025233745574951,0.16405415534973145,2015-05-05,27705
279,damascus syria civil war clash insurgents,0.025499198585748672,0.7227612137794495,0.25173962116241455,2015-05-05,27529
280,south korea mers virus death,0.029165741056203842,0.7615000605583191,0.20933417975902557,2015-05-06,34323
281,fifa jack warner sepp blatter corruption,0.03967536985874176,0.07326848804950714,0.8870561718940735,2015-05-06,34295
282,hong kong disconnected from china democracy on tiananmen anniversary,0.04337155073881149,0.08298338949680328,0.8736450672149658,2015-05-06,34303
283,beware a bluff from dishs poker playing boss,0.05580785125494003,0.10914511233568192,0.8350470662117004,2015-05-06,34421
284,edward snowden the world says no to surveillance,0.05464155226945877,0.05495313182473183,0.8904052972793579,2015-05-06,34520
285,fund in china aims to stabilize stock markets,0.7984821200370789,0.01243557408452034,0.18908236920833588,2015-05-07,41217
286,national cathedrals repair work finials finance and faith,0.03303057700395584,0.027454933151602745,0.9395144581794739,2015-05-07,41243
287,linda greenhouse the supreme court and the politics of fear,0.07653975486755371,0.0638633593916893,0.859596848487854,2015-05-07,41263
288,credit agricole in advanced talks on us sanctions settlement,0.14052268862724304,0.2506316006183624,0.6088457107543945,2015-05-08,46127
289,john kerry hails progress toward trans pacific partnership despite delays,0.9105672240257263,0.011982078664004803,0.07745067030191422,2015-05-08,46125
290,kosovo parliament votes to allow war crimes court,0.16760940849781036,0.22871065139770508,0.603679895401001,2015-05-08,46234
291,shires merger machine stumbles on baxalta bid,0.009851545095443726,0.96181321144104,0.028335247188806534,2015-05-08,46238
292,lesbos greece migrant refugee crisis,0.017753049731254578,0.7719306945800781,0.2103162705898285,2015-05-08,46258
293,an exchange in australia woos listings from china,0.7859703898429871,0.027195217087864876,0.18683429062366486,2015-05-08,46308
294,aretha franklin thwarts screening of documentary featuring concert footage,0.04345026612281799,0.4191915690898895,0.5373581051826477,2015-05-09,52732
295,star wars midnight sales draw fans in droves,0.14991900324821472,0.02668120712041855,0.8233998417854309,2015-05-09,52546
296,new widows have another concern their finances,0.0234757661819458,0.7644740343093872,0.2120501846075058,2015-05-09,52574
297,migrant crisis hungary,0.017905166372656822,0.7932654023170471,0.1888294517993927,2015-05-09,52550
298,obama and saudi king sidestep dispute over iran nuclear deal,0.19215306639671326,0.12254222482442856,0.6853047013282776,2015-05-09,52669
299,shrugging off market turmoil gas prices extend slide,0.8060836791992188,0.067640021443367,0.12627635896205902,2015-05-09,52739
300,today in politics clinton seeks to add leadership councils to campaign infrastructure,0.1965835988521576,0.009496674872934818,0.7939196825027466,2015-05-10,59738
301,indie comic book publishers make moves toward tv and film,0.20637838542461395,0.015988092869520187,0.7776334881782532,2015-05-10,59635
302,with the tv business in upheaval targeted ads offer hope,0.1609124094247818,0.03792968764901161,0.8011578917503357,2015-05-10,58351
303,finance ministers meet to discuss greek bailout,0.0755097046494484,0.04016443341970444,0.8843258619308472,2015-05-10,59647
304,policy makers skeptical on preventing financial crisis,0.230726420879364,0.15413601696491241,0.6151375770568848,2015-05-10,59660
305,a view emerges of business technologys future as the personalization of the machine,0.20391473174095154,0.010330351069569588,0.785754919052124,2015-05-10,59662
306,puerto ricos debt crisis and the 1975 law complicating matters,0.020026743412017822,0.8268077373504639,0.15316542983055115,2015-05-11,67027
307,in hondas rebuke of takata a rare move for business partners in japan,0.6227290034294128,0.2861801087856293,0.09109088778495789,2015-05-11,66836
308,south sudan juba plane crash,0.02377084083855152,0.6449158191680908,0.3313134014606476,2015-05-11,66825
309,time warner may have left door ajar for a fox return,0.03029979206621647,0.5940865874290466,0.3756136894226074,2015-05-11,66922
310,afghan businessman convicted in kabul bank fraud is still free to make money,0.11807087808847427,0.01825076900422573,0.8636783361434937,2015-05-11,66874
311,chinas slowdown raises questions about long term growth,0.06616780161857605,0.4098460078239441,0.5239861607551575,2015-05-11,66954
312,the risks and rewards of short termism,0.057159341871738434,0.027226528152823448,0.9156141877174377,2015-05-11,66957
313,south korea forced war laborers japan world war ii,0.030396422371268272,0.4634097218513489,0.5061939358711243,2015-05-11,66791
314,time warner fox q3 earnings,0.030658265575766563,0.05295010656118393,0.9163916707038879,2015-05-11,66929
315,china taiwan xi jinping ma ying jeou protocol,0.0459156334400177,0.03718814626336098,0.9168961644172668,2015-05-11,66761
316,supreme court justices fear loss of control over redistricting cases,0.008472367189824581,0.9527592658996582,0.038768358528614044,2015-05-11,66933
317,britain russia plane crash egypt sharm el sheikh,0.030688252300024033,0.5714411735534668,0.39787060022354126,2015-05-11,66890
318,ted cruz vows to kill the terrorists in ad timed to big football game,0.0765581801533699,0.03337829187512398,0.890063464641571,2015-05-12,73467
319,yahoos spinoff plan could be risky business,0.019289029762148857,0.587938666343689,0.39277225732803345,2015-05-12,73343
320,la bonne biere cafe hit in paris attacks is back in business,0.09168218821287155,0.3809625506401062,0.5273552536964417,2015-05-12,73362
321,china creates an asian bank as the us stands aloof,0.1119527667760849,0.04284071922302246,0.8452064990997314,2015-05-12,73364
322,worlds converge in deadly crash on new jersey highway,0.03630126267671585,0.43252530694007874,0.5311734676361084,2015-05-12,73368
323,gm will import buicks made in china to the us,0.17347295582294464,0.008829944767057896,0.8176971077919006,2015-05-12,73427
324,chipotle stock tumbles after e coli outbreak,0.00898490659892559,0.9603393077850342,0.030675740912556648,2015-05-12,73425
325,china pledges 60 billion to aid africas development,0.5539356470108032,0.011966202408075333,0.43409815430641174,2015-05-12,73292
326,prosecutor indicates new trial for former dewey leaders,0.10206407308578491,0.23691383004188538,0.6610221266746521,2015-05-12,73307
327,china constitution qin hui book,0.060859426856040955,0.03040195442736149,0.9087386131286621,2015-05-12,73239
328,china renmin university admission bribery,0.04941064119338989,0.020791340619325638,0.9297980070114136,2015-05-12,73225
329,liberias military tries to remedy tension over ebola quarantine,0.6279184818267822,0.28198564052581787,0.0900958776473999,2015-05-13,29481
330,jeb bush walks back iraq war comments,0.07235144823789597,0.5654916167259216,0.3621569573879242,2015-05-13,29520
331,as obama plays china card on trade chinese pursue their own deals,0.06622584909200668,0.032948609441518784,0.9008255004882812,2015-05-13,29503
332,iranian cargo ship heads toward yemen and saudi blockade,0.054241180419921875,0.092885322868824,0.8528735041618347,2015-05-13,29418
333,leaks gain credibility and potential to embarrass egypts leaders,0.02522699162364006,0.8853907585144043,0.0893823504447937,2015-05-13,29316
334,owner of anonymous hackers for hire site steps forward,0.06604032963514328,0.24377471208572388,0.6901849508285522,2015-05-13,29440
335,twitter beckons but bill simmons is all about the business of keeping silent,0.03109912760555744,0.05111159756779671,0.9177892804145813,2015-05-13,29312
336,william d smith dies at 79 business reporter who joined oil industry,0.030641764402389526,0.12008225917816162,0.8492760062217712,2015-05-13,29703
337,senator thomas carper got off train minutes before crash,0.05530517175793648,0.2967495918273926,0.6479451656341553,2015-05-13,29724
338,president meant no offense in calling elizabeth warren by her first name white house says,0.023767050355672836,0.0810379907488823,0.895194947719574,2015-05-13,29705
339,iraq war remains a quagmire that republicans hope to avoid,0.051548656076192856,0.7532221078872681,0.1952292025089264,2015-05-13,29658
340,out of nhl playoffs sidney crosby joins world championships chase,0.03790580853819847,0.22741341590881348,0.734680712223053,2015-05-14,29634
341,frontline getting a change in leadership,0.10068116337060928,0.03838856518268585,0.8609302043914795,2015-05-14,29659
342,political turmoil returns to burundi as president seeks new term,0.05870993807911873,0.6914206147193909,0.2498694807291031,2015-05-14,29789
343,today in politics gulf leaders to push obama for support,0.7720621824264526,0.026378896087408066,0.2015589028596878,2015-05-14,29879
344,fearing bangladeshi blogger might claim asylum sweden blocked visit that could have saved his life,0.07820731401443481,0.7112315893173218,0.2105610966682434,2015-05-14,29779
345,british flash crash trader to appeal bail terms,0.07777594029903412,0.8309178948402405,0.09130622446537018,2015-05-14,29624
346,bank of england expects zero inflation rate to pick up,0.9180419445037842,0.025253351777791977,0.056704822927713394,2015-05-14,29783
347,bank of england growth inflation,0.08418019115924835,0.07077723741531372,0.8450426459312439,2015-05-14,29614
348,in ukraine bones of war dead re emerge to stir political passions,0.03254785016179085,0.7224647998809814,0.24498741328716278,2015-05-14,29780
349,bankruptcy can help seniors protect assets,0.11577579379081726,0.035525694489479065,0.8486984968185425,2015-05-14,29716
350,why stocks belong in a retirement portfolio,0.027670813724398613,0.044092610478401184,0.9282366037368774,2015-05-14,29715
351,india and china aim to table territorial rifts amid economic courtship,0.6690362691879272,0.2514059245586395,0.07955789566040039,2015-05-14,29770
352,ivy ziedrich college student warms to role as jeb bush critic on isis,0.24434621632099152,0.01997099071741104,0.7356827855110168,2015-05-14,29968
353,Understanding Southeast Asias Migrant Crisis,0.10466071218252182,0.030802378430962563,0.8645369410514832,2015-05-14,30094
354,upward mobility for the worlds destitute,0.8834931254386902,0.014780598692595959,0.10172636806964874,2015-05-15,30181
355,review in the name of my daughter a family business scandal,0.027253862470388412,0.0493389256298542,0.923407256603241,2015-05-15,30097
356,netanyahus coalition gets rocky start with discontent over leadership posts,0.016241412609815598,0.9548458456993103,0.02891271561384201,2015-05-15,30101
357,india china narendra modi xi jinping xian,0.038107920438051224,0.03692518547177315,0.9249668717384338,2015-05-15,29921
358,china passports xinjiang ili kazakh autonomous prefecture,0.02839234657585621,0.056624408811330795,0.9149832725524902,2015-05-15,29884
359,opposition activists in burundi fear crackdown after presidents return,0.023819591850042343,0.8592719435691833,0.11690844595432281,2015-05-16,30369
360,yemen aid coordinator asks saudis to simplify restrictions,0.1326221078634262,0.01994171552360058,0.8474361896514893,2015-05-16,30419
361,narendra modi urges china to rethink policies that strain ties to india,0.24654844403266907,0.08578873425722122,0.6676628589630127,2015-05-16,30157
362,bus shaanxi province china,0.026423467323184013,0.10925639420747757,0.8643200993537903,2015-05-16,30214
363,kerry china south sea dispute,0.03741111606359482,0.04661886766552925,0.915969967842102,2015-05-16,30210
364,china pu zhiqiang trial,0.04719701409339905,0.04535161331295967,0.907451331615448,2015-05-16,30202
365,families find the principles that keep the business going,0.05203509330749512,0.020753899589180946,0.9272110462188721,2015-05-16,30198
366,china hunts fugitives accused of corruption many in us,0.07855246216058731,0.5307304859161377,0.3907170295715332,2015-05-16,30355
367,elizabeth warren emerges as trade bills detractor in chief,0.19370058178901672,0.08329521864652634,0.723004162311554,2015-05-16,30303
368,bond turmoil signals a new era of return free risk,0.22639663517475128,0.04572424292564392,0.7278791666030884,2015-05-16,30296
369,iraq war haunts potential bush candidacy as it did clinton in 2008,0.038113754242658615,0.30033764243125916,0.6615485548973083,2015-05-16,30185
370,chelseas risque businesses,0.04104055091738701,0.1636309176683426,0.7953284978866577,2015-05-17,30308
371,marco rubio struggles with question on iraq war,0.05671478435397148,0.6143621802330017,0.32892298698425293,2015-05-17,30560
372,russian rocket carrying mexican satellite is said to crash in siberia,0.02838735654950142,0.374265193939209,0.5973474383354187,2015-05-17,30437
373,china stands by its claims over reefs,0.18353579938411713,0.03409966453909874,0.782364547252655,2015-05-17,30459
374,back in show business,0.2000574916601181,0.07996835559606552,0.7199742197990417,2015-05-17,30339
375,china making some missiles more powerful,0.3820174038410187,0.01137488055974245,0.6066076755523682,2015-05-17,30496
376,bodies recovered from helicopter crash in nepal are identified,0.02994881384074688,0.43854203820228577,0.5315091609954834,2015-05-18,30556
377,burundi president surviving coup warns of a threat from shabab,0.061894651502370834,0.7890949249267578,0.1490103155374527,2015-05-18,30581
378,revisiting a world war ii internment camp as others try to keep its story from fading,0.041292767971754074,0.17512983083724976,0.7835773825645447,2015-05-18,30620
379,first draft focus easing tensions,0.2192753106355667,0.023011259734630585,0.7577133774757385,2015-05-18,30782
380,shell oils cold calculations for a warming world,0.16752055287361145,0.350853830575943,0.48162561655044556,2015-05-18,30810
381,isis finances,0.0223361998796463,0.11499214917421341,0.8626716732978821,2015-05-19,30886
382,how the civil war changed the world,0.051104649901390076,0.08830934762954712,0.8605860471725464,2015-05-19,30897
