,Headline,Positive,Negative,Neutral,date,article_id
193,maybe the young shouldnt dive into stocks,0.0958469957113266,0.05464991554617882,0.8495030403137207,2015-10-02,8813
194,small business leaders wage counteroffensive to save export import bank,0.19464267790317535,0.6955828070640564,0.10977454483509064,2015-10-03,15317
195,panel seeks more time for gaza war crimes inquiry,0.09478345513343811,0.16757182776927948,0.7376447319984436,2015-10-03,15320
196,china dalai lama supporter burns herself in protest,0.031800199300050735,0.7067368030548096,0.2614630162715912,2015-10-03,15378
197,armenian leaders establish rights award to commemorate centenary of genocide,0.3551076054573059,0.01671736314892769,0.6281750202178955,2015-10-03,15379
198,helicopters crash in argentina 10 are killed,0.019492043182253838,0.8317275643348694,0.14878040552139282,2015-10-03,15381
199,white house faults gop senators letter to irans leaders,0.14306527376174927,0.02129243314266205,0.8356423377990723,2015-10-03,15267
200,greece eurozone finance ministers,0.03774075210094452,0.030336182564496994,0.9319230914115906,2015-10-03,15172
201,donna edwards announces bid for maryland senate seat,0.07237080484628677,0.06972328573465347,0.8579059839248657,2015-10-03,15462
202,ahead of world war ii anniversary questions linger over stance of japans premier,0.04064200446009636,0.6253749132156372,0.33398303389549255,2015-10-04,22171
203,in moscow economic sanctions rattle malls,0.04217197746038437,0.8864791989326477,0.07134877890348434,2015-10-04,22178
204,founder of satyam software outsourcing company in india found guilty of fraud,0.04945728927850723,0.47198227047920227,0.47856035828590393,2015-10-04,22159
205,warner bros and lego enter market where toys and gaming meet,0.15145495533943176,0.009753149002790451,0.8387919068336487,2015-10-04,22131
206,biden cites progress in iraqs war with isis,0.5277445316314697,0.03236480802297592,0.43989068269729614,2015-10-04,22208
207,china south china sea spratly paracel islands,0.0320778414607048,0.11498438566923141,0.8529377579689026,2015-10-04,22143
208,china detained womens rights activists,0.041696321219205856,0.7822655439376831,0.17603808641433716,2015-10-04,22093
209,morning agenda g e to sell bulk of finance unit,0.053668804466724396,0.016296561807394028,0.9300345778465271,2015-10-04,22395
210,in aftermath of east village blast business owners vow to rebuild,0.1652018278837204,0.0987335816025734,0.736064612865448,2015-10-04,22314
211,italy man opens fire in court during bankruptcy hearing,0.026981867849826813,0.8040198087692261,0.16899828612804413,2015-10-04,22310
212,civil wars lessons resound 150 years later,0.11034379154443741,0.035203561186790466,0.8544526696205139,2015-10-04,22321
213,obama calls elizabeth warren absolutely wrong on trans pacific trade deal,0.02671234868466854,0.8251014351844788,0.14818620681762695,2015-10-05,28893
214,medals and memories for jewish world war ii veterans from russia,0.10080835223197937,0.03580603376030922,0.8633856177330017,2015-10-05,28913
215,accused of spying for china until she wasnt,0.050022054463624954,0.4164155125617981,0.5335623621940613,2015-10-05,28837
216,after ebola outbreak liberian churches confront crisis of faith,0.04718375578522682,0.7964745163917542,0.15634174644947052,2015-10-05,28855
217,european businesses hit by chinas cooling economy,0.02073717676103115,0.932062566280365,0.04720015078783035,2015-10-06,35655
218,greece un warns that migrants may overwhelm tourist island of lesbos,0.02549305371940136,0.9483453631401062,0.026161551475524902,2015-10-06,35571
219,blackrock hires columbia finance professor to guide new investment strategy,0.10289500653743744,0.013251489028334618,0.883853554725647,2015-10-06,35503
220,elizabeth warren calls out education department over student loans,0.014633399434387684,0.8837724328041077,0.10159412026405334,2015-10-06,35762
221,global index may add chinese stocks fueling investment,0.9008949995040894,0.02933720126748085,0.06976776570081711,2015-10-06,35530
222,south korea mers virus pneumonia patients,0.03143875673413277,0.68683260679245,0.28172871470451355,2015-10-06,35422
223,new jersey battles to attract food businesses,0.8847039341926575,0.01907414011657238,0.0962219089269638,2015-10-06,35417
224,to move forward hsbc looks back,0.24290990829467773,0.009016546420753002,0.7480735182762146,2015-10-06,35447
225,an audacious project and its founder slide toward failure in paris,0.012560371309518814,0.9427239894866943,0.044715575873851776,2015-10-06,35432
226,marco rubio finances debt loans credit,0.037044622004032135,0.01591702364385128,0.9470383524894714,2015-10-06,35378
227,china frees zhang miao employee of die zeit,0.07517220824956894,0.2896070182323456,0.6352207660675049,2015-10-07,41980
228,thailand deports uighur migrants to china,0.05031965672969818,0.383414626121521,0.5662657022476196,2015-10-07,41976
229,why chinas stock market bailout just might work,0.04914487153291702,0.04699692130088806,0.9038582444190979,2015-10-07,41992
230,china stock market crash communist xi jinping,0.01518982369452715,0.8665497303009033,0.11826034635305405,2015-10-07,41934
231,chinese stocks stabilize but fears persist,0.05774100497364998,0.906436562538147,0.03582235425710678,2015-10-07,41804
232,when prostitution is nobodys business,0.02699696086347103,0.2866940498352051,0.6863089799880981,2015-10-08,47372
233,mtime helps hollywood clear chinas marketing hurdles and reach fans,0.5319135189056396,0.00962190330028534,0.458464652299881,2015-10-08,47333
234,similarities aside bernie sanders isnt rerunning howard deans 2004 race,0.03600354120135307,0.07218394428491592,0.8918125033378601,2015-10-08,47266
235,scale of migrant crisis in europe,0.03741053119301796,0.5783222317695618,0.3842672109603882,2015-10-09,53729
236,europe migrant crisis jean claude juncker,0.03641441836953163,0.4626842737197876,0.5009012818336487,2015-10-09,53429
237,in china a forceful crackdown in response to stock market crisis,0.061548881232738495,0.7806797027587891,0.15777143836021423,2015-10-09,53454
238,migrants refugee tensions in europe,0.043056029826402664,0.6724583506584167,0.2844856083393097,2015-10-09,53564
239,bao zhuoxuan wang yu son myanmar china,0.029567576944828033,0.10476824641227722,0.8656641840934753,2015-10-10,60855
240,fiat chrysler to move forward with ferrari ipo,0.7099210023880005,0.010052341967821121,0.2800266444683075,2015-10-10,61066
241,defamation suit against cosby will go forward in massachusetts,0.051901742815971375,0.03294024243950844,0.9151579737663269,2015-10-10,61069
242,is vw proof that businesses cant regulate themselves,0.030506959185004234,0.08513001352548599,0.884363055229187,2015-10-11,68086
243,poll watch overseas elections offer warnings for u s pollsters,0.028141146525740623,0.5658362507820129,0.4060226380825043,2015-10-11,68116
244,netflix to finance film by snowpiercer director,0.16480274498462677,0.008279804140329361,0.8269174695014954,2015-10-11,68208
245,an island refuge surrounded by bloody civil war in south sudan,0.0960996150970459,0.37522104382514954,0.5286792516708374,2015-10-11,67875
246,as china and europe age path to more children lies beyond bedroom,0.1845976710319519,0.012818995863199234,0.8025833964347839,2015-10-11,67917
247,cuban peers dispute ted cruzs fathers story of fighting for castro,0.1348177045583725,0.03581995889544487,0.8293622732162476,2015-10-11,67964
248,shift to lower carbon energy is too slow report warns,0.0596260242164135,0.15457361936569214,0.7858003973960876,2015-10-11,68030
249,nato war games unwittingly put soviets and us on hair trigger in 83 analysis suggests,0.07289886474609375,0.09464100003242493,0.8324601054191589,2015-10-11,68033
250,suspects in russian jet crash risk exposing their isis allies to a backlash,0.035737305879592896,0.6966140866279602,0.2676485776901245,2015-10-11,68001
251,a congress that doesnt want to weigh in on war,0.042638927698135376,0.10351990908384323,0.8538411855697632,2015-10-12,74383
252,gm compensated some pre bankruptcy crash victims,0.17962701618671417,0.05938210338354111,0.7609908580780029,2015-10-12,74392
253,walmart prepares to enter mobile payments business,0.10238825529813766,0.008339530788362026,0.8892722129821777,2015-10-12,74393
254,venezuelas defeated ruling party riven by conflict and scorn,0.04922182485461235,0.868256151676178,0.08252199739217758,2015-10-12,74361
255,diamondbacks not worried about future or finances,0.047543443739414215,0.03079572692513466,0.9216607809066772,2015-10-12,74373
256,fbi chief says texas gunman used encryption to text overseas terrorist,0.028505070134997368,0.2968873977661133,0.6746075749397278,2015-10-12,74374
257,south china morning post history,0.03725343942642212,0.04452994838356972,0.9182165861129761,2015-10-12,74756
258,morning agenda yahoo to spin off core business,0.02420545555651188,0.2726271152496338,0.7031674981117249,2015-10-12,74431
259,new york business leaders full page ad praises citys immigrants,0.04785881191492081,0.033910393714904785,0.9182308316230774,2015-10-12,74550
260,ukraine conflict toll,0.027299493551254272,0.6628323197364807,0.3098682165145874,2015-10-12,74205
261,small business counter bad reviews,0.046764012426137924,0.7050799131393433,0.24815605580806732,2015-10-12,74221
262,china ipo trading hiatus,0.03041514940559864,0.026550380513072014,0.9430345296859741,2015-10-12,74133
263,china climate change smog pollution,0.02248965948820114,0.3080466389656067,0.6694636344909668,2015-10-12,74176
264,india climate change global warming,0.026796750724315643,0.10926790535449982,0.8639352917671204,2015-10-12,74313
265,how to value yahoos core business,0.057114992290735245,0.018236059695482254,0.9246490001678467,2015-10-12,74328
266,as us and europe pass the hat at climate talks china clings to developing nation status,0.27340108156204224,0.01492795068770647,0.711670994758606,2015-10-12,74337
267,argentinas next finance chief meets debt dispute mediator,0.07336826622486115,0.23931963741779327,0.687312126159668,2015-10-12,74286
268,china sentences 2 former top communist party officials over bribes,0.04938517138361931,0.8451045751571655,0.10551022738218307,2015-10-13,61391
269,us asia south china sea patrols,0.032851655036211014,0.04870542138814926,0.918442964553833,2015-10-13,61396
270,russia says it has detained a terrorist cell in moscow,0.04498620703816414,0.6746914982795715,0.28032228350639343,2015-10-13,61485
271,in choreographed campaigns candidates stumble over choice of music,0.04042793810367584,0.35441872477531433,0.6051533222198486,2015-10-13,61542
272,china fire strikes tianjin 2 months after fatal blast,0.04974539950489998,0.5791970491409302,0.3710575997829437,2015-10-13,61541
273,china bao zhuoxuan son wang yu rights lawyer house arrest,0.020129486918449402,0.16592314839363098,0.813947319984436,2015-10-13,61365
274,2 afghan military aircraft crash as flights become more crucial,0.013161429204046726,0.9235052466392517,0.06333339214324951,2015-10-13,61464
275,poll watch voters like joe biden on honesty and donald trump for leadership skills,0.08092737942934036,0.020955052226781845,0.8981175422668457,2015-10-13,61622
276,inertia may decide fate of proposed changes to bankruptcy law,0.027051789686083794,0.03313380852341652,0.9398144483566284,2015-10-14,61644
277,wework ends combative dispute with former janitorial workers,0.02475813217461109,0.9074252247810364,0.06781664490699768,2015-10-14,61704
278,new labour party leadership widens rift between left and center,0.03492755815386772,0.9162139892578125,0.04885852336883545,2015-10-14,61726
279,group supporting hillary clinton releases hispanic themed ad,0.05462255701422691,0.0497879795730114,0.8955894708633423,2015-10-14,61903
280,top party official accuses democratic national chairwoman of lying questions her leadership,0.02342771738767624,0.8745799660682678,0.10199227929115295,2015-10-15,62337
281,blackrock sees inflow of money even amid market volatility,0.9298997521400452,0.01571681536734104,0.054383475333452225,2015-10-15,61853
282,china britain magna carta renmin university,0.04988866299390793,0.02087382972240448,0.9292374849319458,2015-10-15,61874
283,treasurys warning on debt limit seen as cudgel to congress,0.03481469675898552,0.8981260061264038,0.06705925613641739,2015-10-16,62421
284,huarong china ipo debt,0.034244466572999954,0.021865736693143845,0.9438897967338562,2015-10-16,62083
285,untangling the overlapping conflicts in the syrian war,0.14825832843780518,0.0681200698018074,0.783621609210968,2015-10-16,62801
286,migrant crisis europe,0.02516658417880535,0.5869483947753906,0.38788506388664246,2015-10-16,62159
287,europe refugee crisis questions,0.02881530299782753,0.5011204481124878,0.4700642228126526,2015-10-16,62142
288,conflicting accounts of jerusalem strife surround a wounded arab boy,0.04468806833028793,0.8062042593955994,0.1491076797246933,2015-10-16,62324
289,four children among migrants found after boat crash near greece,0.06210552528500557,0.6372482180595398,0.30064627528190613,2015-10-16,62347
290,canadian campaign blurs party lines to thwart conservatives,0.023280177265405655,0.7955683469772339,0.18115147948265076,2015-10-16,62345
291,why great leaders see more and exclude less,0.04805499687790871,0.03702608123421669,0.9149188995361328,2015-10-17,62511
292,leaders of frances socialist party defy its orthodoxy,0.06552208960056305,0.4319588243961334,0.5025190711021423,2015-10-17,62529
293,online university helps philanthropic groups and their leaders,0.1399567723274231,0.01112697646021843,0.848916232585907,2015-10-17,62451
294,online dating business files to go public,0.023384351283311844,0.04642554745078087,0.9301901459693909,2015-10-17,62602
295,iran nuclear deal sanctions,0.043614041060209274,0.032497771084308624,0.9238881468772888,2015-10-18,62667
296,india writers return awards to protest government silence on violence,0.08549642562866211,0.6039170622825623,0.31058648228645325,2015-10-18,62656
297,fearing election losses taiwans governing party drops its presidential candidate,0.010165239684283733,0.9448801279067993,0.0449545681476593,2015-10-18,62660
298,as conflicts flare up leaders fan sectarian flames in middle east,0.04673050716519356,0.6475293040275574,0.3057401776313782,2015-10-18,62718
299,britain to put commerce with china first in president xi jinpings state visit,0.35914936661720276,0.008663808926939964,0.6321868300437927,2015-10-18,62721
300,chinas growth slows to 6 9,0.008653467521071434,0.9600386023521423,0.03130798041820526,2015-10-19,62873
301,in a region disturbed by ethnic tensions china keeps tight lid on a massacre,0.2095741480588913,0.5054128170013428,0.2850130796432495,2015-10-19,62846
302,china economy xi jinping officials,0.02791753038764,0.04702882096171379,0.9250537157058716,2015-10-19,62977
303,painting seized in world war ii to be sold as restitution to jewish heirs,0.035954952239990234,0.06450258940458298,0.899542510509491,2015-10-19,62960
304,square hires former yahoo executive to run cash advance business,0.03746170923113823,0.028101928532123566,0.9344363808631897,2015-10-19,62956
305,today in politics congress returns from break to find a vacuum crisis and clinton,0.1732417494058609,0.20814219117164612,0.6186161041259766,2015-10-19,62923
306,jim webb a blip in the polls warns of an independent run,0.05006228759884834,0.721472978591919,0.22846472263336182,2015-10-19,63062
307,joe bidens account of stance on bin laden raid conflicts with others,0.03597097471356392,0.22156216204166412,0.742466926574707,2015-10-20,63302
308,united ceo oscar munoz hospitalization leadership,0.01936771720647812,0.8977698683738708,0.08286235481500626,2015-10-20,63036
309,discordant financial messages from china spur global unease,0.07308456301689148,0.7922705411911011,0.13464483618736267,2015-10-20,62986
310,guantanamo detainees request delays progress toward 9 11 trial,0.010970912873744965,0.896935224533081,0.09209389239549637,2015-10-20,63000
311,china economic growth is reducing coastal wetlands report finds,0.034123826771974564,0.9428561329841614,0.023020058870315552,2015-10-20,62915
312,report traces jeb bushs ties to companies that had business with florida,0.038805652409791946,0.07059196382761002,0.8906024098396301,2015-10-21,63333
313,watching syrias war as a music video shot by a russian drone,0.0404912531375885,0.14879110455513,0.8107176423072815,2015-10-21,63320
314,as migrants reach europe fears may be misplaced,0.07904833555221558,0.686793327331543,0.23415830731391907,2015-10-21,63205
315,credit agricole to pay 787 million for sanctions violations,0.10125934332609177,0.46201664209365845,0.4367240369319916,2015-10-21,63251
316,hedge fund assets decline by biggest amount since financial crisis,0.009250542148947716,0.9703902006149292,0.020359288901090622,2015-10-21,63239
317,jeb bush to address hispanic group tied to koch brothers,0.08402282744646072,0.01879551261663437,0.8971816301345825,2015-10-21,63403
318,americas flatware,0.20559310913085938,0.30594414472579956,0.4884626865386963,2015-10-21,63471
319,brazil pension crisis mounts as more retire earlier then pass benefits on,0.010809785686433315,0.9661810398101807,0.023009199649095535,2015-10-21,63145
320,yum brands to split china business into separate company,0.02099558897316456,0.035103216767311096,0.9439012408256531,2015-10-21,63182
321,mao zedong china quiz edX,0.03669123351573944,0.04375550150871277,0.919553279876709,2015-10-21,63383
322,european inquiry focuses on a mysterious starbucks business,0.02588609978556633,0.13935817778110504,0.8347557187080383,2015-10-22,63520
323,spotify in dispute over royalty payments,0.015046910382807255,0.8681455850601196,0.1168074682354927,2015-10-22,63554
324,china diplomats shooting cebu philippines,0.03513285890221596,0.5566974878311157,0.4081696569919586,2015-10-22,63410
325,us marine killed in jet crash in britain,0.034376051276922226,0.6672978401184082,0.2983260750770569,2015-10-22,63445
326,sounds of war recede to background in an eastern ukraine city,0.030930140987038612,0.2105562388896942,0.7585135698318481,2015-10-22,63441
327,warm in public joe biden and hillary clinton have been intense rivals in private,0.12601497769355774,0.14481410384178162,0.7291709184646606,2015-10-22,63624
328,joe biden saves obama from an awkward choice,0.15671652555465698,0.3581659495830536,0.48511749505996704,2015-10-22,63690
329,independent musicians find unexpected rewards in streaming,0.44644439220428467,0.014522494748234749,0.539033055305481,2015-10-23,63929
330,a whiff of intrigue as vatican disputes unfounded report on pope francis health,0.0579909086227417,0.4902883470058441,0.4517207145690918,2015-10-23,63916
331,south sudan thousands face starvation un warns,0.030132198706269264,0.8117647171020508,0.15810304880142212,2015-10-23,63931
332,xis visit to britain highlights broader shift in concerns about china,0.40298742055892944,0.4411311447620392,0.15588140487670898,2015-10-23,63725
333,china cuts interest rates for sixth time since november,0.017164457589387894,0.9403401613235474,0.04249540716409683,2015-10-24,64042
334,conservative pacs turn attack on gop leaders into fund raising tool,0.0316903293132782,0.4991028904914856,0.4692067503929138,2015-10-24,64001
335,france bus crash,0.038254041224718094,0.06090948358178139,0.9008364677429199,2015-10-24,63991
336,lesa kennedy of nascar on taking the lead in her family business,0.16162315011024475,0.02392815425992012,0.8144486546516418,2015-10-25,63764
337,risky business,0.02988847903907299,0.25183728337287903,0.7182741761207581,2015-10-25,63810
338,israel and jordan agree on steps to ease jerusalem tensions kerry says,0.8955529928207397,0.01709848828613758,0.08734853565692902,2015-10-25,64292
339,ex im bank dispute threatens ge factory that obama praised,0.023345574736595154,0.9119887948036194,0.06466566771268845,2015-10-26,64397
340,china mosuo lugu lake matrilineal society,0.030291039496660233,0.042393364012241364,0.9273155927658081,2015-10-26,64439
341,merkel and east european leaders discuss migrant crisis in brussels,0.04750635847449303,0.39947858452796936,0.5530150532722473,2015-10-26,64427
342,tony blair says iraq war helped give rise to isis,0.4892542064189911,0.03874974697828293,0.4719959497451782,2015-10-26,64436
343,fox business news details criteria for nov 10 debate and plans undercard,0.022968102246522903,0.03567194193601608,0.9413599371910095,2015-10-27,64943
344,standard chartered to wind down 2 more businesses in overhaul,0.022174615412950516,0.43132543563842773,0.5464999675750732,2015-10-27,64558
345,philips casts doubt on closing of sale of stake in led business,0.05175119638442993,0.1255270093679428,0.8227217793464661,2015-10-27,64535
346,china reinsurance group ipo tests volatile equity climate,0.017919596284627914,0.9430504441261292,0.03902995586395264,2015-10-27,64523
347,catholic church leaders issue appeal on climate change,0.10948961228132248,0.03914347663521767,0.8513668775558472,2015-10-27,64652
348,today in politics budget deal could do little to assuage shutdown stalwarts,0.06453907489776611,0.7892818450927734,0.14617910981178284,2015-10-27,64825
349,a new low in campaign finance,0.0766792893409729,0.9002272486686707,0.023093579337000847,2015-10-27,64777
350,carlyle group and vinci partners buy brazilian education business,0.14853201806545258,0.012480231001973152,0.8389877676963806,2015-10-27,64643
351,gms tentative labor deal is set for approval by union leaders,0.15463826060295105,0.06300488114356995,0.7823567986488342,2015-10-27,64716
352,belgian authorities see no terror link in car crash at army barracks,0.027596844360232353,0.3539133071899414,0.6184898018836975,2015-10-27,64736
353,challenging chinese claims us sends warship near artificial island chain,0.06151001527905464,0.7998800873756409,0.13860991597175598,2015-10-27,64732
354,a gop stalwarts task retooling candidate debates,0.31013044714927673,0.10428135097026825,0.5855881571769714,2015-10-27,64731
355,south china sea uss lassen spratly islands,0.051613397896289825,0.12545232474803925,0.8229342103004456,2015-10-28,64808
356,to help small businesses help immigrants,0.21368977427482605,0.026181688532233238,0.7601284980773926,2015-10-28,65206
357,house passes deadline extension for rail safety system,0.1796112209558487,0.06507894396781921,0.7553098797798157,2015-10-28,64967
358,dispute with david cameron opens new challenge to house of lords,0.08956778049468994,0.5749590992927551,0.33547312021255493,2015-10-28,64934
359,sabmiller expected to seek extension in takeover talks,0.25795528292655945,0.012512448243796825,0.7295322418212891,2015-10-28,64906
360,deeply divided republican electorate drifts toward ben carson poll shows,0.0367785282433033,0.7751114368438721,0.18811005353927612,2015-10-28,64964
361,the dueling narratives of the israeli palestinian conflict,0.057109542191028595,0.11238624155521393,0.8305042386054993,2015-10-28,64949
362,republican debate draws 14 million as viewership declines,0.01656816154718399,0.952190637588501,0.03124123252928257,2015-10-29,65483
363,china one child policy timeline,0.05018492043018341,0.030393708497285843,0.9194214344024658,2015-10-29,65477
364,republican tensions at cnbc boil over during and after debate,0.014486230909824371,0.8724688291549683,0.11304499953985214,2015-10-29,65465
365,your thursday evening briefing china republicans world series,0.04011154547333717,0.032645344734191895,0.9272431135177612,2015-10-29,65548
366,tony abbott australia europe migrant crisis,0.039229076355695724,0.33985820412635803,0.6209126710891724,2015-10-29,65052
367,south sudan war african union report,0.04494524374604225,0.14497067034244537,0.8100841045379639,2015-10-29,65241
368,beijing china volunteer retiree patrol,0.04727654159069061,0.03332715854048729,0.9193963408470154,2015-10-29,65125
369,carlyle posts quarterly loss after global market turmoil,0.013016259297728539,0.963101327419281,0.023882312700152397,2015-10-29,65109
370,french billionaire takes 5 stake in warburg pincus,0.04004566743969917,0.019609814509749413,0.9403444528579712,2015-10-29,65183
371,south korea statues honor wartime comfort women japan,0.11250939965248108,0.017330963164567947,0.8701596856117249,2015-10-29,65101
372,violence creating refugee crisis a un commissioner warns,0.06339078396558762,0.5452388525009155,0.39137038588523865,2015-10-29,65305
373,deutsche bank is expected to settle sanctions violation case for dollar200 million,0.07871223241090775,0.41086676716804504,0.5104209780693054,2015-10-29,65304
374,china pushes back against us influence in the seas of east asia,0.3502359390258789,0.19520099461078644,0.45456308126449585,2015-10-29,65287
375,uaw leaders approve proposed gm contract,0.30322787165641785,0.04339414834976196,0.653377890586853,2015-10-29,65302
376,china ends one child policy weibo wechat,0.043747298419475555,0.13330593705177307,0.8229467272758484,2015-10-30,65500
377,china ending one child policy,0.0399276465177536,0.2809770107269287,0.6790953278541565,2015-10-30,65499
378,edward snowden nsa whistleblower,0.05623064190149307,0.598450779914856,0.34531864523887634,2015-10-30,65462
379,delayed report on britains role in iraq war is expected in summer,0.016655130311846733,0.09883173555135727,0.8845131993293762,2015-10-30,65533
380,time warner cable and charter chiefs expect delay in merger,0.013761642388999462,0.7482967376708984,0.23794153332710266,2015-10-30,65467
381,saudi blogger raif badawi gets sakharov prize top eu human rights award,0.6550721526145935,0.059449102729558945,0.2854786515235901,2015-10-30,65396
382,china end one child policy,0.03728090971708298,0.07515963912010193,0.8875594139099121,2015-10-30,65395
383,experts weigh likely impacts of chinas one child reversal,0.03653562441468239,0.7225918173789978,0.2408726066350937,2015-10-30,65636
384,freedom house report china internet freedom,0.03669591248035431,0.02750832960009575,0.935795783996582,2015-10-30,65425
