,Headline,Positive,Negative,Neutral,date,article_id
412,sports authority bankruptcy part of larger wave,0.030576981604099274,0.019606690853834152,0.9498163461685181,2016-03-03,13140
413,new tremors in high finance rattle foundation of postcrisis regulations,0.09782735258340836,0.04486836865544319,0.8573043346405029,2016-03-03,13226
414,republican turmoil has historians straining for parallels,0.16793940961360931,0.49795567989349365,0.3341049253940582,2016-03-03,13394
415,even in a warming world it will still snow somewhere,0.12812530994415283,0.027440335601568222,0.8444343209266663,2016-03-04,19533
416,belgium terrorist plot france,0.018620839342474937,0.5791853666305542,0.4021938145160675,2016-03-04,19515
417,at berkshire hathaway meeting warren buffett talks of sharing the wealth,0.07024960219860077,0.014869914390146732,0.9148805141448975,2016-03-05,25445
418,wartime damascus preserves tenuous air of normalcy,0.23051753640174866,0.021942319348454475,0.7475401759147644,2016-03-05,25450
419,china ren zhiqiang,0.03148842230439186,0.0346037894487381,0.9339077472686768,2016-03-05,25304
420,donald trump trade policy china,0.042917609214782715,0.02851487137377262,0.9285674691200256,2016-03-05,25307
421,northeast china economy jobs,0.1684853434562683,0.04828164726495743,0.783233106136322,2016-03-05,25311
422,china demolition hainan beating,0.07353974878787994,0.07014505565166473,0.8563152551651001,2016-03-05,25295
423,ex cuomo aide paid by companies with state business records show,0.03782052546739578,0.1320735067129135,0.8301060199737549,2016-03-05,25397
424,in turner paintings at the met the bloody business of whaling,0.029570143669843674,0.284410297870636,0.6860195398330688,2016-03-06,31409
425,canada china wang yi,0.04280126094818115,0.03154424577951431,0.9256545305252075,2016-03-06,31340
426,in sumner redstone affair his decline upends estate planning,0.03160858899354935,0.4179708659648895,0.5504205822944641,2016-03-06,31485
427,mining for bitcoin in china,0.05471773445606232,0.02363636903464794,0.9216458797454834,2016-03-07,36696
428,bitcoin china,0.027851922437548637,0.028118621557950974,0.9440294504165649,2016-03-07,36697
429,after brexit a market recovery until the next crisis,0.3427524268627167,0.0442434623837471,0.6130040884017944,2016-03-07,36960
430,china activist zhai yanmin,0.11923806369304657,0.07511221617460251,0.8056497573852539,2016-03-08,42812
431,china uber didi chuxing,0.06574705243110657,0.04680124297738075,0.887451708316803,2016-03-09,48060
432,taco trucks on every corner trump supporters anti immigration warning,0.0853748470544815,0.4165182113647461,0.4981069266796112,2016-03-09,48155
433,china school long march,0.08553331345319748,0.052201833575963974,0.8622648119926453,2016-03-09,48102
434,yum brands in china adds owners with skill and connections,0.3150317072868347,0.010347018949687481,0.6746212840080261,2016-03-09,48224
435,china cultural revolution shantou museum,0.0409560427069664,0.039620425552129745,0.919423520565033,2016-03-10,53919
436,big oil slowly adapts to a warming world,0.1812889128923416,0.013346743769943714,0.8053643107414246,2016-03-11,59630
437,climate crisis big question how to inspire innovation,0.0457117035984993,0.03002353012561798,0.9242647886276245,2016-03-11,59631
438,alibaba earnings china,0.04148545488715172,0.02307300455868244,0.9354416131973267,2016-03-11,59471
439,philippines duterte south china sea,0.028919642791152,0.06563761830329895,0.9054427146911621,2016-03-11,59481
440,hong kong lawmakers oath china,0.08923237025737762,0.16638189554214478,0.7443857192993164,2016-03-11,59498
441,trump taiwan and china the controversy explained,0.058234166353940964,0.09524143487215042,0.8465243577957153,2016-03-12,65128
442,donald trump taiwan china,0.03825083374977112,0.05146150663495064,0.910287618637085,2016-03-12,65126
443,taiwan call gives china a clue on what to expect from donald trump,0.13092434406280518,0.01353541761636734,0.8555402159690857,2016-03-12,65081
444,trumps win gives stocks in private prison companies a reprieve,0.8855886459350586,0.03133563697338104,0.08307573944330215,2016-03-12,65097
445,the smollett family business acting and activism,0.0386526919901371,0.029912568628787994,0.9314348101615906,2016-03-13,14737
446,culture gap impedes us business efforts for trade with cuba,0.010237687267363071,0.9464057087898254,0.04335666447877884,2016-03-13,15413
447,syria control isis maps cease fire civil war five years,0.024770980700850487,0.33913546800613403,0.6360934972763062,2016-03-13,15373
448,china weighs letting banks sell bad debt to investors,0.15153135359287262,0.11024132370948792,0.7382273077964783,2016-03-13,15355
449,germanwings crash inquiry urges stricter oversight of pilots mental health,0.04574446752667427,0.13790634274482727,0.8163491487503052,2016-03-14,15472
450,nonprofit ads tap game of thrones to highlight real world conflict,0.07164662331342697,0.01668388769030571,0.9116694331169128,2016-03-14,15467
451,china heilongjiang governor mine protest,0.052468735724687576,0.27850642800331116,0.6690248250961304,2016-03-14,15454
452,donald trump jokes awkwardly about todd palin,0.038147155195474625,0.5632807612419128,0.39857208728790283,2016-03-14,15709
453,out of the navy and in business,0.041527487337589264,0.04350923001766205,0.9149632453918457,2016-03-15,15837
454,united arab emirates plane crashes yemen,0.01595364138484001,0.8614014387130737,0.12264487147331238,2016-03-15,15628
455,china halal food standards,0.07141171395778656,0.02340790256857872,0.9051803946495056,2016-03-15,15572
456,china xinhua typo xi jinping,0.039586249738931656,0.028276875615119934,0.9321368336677551,2016-03-15,15573
457,syria war children unicef,0.03575856611132622,0.5331968069076538,0.43104463815689087,2016-03-15,15577
458,walking dead to swarm universal studios year round,0.07968020439147949,0.027286672964692116,0.8930330872535706,2016-03-15,15609
459,china labor strike protest,0.02044413983821869,0.8909978866577148,0.08855798095464706,2016-03-15,15603
460,european union suspends aid to burundi over political crisis,0.011366081424057484,0.9269177913665771,0.06171608343720436,2016-03-15,15707
461,is the us now at war with the shabab not exactly,0.05232452601194382,0.38844719529151917,0.559228241443634,2016-03-15,15741
462,european refugee crisis,0.02517305128276348,0.4575425088405609,0.5172845125198364,2016-03-15,15698
463,fearing the tide in west point a slum already swamped with worry,0.03165852278470993,0.8081309795379639,0.16021044552326202,2016-03-16,15850
464,bangladesh police dispute isis claim that it killed shiite preacher,0.033826690167188644,0.8091995120048523,0.15697380900382996,2016-03-16,15934
465,white house cuba restrictions,0.03823472186923027,0.06786448508501053,0.8939007520675659,2016-03-16,15839
466,qube brookfield buy asciano australian ports business,0.043391067534685135,0.01875946670770645,0.9378495216369629,2016-03-16,15797
467,quonset makes a new name for itself in business,0.25851690769195557,0.010386005975306034,0.7310971021652222,2016-03-16,15838
468,hong kong china lau ming wai,0.07679256051778793,0.06636379659175873,0.8568436503410339,2016-03-16,15830
469,bernie sanders team insists it still sees a path forward,0.42189905047416687,0.013294539414346218,0.5648064613342285,2016-03-16,16242
470,17china li keqiang work report,0.03588616102933884,0.09476567059755325,0.8693481683731079,2016-03-16,16068
471,donald trump warns of riots if party blocks him at convention,0.026484325528144836,0.8541949391365051,0.11932069063186646,2016-03-16,16126
472,cbs looks to exit radio business,0.018033267930150032,0.31808292865753174,0.6638838052749634,2016-03-16,15951
473,ad wars come to arizona next battleground in republican race,0.11051969230175018,0.029520511627197266,0.8599598407745361,2016-03-17,16529
474,youve bought a small business now what,0.03911583498120308,0.03579801693558693,0.9250861406326294,2016-03-17,16211
475,peabody energy warns of possible bankruptcy filing,0.011943455785512924,0.9027799963951111,0.08527657389640808,2016-03-17,16136
476,china npc legislation proposals,0.046158138662576675,0.021957768127322197,0.9318840503692627,2016-03-17,16106
477,china national peoples congress,0.031435493379831314,0.04816997051239014,0.9203944802284241,2016-03-17,16098
478,putin warns against politicizing doping scandal,0.04968540742993355,0.09733326733112335,0.8529813289642334,2016-03-17,16192
479,cbs considers selling its us radio business,0.01947432942688465,0.3101238012313843,0.6704018712043762,2016-03-17,16196
480,the battles of wilmington nc in world war ii that is,0.025515057146549225,0.07886961847543716,0.8956153392791748,2016-03-17,16167
481,north korea otto warmbier sentenced,0.29272961616516113,0.07801688462495804,0.6292535662651062,2016-03-17,16052
482,china premier li keqiang economy,0.1257154941558838,0.08184749633073807,0.7924370169639587,2016-03-17,16083
483,pakistan peshawar bus explosion,0.03112776018679142,0.12042737007141113,0.8484448194503784,2016-03-17,16082
484,china xinjiang mao slogan,0.049104832112789154,0.05140731856226921,0.8994879126548767,2016-03-18,16340
485,delawares chief justice speaks out on big mergers and investors,0.03737064450979233,0.04575132951140404,0.9168780446052551,2016-03-18,16416
486,book awards influences,0.1373390555381775,0.03021342307329178,0.8324475288391113,2016-03-18,16746
487,china african wildlife foundation,0.037367429584264755,0.029302354902029037,0.933330237865448,2016-03-18,16296
488,spotify reaches settlement with publishers in licensing dispute,0.3415994942188263,0.5787874460220337,0.0796131044626236,2016-03-18,16528
489,the sellout wins national book critics circles fiction award,0.8470262885093689,0.029732055962085724,0.12324168533086777,2016-03-18,16530
490,lawyer for turing said he warned against drug price increase,0.11324246227741241,0.24963706731796265,0.6371204257011414,2016-03-18,16531
491,an african elephant named morgan strays into a war zone and survives,0.01785900816321373,0.8943392634391785,0.08780171722173691,2016-03-18,16482
492,obama to unseal files on argentinas dirty war,0.025657866150140762,0.8088447451591492,0.16549746692180634,2016-03-18,16558
493,un officials warned that congolese soldiers were linked to rape,0.03654995560646057,0.7473441958427429,0.21610590815544128,2016-03-18,16560
494,ted cruz plays to fear of immigrants in arizona,0.11510422825813293,0.09973948448896408,0.78515625,2016-03-18,16566
495,morocco orders un to cut staff in disputed western sahara territory,0.008825408294796944,0.9611557722091675,0.030018851161003113,2016-03-18,16568
496,business executive from china is charged in un bribery case,0.04185701534152031,0.7894976139068604,0.16864533722400665,2016-03-19,16819
497,dubai airliner crashes while trying to land at russian airport,0.016649503260850906,0.9357048273086548,0.04764561355113983,2016-03-19,16849
498,an educated guess on how much star wars the force awakens will make for disney,0.10031754523515701,0.01125381886959076,0.8884286284446716,2016-03-19,16754
499,china paper waist challenge,0.08004186302423477,0.03508485481142998,0.8848733305931091,2016-03-19,16629
