,Headline,Positive,Negative,Neutral,date,article_id
457,azerbaijan armenia conflict nagorno karabakh,0.041984181851148605,0.062036968767642975,0.8959788084030151,2020-09-27,3943
458,china mine disaster,0.03999144956469536,0.06721558421850204,0.8927929997444153,2020-09-27,3942
459,amy coney barrett business supreme court,0.06033901497721672,0.10279306024312973,0.8368678689002991,2020-09-27,3951
460,coronavirus education child labor,0.030116625130176544,0.1706690937280655,0.7992143630981445,2020-09-27,3972
461,covid 19 india children school education labor,0.06329909712076187,0.02066127024590969,0.9160395860671997,2020-09-27,3956
462,new york small businesses,0.033748939633369446,0.13195756077766418,0.83429354429245,2020-09-28,4117
463,france marseille virus restaurants,0.04472407326102257,0.11841987073421478,0.8368560075759888,2020-09-28,4108
464,italy warship migrants libya cigarettes smuggling,0.031946517527103424,0.11009464412927628,0.8579588532447815,2020-09-28,4135
465,covid 1 million deaths,0.05148966610431671,0.0185149647295475,0.9299952983856201,2020-09-28,4160
466,white house cdc coronavirus schools,0.04520381614565849,0.5064229369163513,0.44837328791618347,2020-09-28,4157
467,china consumers beijing auto show,0.12479548156261444,0.016865655779838562,0.8583388924598694,2020-09-28,4020
468,coronavirus pandemic income inequality,0.1267220824956894,0.27840813994407654,0.5948697328567505,2020-09-28,4085
469,myanmars virus restrictions keep journalists at home,0.02095693163573742,0.6806435585021973,0.2983994781970978,2020-09-28,4060
470,europe coronavirus protests,0.028481515124440193,0.10468815267086029,0.8668302893638611,2020-09-28,4063
471,coronavirus indian health service,0.022018151357769966,0.15006236732006073,0.8279194831848145,2020-09-29,4220
472,hong kong protesters china,0.027669966220855713,0.7287037968635559,0.24362625181674957,2020-09-29,4234
473,disney theme park workers layoffs,0.008437474258244038,0.9415745139122009,0.049987949430942535,2020-09-29,4359
474,coronavirus quebec ontario lockdowns,0.01674598455429077,0.6501882076263428,0.33306577801704407,2020-09-29,4353
475,we have a higher deficit with china now than we did before,0.1828269511461258,0.6478798985481262,0.16929318010807037,2020-09-29,4405
476,china teacher poison students,0.03728751093149185,0.662997841835022,0.2997146248817444,2020-09-29,4415
477,sweden coronavirus strategy,0.022394170984625816,0.17470456659793854,0.8029012680053711,2020-09-29,4254
478,netanyahu says israels nationwide lockdown is likely to last at least a month,0.032244615256786346,0.64253830909729,0.3252170979976654,2020-09-29,4311
479,putin virus russia bubble,0.07943782210350037,0.03271789848804474,0.8878442049026489,2020-09-30,4557
480,house intelligence china,0.027198702096939087,0.05972735583782196,0.9130738973617554,2020-09-30,4561
481,wall street uncertainty election,0.03422067314386368,0.610382080078125,0.3553972542285919,2020-09-30,4526
482,ocasio cortez warren new yorker festival union,0.04539334774017334,0.04587602987885475,0.9087306261062622,2020-09-30,4537
483,pompeo pope francis china,0.06402405351400375,0.02373502217233181,0.9122409224510193,2020-09-30,4605
484,trump coronavirus misinformation,0.021301541477441788,0.51412433385849,0.4645741879940033,2020-09-30,4600
485,ski party pandemic travel coronavirus,0.028332309797406197,0.34892958402633667,0.6227380633354187,2020-09-30,4518
486,covid lockdown madrid spain,0.025249361991882324,0.06542064994573593,0.9093299508094788,2020-09-30,4463
487,airline worker furloughs coronavirus,0.019251372665166855,0.7877689599990845,0.19297975301742554,2020-09-30,4435
488,trump biden debate business,0.05306684225797653,0.03747684881091118,0.9094563722610474,2020-09-30,4486
489,iran plane crash suleimani,0.052528850734233856,0.29745540022850037,0.6500157713890076,2020-10-01,1320
490,cnn labor dispute settlement,0.025964101776480675,0.7723060846328735,0.20172978937625885,2020-10-01,1331
491,missile iran plane crash,0.027209147810935974,0.2923128604888916,0.6804779171943665,2020-10-01,1339
492,iran tehran airport crash flights,0.02054128609597683,0.7771871089935303,0.20227161049842834,2020-10-01,1336
493,china virus wuhan death,0.030996784567832947,0.0868372693657875,0.8821659684181213,2020-10-01,1329
494,iran jet crash,0.04249033331871033,0.09240356087684631,0.8651061058044434,2020-10-01,1327
495,iran crash victims canada,0.03168507292866707,0.6037760376930237,0.36453884840011597,2020-10-01,1332
496,trump pompeo iran sanctions,0.06228572130203247,0.05944446101784706,0.8782697916030884,2020-10-01,1262
497,spirit aerosystems layoffs,0.00942931231111288,0.9066507816314697,0.08391989022493362,2020-10-01,1261
498,iran ukraine plane crash,0.02414499782025814,0.48146772384643555,0.4943872094154358,2020-10-01,1186
499,elizabeth warren disability plan,0.031056765466928482,0.044074103236198425,0.9248691201210022,2020-10-01,1201
