,Headline,Positive,Negative,Neutral,date,article_id
437,china billionaire guo wengui xi mar a lago,0.13248120248317719,0.029217608273029327,0.8383011221885681,2017-04-15,18059
438,trump appointees potential conflicts,0.02487725391983986,0.3096619248390198,0.6654608845710754,2017-04-15,18067
439,emerging market stocks have come roaring back can they go any higher,0.44019168615341187,0.1629394143819809,0.39686891436576843,2017-04-15,18094
440,fewer children in greece may add to its financial crisis,0.00980414729565382,0.9672319293022156,0.022964034229516983,2017-04-16,18148
441,north korea missile crisis slow motion,0.028332091867923737,0.5110134482383728,0.46065443754196167,2017-04-16,18178
442,china gdp,0.03393934667110443,0.05102885514497757,0.9150317907333374,2017-04-16,18182
443,time to be honest about the fear thats getting in your way,0.07892850786447525,0.08070392161607742,0.8403675556182861,2017-04-17,18269
444,north korea nuclear weapons missiles sanctions,0.04304572567343712,0.14133359491825104,0.8156206607818604,2017-04-17,18267
445,united continental netflix earnings markets stocks bonds ,0.024247504770755768,0.06557480245828629,0.9101777076721191,2017-04-17,18237
446,china north korea war,0.03233304247260094,0.06897835433483124,0.8986886739730835,2017-04-18,18413
447,north korea south china shen zhihua,0.07094640284776688,0.027307158336043358,0.9017464518547058,2017-04-18,18414
448,movers bank goldman sachs earnings housing starts yahoo cardinal medtronic stocks markets,0.03149165213108063,0.05267743766307831,0.9158309102058411,2017-04-18,18395
449,exxon mobil russia sanctions waiver oil,0.057238660752773285,0.40265530347824097,0.5401060581207275,2017-04-19,18649
450,china guo wengui interpol voice of america,0.03915024921298027,0.028622467070817947,0.9322272539138794,2017-04-19,18694
451,china apple app store,0.033336788415908813,0.030277587473392487,0.9363856315612793,2017-04-19,18606
452,china companies complain,0.0457816906273365,0.07335437834262848,0.8808639049530029,2017-04-19,18507
453,china minsheng shadow banking,0.025804754346609116,0.03500738739967346,0.9391878247261047,2017-04-19,18579
454,taiwan china asylum zhang xiangzhong,0.06390652060508728,0.08647996932268143,0.8496134877204895,2017-04-19,18563
455,trump targets steel trade but china will be tough to contain,0.09045183658599854,0.04492687061429024,0.8646213412284851,2017-04-20,18796
456,venezuela general motors business protests,0.028416596353054047,0.25968724489212036,0.7118961215019226,2017-04-20,18785
457,china anti gay banner university,0.06519349664449692,0.06944403052330017,0.8653624653816223,2017-04-20,18750
458,fears of revolt by consumers felled bill oreilly,0.030868543311953545,0.9182198643684387,0.05091153457760811,2017-04-20,18914
459,with the old breed e b sledge world war ii memoir,0.07421352714300156,0.020639482885599136,0.9051469564437866,2017-04-20,18848
460,treasury exxon mobil sanctions waiver,0.03256412222981453,0.22190023958683014,0.7455356121063232,2017-04-21,19056
461,23gretchen morgenson wells fargo elizabeth warren,0.048583026975393295,0.07315793633460999,0.8782590627670288,2017-04-21,19045
462,one countrys war changed the world,0.07108655571937561,0.18158984184265137,0.7473235726356506,2017-04-21,18935
463,stocks movers markets general electric honeywell world bank imf bonds,0.030359255149960518,0.04573000594973564,0.9239107370376587,2017-04-21,18989
464,vietnam hostages protest land dispute eviction,0.021919406950473785,0.8430653214454651,0.13501523435115814,2017-04-21,18990
465,tax code business,0.030018147081136703,0.030703848227858543,0.9392779469490051,2017-04-21,19037
466,wills avoiding family conflict,0.055719174444675446,0.10736318677663803,0.8369176387786865,2017-04-21,19014
467,philippines south china sea,0.02587488293647766,0.061218999326229095,0.9129060506820679,2017-04-21,18997
468,vietnam hostages land dispute,0.03302237018942833,0.17722928524017334,0.7897483110427856,2017-04-22,19154
469,indiana united technology factory layoffs,0.008206437341868877,0.9514243006706238,0.040369365364313126,2017-04-23,19272
470,afghan base massacre taliban fight uncertainty,0.04186505451798439,0.6623601913452148,0.29577481746673584,2017-04-23,19274
471,north korea trump china xi jinping,0.05441218987107277,0.04867519065737724,0.896912693977356,2017-04-24,19302
472,movers stocks bonds markets,0.026836561039090157,0.05331665650010109,0.919846773147583,2017-04-24,19347
473,six steps to ditching your fear and starting that big thing,0.1171729788184166,0.014486603438854218,0.8683404326438904,2017-04-24,19360
474,un syria war crimes,0.04040153697133064,0.3231034576892853,0.6364949941635132,2017-04-24,19405
475,trump syria chemical weapons missiles sanctions,0.03247641772031784,0.11249028891324997,0.8550333380699158,2017-04-24,19395
476,trump business tax market reaction,0.043691858649253845,0.03382708504796028,0.9224810004234314,2017-04-25,19584
477,in china daydreaming students are caught on camera,0.024731963872909546,0.251138299703598,0.7241296768188477,2017-04-25,19564
478,china aircraft carrier,0.07571206986904144,0.018068095669150352,0.9062198400497437,2017-04-25,19644
479,china zouping debt bank crisis,0.02190627157688141,0.2825607657432556,0.695533037185669,2017-04-25,19551
480,sandy phan gillis china houston espionage,0.036952801048755646,0.028362326323986053,0.9346848726272583,2017-04-25,19537
481,china xinjiang ban muslim names muhammad jihad,0.035262007266283035,0.15008655190467834,0.8146514892578125,2017-04-25,19526
482,north korea trump nuclear war,0.04286544770002365,0.16173440217971802,0.7954001426696777,2017-04-26,19663
483,the low inflation world may be sticking around longer than expected,0.059933215379714966,0.767511785030365,0.17255505919456482,2017-04-26,19660
484,huawei investigation sanctions subpoena,0.03457769751548767,0.387937068939209,0.5774852633476257,2017-04-26,19694
485,mexico fuel theft crisis,0.024512074887752533,0.4539944529533386,0.5214934349060059,2017-04-26,19825
486,ivanka trump syria refugees humanitarian crisis,0.030227094888687134,0.4292965233325958,0.540476381778717,2017-04-26,19851
487,augustin edwards dead chile publisher,0.03259919583797455,0.12141413241624832,0.8459867238998413,2017-04-26,19797
488,north korea thaad missile defense us china,0.031557608395814896,0.03856289014220238,0.9298794269561768,2017-04-27,19903
489,hong kong protest arrests china,0.01956988498568535,0.8622562289237976,0.11817386001348495,2017-04-27,19911
490,new balance china trademark,0.11750362068414688,0.017614630982279778,0.864881694316864,2017-04-27,19917
491,movers earnings stocks amazon google alphabet microsoft ford lloyds,0.03554832935333252,0.04075342416763306,0.9236982464790344,2017-04-27,19919
492,china eb 5 golden visa,0.4273693859577179,0.023396477103233337,0.54923415184021,2017-04-27,19970
493,north korea south tensions,0.05795357748866081,0.06242397800087929,0.8796225190162659,2017-04-27,19930
494,how trumps tax plan affects businesses him and us,0.02294681780040264,0.05663419887423515,0.920418918132782,2017-04-27,19994
495,individual business tax wealth,0.022693390026688576,0.04071037098765373,0.9365962147712708,2017-04-27,20067
496,germany syrian refugees tensions,0.023746712133288383,0.40189647674560547,0.5743567943572998,2017-04-28,20084
497,movers gdp corporate earnings exxon chevron stocks markets,0.030497215688228607,0.09235366433858871,0.8771491646766663,2017-04-28,20158
498,china didi chuxing uber,0.05496229603886604,0.04723464697599411,0.897803008556366,2017-04-28,20156
499,china oysters denmark,0.05188049376010895,0.03570019081234932,0.912419319152832,2017-04-28,20155
