,Unnamed: 0,article_id,article_url,comment_count,year,date,title,datetimeobject
57033,22092,22093,https://www.nytimes.com/2015/04/10/world/asia/china-detained-womens-rights-activists.html,0,2015,10/04/2015,china detained womens rights activists,2015-10-04
57113,22394,22395,https://news.blogs.nytimes.com/2015/04/10/morning-agenda-g-e-to-sell-bulk-of-finance-unit/,0,2015,10/04/2015,morning agenda g e to sell bulk of finance unit,2015-10-04
57135,22313,22314,https://www.nytimes.com/2015/04/10/nyregion/in-aftermath-of-east-village-blast-business-owners-vow-to-rebuild.html,0,2015,10/04/2015,in aftermath of east village blast business owners vow to rebuild,2015-10-04
57141,22309,22310,https://www.nytimes.com/2015/04/10/world/europe/italy-man-opens-fire-in-court-during-bankruptcy-hearing.html,0,2015,10/04/2015,italy man opens fire in court during bankruptcy hearing,2015-10-04
57168,22320,22321,https://www.nytimes.com/2015/04/10/us/politics/civil-wars-lessons-resound-150-years-later.html,0,2015,10/04/2015,civil wars lessons resound 150 years later,2015-10-04
57286,28892,28893,https://www.nytimes.com/2015/05/10/us/politics/obama-calls-elizabeth-warren-absolutely-wrong-on-trans-pacific-trade-deal.html,0,2015,10/05/2015,obama calls elizabeth warren absolutely wrong on trans pacific trade deal,2015-10-05
57306,28912,28913,https://www.nytimes.com/2015/05/10/nyregion/medals-and-memories-for-jewish-world-war-ii-veterans-from-russia.html,0,2015,10/05/2015,medals and memories for jewish world war ii veterans from russia,2015-10-05
57321,28836,28837,https://www.nytimes.com/2015/05/10/business/accused-of-spying-for-china-until-she-wasnt.html,0,2015,10/05/2015,accused of spying for china until she wasnt,2015-10-05
57349,28854,28855,https://www.nytimes.com/2015/05/10/world/africa/after-ebola-outbreak-liberian-churches-confront-crisis-of-faith.html,0,2015,10/05/2015,after ebola outbreak liberian churches confront crisis of faith,2015-10-05
57480,35654,35655,https://sinosphere.blogs.nytimes.com/2015/06/10/european-businesses-hit-by-chinas-cooling-economy/,0,2015,10/06/2015,european businesses hit by chinas cooling economy,2015-10-06
57488,35570,35571,https://www.nytimes.com/2015/06/10/world/europe/greece-un-warns-that-migrants-may-overwhelm-tourist-island-of-lesbos.html,0,2015,10/06/2015,greece un warns that migrants may overwhelm tourist island of lesbos,2015-10-06
57551,35502,35503,https://www.nytimes.com/2015/06/10/business/dealbook/blackrock-hires-columbia-finance-professor-to-guide-new-investment-strategy.html,0,2015,10/06/2015,blackrock hires columbia finance professor to guide new investment strategy,2015-10-06
57566,35761,35762,https://www.nytimes.com/politics/first-draft/2015/06/10/elizabeth-warren-calls-out-education-department-over-student-loans/,0,2015,10/06/2015,elizabeth warren calls out education department over student loans,2015-10-06
57612,35529,35530,https://www.nytimes.com/2015/06/10/business/dealbook/global-index-may-add-chinese-stocks-fueling-investment.html,0,2015,10/06/2015,global index may add chinese stocks fueling investment,2015-10-06
57616,35421,35422,https://www.nytimes.com/2015/06/10/world/asia/south-korea-mers-virus-pneumonia-patients.html,0,2015,10/06/2015,south korea mers virus pneumonia patients,2015-10-06
57621,35416,35417,https://www.nytimes.com/2015/06/10/realestate/commercial/new-jersey-battles-to-attract-food-businesses.html,0,2015,10/06/2015,new jersey battles to attract food businesses,2015-10-06
57632,35446,35447,https://www.nytimes.com/2015/06/10/business/dealbook/to-move-forward-hsbc-looks-back.html,0,2015,10/06/2015,to move forward hsbc looks back,2015-10-06
57648,35431,35432,https://www.nytimes.com/2015/06/10/world/europe/an-audacious-project-and-its-founder-slide-toward-failure-in-paris.html,0,2015,10/06/2015,an audacious project and its founder slide toward failure in paris,2015-10-06
57679,35377,35378,https://www.nytimes.com/2015/06/10/us/politics/marco-rubio-finances-debt-loans-credit.html,957,2015,10/06/2015,marco rubio finances debt loans credit,2015-10-06
57696,41979,41980,https://www.nytimes.com/2015/07/10/world/asia/china-frees-zhang-miao-employee-of-die-zeit.html,0,2015,10/07/2015,china frees zhang miao employee of die zeit,2015-10-07
57731,41975,41976,https://www.nytimes.com/2015/07/10/world/asia/thailand-deports-uighur-migrants-to-china.html,0,2015,10/07/2015,thailand deports uighur migrants to china,2015-10-07
57759,41991,41992,https://www.nytimes.com/2015/07/10/business/international/why-chinas-stock-market-bailout-just-might-work.html,0,2015,10/07/2015,why chinas stock market bailout just might work,2015-10-07
57830,41933,41934,https://www.nytimes.com/2015/07/10/world/asia/china-stock-market-crash-communist-xi-jinping.html,51,2015,10/07/2015,china stock market crash communist xi jinping,2015-10-07
57846,41803,41804,https://www.nytimes.com/2015/07/10/business/chinese-stocks-stabilize-but-fears-persist.html,0,2015,10/07/2015,chinese stocks stabilize but fears persist,2015-10-07
57917,47371,47372,https://opinionator.blogs.nytimes.com/2015/08/10/when-prostitution-is-nobodys-business/,224,2015,10/08/2015,when prostitution is nobodys business,2015-10-08
57972,47332,47333,https://www.nytimes.com/2015/08/10/business/mtime-helps-hollywood-clear-chinas-marketing-hurdles-and-reach-fans.html,0,2015,10/08/2015,mtime helps hollywood clear chinas marketing hurdles and reach fans,2015-10-08
58055,47265,47266,https://www.nytimes.com/2015/08/10/us/politics/similarities-aside-bernie-sanders-isnt-rerunning-howard-deans-2004-race.html,0,2015,10/08/2015,similarities aside bernie sanders isnt rerunning howard deans 2004 race,2015-10-08
58131,53728,53729,https://www.nytimes.com/interactive/2015/09/10/world/europe/scale-of-migrant-crisis-in-europe.html,0,2015,10/09/2015,scale of migrant crisis in europe,2015-10-09
58227,53428,53429,https://www.nytimes.com/2015/09/10/world/europe/europe-migrant-crisis-jean-claude-juncker.html,327,2015,10/09/2015,europe migrant crisis jean claude juncker,2015-10-09
58237,53453,53454,https://www.nytimes.com/2015/09/10/world/asia/in-china-a-forceful-crackdown-in-response-to-stock-market-crisis.html,109,2015,10/09/2015,in china a forceful crackdown in response to stock market crisis,2015-10-09
58298,53563,53564,https://www.nytimes.com/2015/09/10/world/europe/migrants-refugee-tensions-in-europe.html,0,2015,10/09/2015,migrants refugee tensions in europe,2015-10-09
58369,60854,60855,https://www.nytimes.com/2015/10/10/world/asia/bao-zhuoxuan-wang-yu-son-myanmar-china.html,0,2015,10/10/2015,bao zhuoxuan wang yu son myanmar china,2015-10-10
58394,61065,61066,https://www.nytimes.com/2015/10/10/business/dealbook/fiat-chrysler-to-move-forward-with-ferrari-ipo.html,0,2015,10/10/2015,fiat chrysler to move forward with ferrari ipo,2015-10-10
58406,61068,61069,https://www.nytimes.com/2015/10/10/business/defamation-suit-against-cosby-will-go-forward-in-massachusetts.html,0,2015,10/10/2015,defamation suit against cosby will go forward in massachusetts,2015-10-10
58437,68085,68086,https://www.nytimes.com/roomfordebate/2015/11/10/is-vw-proof-that-businesses-cant-regulate-themselves,0,2015,10/11/2015,is vw proof that businesses cant regulate themselves,2015-10-11
58477,68115,68116,https://www.nytimes.com/politics/first-draft/2015/11/10/poll-watch-overseas-elections-offer-warnings-for-u-s-pollsters/,0,2015,10/11/2015,poll watch overseas elections offer warnings for u s pollsters,2015-10-11
58503,68207,68208,https://artsbeat.blogs.nytimes.com/2015/11/10/netflix-to-finance-film-by-snowpiercer-director/,0,2015,10/11/2015,netflix to finance film by snowpiercer director,2015-10-11
58557,67874,67875,https://www.nytimes.com/2015/11/10/world/africa/an-island-refuge-surrounded-by-bloody-civil-war-in-south-sudan.html,0,2015,10/11/2015,an island refuge surrounded by bloody civil war in south sudan,2015-10-11
58573,67916,67917,https://www.nytimes.com/2015/11/10/world/europe/as-china-and-europe-age-path-to-more-children-lies-beyond-bedroom.html,0,2015,10/11/2015,as china and europe age path to more children lies beyond bedroom,2015-10-11
58579,67963,67964,https://www.nytimes.com/2015/11/10/us/politics/cuban-peers-dispute-ted-cruzs-fathers-story-of-fighting-for-castro.html,0,2015,10/11/2015,cuban peers dispute ted cruzs fathers story of fighting for castro,2015-10-11
58591,68029,68030,https://www.nytimes.com/2015/11/10/business/energy-environment/shift-to-lower-carbon-energy-is-too-slow-report-warns.html,0,2015,10/11/2015,shift to lower carbon energy is too slow report warns,2015-10-11
58594,68032,68033,https://www.nytimes.com/2015/11/10/world/europe/nato-war-games-unwittingly-put-soviets-and-us-on-hair-trigger-in-83-analysis-suggests.html,0,2015,10/11/2015,nato war games unwittingly put soviets and us on hair trigger in 83 analysis suggests,2015-10-11
58623,68000,68001,https://www.nytimes.com/2015/11/10/world/middleeast/suspects-in-russian-jet-crash-risk-exposing-their-isis-allies-to-a-backlash.html,0,2015,10/11/2015,suspects in russian jet crash risk exposing their isis allies to a backlash,2015-10-11
58635,74382,74383,https://www.nytimes.com/2015/12/10/us/politics/a-congress-that-doesnt-want-to-weigh-in-on-war.html,0,2015,10/12/2015,a congress that doesnt want to weigh in on war,2015-10-12
58643,74391,74392,https://www.nytimes.com/2015/12/10/business/gm-compensated-some-pre-bankruptcy-crash-victims.html,0,2015,10/12/2015,gm compensated some pre bankruptcy crash victims,2015-10-12
58644,74392,74393,https://www.nytimes.com/2015/12/10/business/walmart-prepares-to-enter-mobile-payments-business.html,0,2015,10/12/2015,walmart prepares to enter mobile payments business,2015-10-12
58674,74360,74361,https://www.nytimes.com/2015/12/10/world/americas/venezuelas-defeated-ruling-party-riven-by-conflict-and-scorn.html,0,2015,10/12/2015,venezuelas defeated ruling party riven by conflict and scorn,2015-10-12
58686,74372,74373,https://www.nytimes.com/2015/12/10/sports/baseball/diamondbacks-not-worried-about-future-or-finances.html,4,2015,10/12/2015,diamondbacks not worried about future or finances,2015-10-12
58687,74373,74374,https://www.nytimes.com/2015/12/10/us/politics/fbi-chief-says-texas-gunman-used-encryption-to-text-overseas-terrorist.html,0,2015,10/12/2015,fbi chief says texas gunman used encryption to text overseas terrorist,2015-10-12
58720,74755,74756,https://www.nytimes.com/interactive/2015/12/10/business/international/south-china-morning-post-history.html,0,2015,10/12/2015,south china morning post history,2015-10-12
58733,74430,74431,https://news.blogs.nytimes.com/2015/12/10/morning-agenda-yahoo-to-spin-off-core-business/,0,2015,10/12/2015,morning agenda yahoo to spin off core business,2015-10-12
58750,74549,74550,https://www.nytimes.com/politics/first-draft/2015/12/10/new-york-business-leaders-full-page-ad-praises-citys-immigrants/,0,2015,10/12/2015,new york business leaders full page ad praises citys immigrants,2015-10-12
58764,74204,74205,https://www.nytimes.com/2015/12/10/world/europe/ukraine-conflict-toll.html,0,2015,10/12/2015,ukraine conflict toll,2015-10-12
58770,74220,74221,https://www.nytimes.com/2015/12/10/business/smallbusiness/small-business-counter-bad-reviews.html,0,2015,10/12/2015,small business counter bad reviews,2015-10-12
58790,74132,74133,https://www.nytimes.com/2015/12/10/business/dealbook/china-ipo-trading-hiatus.html,0,2015,10/12/2015,china ipo trading hiatus,2015-10-12
58807,74175,74176,https://www.nytimes.com/2015/12/10/world/asia/china-climate-change-smog-pollution.html,12,2015,10/12/2015,china climate change smog pollution,2015-10-12
58819,74312,74313,https://www.nytimes.com/2015/12/10/world/asia/india-climate-change-global-warming.html,0,2015,10/12/2015,india climate change global warming,2015-10-12
58832,74327,74328,https://www.nytimes.com/2015/12/10/business/dealbook/how-to-value-yahoos-core-business.html,0,2015,10/12/2015,how to value yahoos core business,2015-10-12
58839,74336,74337,https://www.nytimes.com/2015/12/10/world/asia/as-us-and-europe-pass-the-hat-at-climate-talks-china-clings-to-developing-nation-status.html,0,2015,10/12/2015,as us and europe pass the hat at climate talks china clings to developing nation status,2015-10-12
58871,74285,74286,https://www.nytimes.com/2015/12/10/business/dealbook/argentinas-next-finance-chief-meets-debt-dispute-mediator.html,0,2015,10/12/2015,argentinas next finance chief meets debt dispute mediator,2015-10-12
58913,61390,61391,https://www.nytimes.com/2015/10/13/world/asia/china-sentences-2-former-top-communist-party-officials-over-bribes.html,0,2015,13/10/2015,china sentences 2 former top communist party officials over bribes,2015-10-13
58917,61395,61396,https://www.nytimes.com/2015/10/13/world/asia/us-asia-south-china-sea-patrols.html,0,2015,13/10/2015,us asia south china sea patrols,2015-10-13
58936,61484,61485,https://www.nytimes.com/2015/10/13/world/europe/russia-says-it-has-detained-a-terrorist-cell-in-moscow.html,0,2015,13/10/2015,russia says it has detained a terrorist cell in moscow,2015-10-13
58940,61541,61542,https://www.nytimes.com/2015/10/13/us/politics/in-choreographed-campaigns-candidates-stumble-over-choice-of-music.html,0,2015,13/10/2015,in choreographed campaigns candidates stumble over choice of music,2015-10-13
58941,61540,61541,https://www.nytimes.com/2015/10/13/world/asia/china-fire-strikes-tianjin-2-months-after-fatal-blast.html,0,2015,13/10/2015,china fire strikes tianjin 2 months after fatal blast,2015-10-13
58946,61364,61365,https://www.nytimes.com/2015/10/13/world/asia/china-bao-zhuoxuan-son-wang-yu-rights-lawyer-house-arrest.html,0,2015,13/10/2015,china bao zhuoxuan son wang yu rights lawyer house arrest,2015-10-13
58960,61463,61464,https://www.nytimes.com/2015/10/13/world/asia/2-afghan-military-aircraft-crash-as-flights-become-more-crucial.html,0,2015,13/10/2015,2 afghan military aircraft crash as flights become more crucial,2015-10-13
59037,61621,61622,https://www.nytimes.com/politics/first-draft/2015/10/13/poll-watch-voters-like-joe-biden-on-honesty-and-donald-trump-for-leadership-skills/,0,2015,13/10/2015,poll watch voters like joe biden on honesty and donald trump for leadership skills,2015-10-13
59085,61643,61644,https://www.nytimes.com/2015/10/14/business/dealbook/inertia-may-decide-fate-of-proposed-changes-to-bankruptcy-law.html,0,2015,14/10/2015,inertia may decide fate of proposed changes to bankruptcy law,2015-10-14
59186,61703,61704,https://www.nytimes.com/2015/10/14/business/wework-ends-combative-dispute-with-former-janitorial-workers.html,0,2015,14/10/2015,wework ends combative dispute with former janitorial workers,2015-10-14
59213,61725,61726,https://www.nytimes.com/2015/10/14/world/europe/new-labour-party-leadership-widens-rift-between-left-and-center.html,0,2015,14/10/2015,new labour party leadership widens rift between left and center,2015-10-14
59258,61902,61903,https://www.nytimes.com/politics/first-draft/2015/10/14/group-supporting-hillary-clinton-releases-hispanic-themed-ad/,0,2015,14/10/2015,group supporting hillary clinton releases hispanic themed ad,2015-10-14
59337,62336,62337,https://www.nytimes.com/politics/first-draft/2015/10/15/top-party-official-accuses-democratic-national-chairwoman-of-lying-questions-her-leadership/,0,2015,15/10/2015,top party official accuses democratic national chairwoman of lying questions her leadership,2015-10-15
59402,61852,61853,https://www.nytimes.com/2015/10/15/business/dealbook/blackrock-sees-inflow-of-money-even-amid-market-volatility.html,0,2015,15/10/2015,blackrock sees inflow of money even amid market volatility,2015-10-15
59422,61873,61874,https://www.nytimes.com/2015/10/15/world/asia/china-britain-magna-carta-renmin-university.html,0,2015,15/10/2015,china britain magna carta renmin university,2015-10-15
59550,62420,62421,https://www.nytimes.com/politics/first-draft/2015/10/16/treasurys-warning-on-debt-limit-seen-as-cudgel-to-congress/,0,2015,16/10/2015,treasurys warning on debt limit seen as cudgel to congress,2015-10-16
59625,62082,62083,https://www.nytimes.com/2015/10/16/business/dealbook/huarong-china-ipo-debt.html,0,2015,16/10/2015,huarong china ipo debt,2015-10-16
59662,62800,62801,https://www.nytimes.com/interactive/2015/10/16/world/middleeast/untangling-the-overlapping-conflicts-in-the-syrian-war.html,0,2015,16/10/2015,untangling the overlapping conflicts in the syrian war,2015-10-16
59663,62158,62159,https://www.nytimes.com/2015/10/16/world/europe/migrant-crisis-europe.html,0,2015,16/10/2015,migrant crisis europe,2015-10-16
59686,62141,62142,https://www.nytimes.com/2015/10/16/world/europe/europe-refugee-crisis-questions.html,0,2015,16/10/2015,europe refugee crisis questions,2015-10-16
59739,62323,62324,https://www.nytimes.com/2015/10/16/world/middleeast/conflicting-accounts-of-jerusalem-strife-surround-a-wounded-arab-boy.html,0,2015,16/10/2015,conflicting accounts of jerusalem strife surround a wounded arab boy,2015-10-16
59762,62346,62347,https://www.nytimes.com/2015/10/16/world/europe/four-children-among-migrants-found-after-boat-crash-near-greece.html,0,2015,16/10/2015,four children among migrants found after boat crash near greece,2015-10-16
59763,62344,62345,https://www.nytimes.com/2015/10/16/world/americas/canadian-campaign-blurs-party-lines-to-thwart-conservatives.html,0,2015,16/10/2015,canadian campaign blurs party lines to thwart conservatives,2015-10-16
59812,62510,62511,https://www.nytimes.com/2015/10/17/business/dealbook/why-great-leaders-see-more-and-exclude-less.html,5,2015,17/10/2015,why great leaders see more and exclude less,2015-10-17
59819,62528,62529,https://www.nytimes.com/2015/10/17/world/europe/leaders-of-frances-socialist-party-defy-its-orthodoxy.html,0,2015,17/10/2015,leaders of frances socialist party defy its orthodoxy,2015-10-17
59853,62450,62451,https://www.nytimes.com/2015/10/17/your-money/online-university-helps-philanthropic-groups-and-their-leaders.html,0,2015,17/10/2015,online university helps philanthropic groups and their leaders,2015-10-17
59860,62601,62602,https://www.nytimes.com/2015/10/17/business/dealbook/online-dating-business-files-to-go-public.html,0,2015,17/10/2015,online dating business files to go public,2015-10-17
59981,62666,62667,https://www.nytimes.com/2015/10/18/world/middleeast/iran-nuclear-deal-sanctions.html,0,2015,18/10/2015,iran nuclear deal sanctions,2015-10-18
59997,62655,62656,https://www.nytimes.com/2015/10/18/world/asia/india-writers-return-awards-to-protest-government-silence-on-violence.html,0,2015,18/10/2015,india writers return awards to protest government silence on violence,2015-10-18
60000,62659,62660,https://www.nytimes.com/2015/10/18/world/asia/fearing-election-losses-taiwans-governing-party-drops-its-presidential-candidate.html,0,2015,18/10/2015,fearing election losses taiwans governing party drops its presidential candidate,2015-10-18
60007,62717,62718,https://www.nytimes.com/2015/10/18/world/middleeast/as-conflicts-flare-up-leaders-fan-sectarian-flames-in-middle-east.html,0,2015,18/10/2015,as conflicts flare up leaders fan sectarian flames in middle east,2015-10-18
60008,62720,62721,https://www.nytimes.com/2015/10/18/world/asia/britain-to-put-commerce-with-china-first-in-president-xi-jinpings-state-visit.html,0,2015,18/10/2015,britain to put commerce with china first in president xi jinpings state visit,2015-10-18
60195,62872,62873,https://www.nytimes.com/2015/10/19/business/international/chinas-growth-slows-to-6-9.html,0,2015,19/10/2015,chinas growth slows to 6 9,2015-10-19
60235,62845,62846,https://www.nytimes.com/2015/10/19/world/asia/in-a-region-disturbed-by-ethnic-tensions-china-keeps-tight-lid-on-a-massacre.html,0,2015,19/10/2015,in a region disturbed by ethnic tensions china keeps tight lid on a massacre,2015-10-19
60280,62976,62977,https://www.nytimes.com/interactive/2015/10/19/business/international/china-economy-xi-jinping-officials.html,0,2015,19/10/2015,china economy xi jinping officials,2015-10-19
60282,62959,62960,https://artsbeat.blogs.nytimes.com/2015/10/19/painting-seized-in-world-war-ii-to-be-sold-as-restitution-to-jewish-heirs/,0,2015,19/10/2015,painting seized in world war ii to be sold as restitution to jewish heirs,2015-10-19
60285,62955,62956,https://bits.blogs.nytimes.com/2015/10/19/square-hires-former-yahoo-executive-to-run-cash-advance-business/,0,2015,19/10/2015,square hires former yahoo executive to run cash advance business,2015-10-19
60296,62922,62923,https://www.nytimes.com/politics/first-draft/2015/10/19/today-in-politics-congress-returns-from-break-to-find-a-vacuum-crisis-and-clinton/,0,2015,19/10/2015,today in politics congress returns from break to find a vacuum crisis and clinton,2015-10-19
60336,63061,63062,https://www.nytimes.com/politics/first-draft/2015/10/19/jim-webb-a-blip-in-the-polls-warns-of-an-independent-run/,0,2015,19/10/2015,jim webb a blip in the polls warns of an independent run,2015-10-19
60366,63301,63302,https://www.nytimes.com/politics/first-draft/2015/10/20/joe-bidens-account-of-stance-on-bin-laden-raid-conflicts-with-others/,0,2015,20/10/2015,joe bidens account of stance on bin laden raid conflicts with others,2015-10-20
60484,63035,63036,https://www.nytimes.com/2015/10/20/business/united-ceo-oscar-munoz-hospitalization-leadership.html,0,2015,20/10/2015,united ceo oscar munoz hospitalization leadership,2015-10-20
60497,62985,62986,https://www.nytimes.com/2015/10/20/business/international/discordant-financial-messages-from-china-spur-global-unease.html,80,2015,20/10/2015,discordant financial messages from china spur global unease,2015-10-20
60528,62999,63000,https://www.nytimes.com/2015/10/20/us/politics/guantanamo-detainees-request-delays-progress-toward-9-11-trial.html,0,2015,20/10/2015,guantanamo detainees request delays progress toward 9 11 trial,2015-10-20
60555,62914,62915,https://www.nytimes.com/2015/10/20/world/asia/china-economic-growth-is-reducing-coastal-wetlands-report-finds.html,5,2015,20/10/2015,china economic growth is reducing coastal wetlands report finds,2015-10-20
60641,63332,63333,https://www.nytimes.com/2015/10/21/us/politics/report-traces-jeb-bushs-ties-to-companies-that-had-business-with-florida.html,0,2015,21/10/2015,report traces jeb bushs ties to companies that had business with florida,2015-10-21
60642,63319,63320,https://www.nytimes.com/2015/10/21/world/middleeast/watching-syrias-war-as-a-music-video-shot-by-a-russian-drone.html,0,2015,21/10/2015,watching syrias war as a music video shot by a russian drone,2015-10-21
60655,63204,63205,https://www.nytimes.com/2015/10/21/world/europe/as-migrants-reach-europe-fears-may-be-misplaced.html,0,2015,21/10/2015,as migrants reach europe fears may be misplaced,2015-10-21
60662,63250,63251,https://www.nytimes.com/2015/10/21/business/dealbook/credit-agricole-to-pay-787-million-for-sanctions-violations.html,0,2015,21/10/2015,credit agricole to pay 787 million for sanctions violations,2015-10-21
60671,63238,63239,https://www.nytimes.com/2015/10/21/business/dealbook/hedge-fund-assets-decline-by-biggest-amount-since-financial-crisis.html,0,2015,21/10/2015,hedge fund assets decline by biggest amount since financial crisis,2015-10-21
60717,63402,63403,https://www.nytimes.com/politics/first-draft/2015/10/21/jeb-bush-to-address-hispanic-group-tied-to-koch-brothers/,0,2015,21/10/2015,jeb bush to address hispanic group tied to koch brothers,2015-10-21
60725,63470,63471,https://www.nytimes.com/slideshow/2015/10/21/business/americas-flatware.html,0,2015,21/10/2015,americas flatware,2015-10-21
60742,63144,63145,https://www.nytimes.com/2015/10/21/world/americas/brazil-pension-crisis-mounts-as-more-retire-earlier-then-pass-benefits-on.html,0,2015,21/10/2015,brazil pension crisis mounts as more retire earlier then pass benefits on,2015-10-21
60769,63181,63182,https://www.nytimes.com/2015/10/21/business/dealbook/yum-brands-to-split-china-business-into-separate-company.html,0,2015,21/10/2015,yum brands to split china business into separate company,2015-10-21
60774,63382,63383,https://www.nytimes.com/interactive/2015/10/21/world/asia/mao-zedong-china-quiz-edX.html,0,2015,21/10/2015,mao zedong china quiz edX,2015-10-21
60843,63519,63520,https://www.nytimes.com/2015/10/22/business/international/european-inquiry-focuses-on-a-mysterious-starbucks-business.html,0,2015,22/10/2015,european inquiry focuses on a mysterious starbucks business,2015-10-22
60871,63553,63554,https://www.nytimes.com/2015/10/22/business/media/spotify-in-dispute-over-royalty-payments.html,0,2015,22/10/2015,spotify in dispute over royalty payments,2015-10-22
60894,63409,63410,https://www.nytimes.com/2015/10/22/world/asia/china-diplomats-shooting-cebu-philippines.html,0,2015,22/10/2015,china diplomats shooting cebu philippines,2015-10-22
60895,63444,63445,https://www.nytimes.com/2015/10/22/world/europe/us-marine-killed-in-jet-crash-in-britain.html,0,2015,22/10/2015,us marine killed in jet crash in britain,2015-10-22
60898,63440,63441,https://www.nytimes.com/2015/10/22/world/europe/sounds-of-war-recede-to-background-in-an-eastern-ukraine-city.html,0,2015,22/10/2015,sounds of war recede to background in an eastern ukraine city,2015-10-22
60956,63623,63624,https://www.nytimes.com/2015/10/22/us/politics/warm-in-public-joe-biden-and-hillary-clinton-have-been-intense-rivals-in-private.html,0,2015,22/10/2015,warm in public joe biden and hillary clinton have been intense rivals in private,2015-10-22
61003,63689,63690,https://www.nytimes.com/politics/first-draft/2015/10/22/joe-biden-saves-obama-from-an-awkward-choice/,0,2015,22/10/2015,joe biden saves obama from an awkward choice,2015-10-22
61103,63928,63929,https://www.nytimes.com/2015/10/23/business/media/independent-musicians-find-unexpected-rewards-in-streaming.html,0,2015,23/10/2015,independent musicians find unexpected rewards in streaming,2015-10-23
