,Unnamed: 0,article_id,article_url,comment_count,year,date,title,datetimeobject
37778,39762,39763,https://www.nytimes.com/2015/06/27/world/asia/nepal-rough-terrain-and-bad-weather-led-to-helicopter-crash-report-says.html,0,2015,27/06/2015,nepal rough terrain and bad weather led to helicopter crash report says,2015-06-27
37793,39520,39521,https://www.nytimes.com/2015/06/27/business/dealbook/europcar-shares-decline-in-early-trading-after-paris-ipo.html,0,2015,27/06/2015,europcar shares decline in early trading after paris ipo,2015-06-27
37834,39575,39576,https://www.nytimes.com/2015/06/27/business/sirius-xm-settles-royalty-dispute-over-old-recordings.html,0,2015,27/06/2015,sirius xm settles royalty dispute over old recordings,2015-06-27
37857,39616,39617,https://www.nytimes.com/2015/06/27/business/dealbook/the-bad-behavior-of-visionary-leaders.html,0,2015,27/06/2015,the bad behavior of visionary leaders,2015-06-27
37863,39652,39653,https://www.nytimes.com/2015/06/27/world/europe/european-union-migrant-crisis-quotas-italy-greece.html,33,2015,27/06/2015,european union migrant crisis quotas italy greece,2015-06-27
37866,39697,39698,https://www.nytimes.com/2015/06/27/world/africa/fear-and-uncertainty-grip-burundi-before-parliamentary-vote.html,0,2015,27/06/2015,fear and uncertainty grip burundi before parliamentary vote,2015-06-27
37976,39802,39803,https://www.nytimes.com/2015/06/28/business/international/china-cuts-interest-rates-after-market-plunge.html,0,2015,28/06/2015,china cuts interest rates after market plunge,2015-06-28
38158,39906,39907,https://www.nytimes.com/2015/06/29/business/greek-debt-crisis-european-central-bank.html,0,2015,29/06/2015,greek debt crisis european central bank,2015-06-29
38163,39934,39935,https://www.nytimes.com/2015/06/29/world/europe/a-wary-athens-awaits-the-referendum-on-austerity.html,0,2015,29/06/2015,a wary athens awaits the referendum on austerity,2015-06-29
38164,39932,39933,https://www.nytimes.com/2015/06/29/world/europe/dutch-say-inquiry-into-malaysia-jet-crash-is-being-blocked-in-ukraine.html,0,2015,29/06/2015,dutch say inquiry into malaysia jet crash is being blocked in ukraine,2015-06-29
38169,39921,39922,https://www.nytimes.com/2015/06/29/business/dealbook/panic-among-hedge-fund-investors-in-greece.html,0,2015,29/06/2015,panic among hedge fund investors in greece,2015-06-29
38192,40084,40085,https://www.nytimes.com/politics/first-draft/2015/06/29/karl-rove-disputes-an-excerpt-from-ted-cruzs-book/,0,2015,29/06/2015,karl rove disputes an excerpt from ted cruzs book,2015-06-29
38217,40003,40004,https://www.nytimes.com/2015/06/29/business/asia-markets-slide-on-fears-over-greece.html,0,2015,29/06/2015,asia markets slide on fears over greece,2015-06-29
38263,39946,39947,https://www.nytimes.com/2015/06/29/business/fears-of-greece-leaving-euro-are-fears-of-the-unknown.html,0,2015,29/06/2015,fears of greece leaving euro are fears of the unknown,2015-06-29
38272,39984,39985,https://www.nytimes.com/2015/06/29/world/europe/greece-will-shut-banks-in-fallout-from-debt-crisis.html,159,2015,29/06/2015,greece will shut banks in fallout from debt crisis,2015-06-29
38283,39972,39973,https://www.nytimes.com/2015/06/29/world/asia/china-and-india-are-sitting-out-refugee-crisis.html,19,2015,29/06/2015,china and india are sitting out refugee crisis,2015-06-29
38306,40050,40051,https://www.nytimes.com/2015/06/30/business/international/chinese-stocks-fall-into-a-bear-market.html,0,2015,30/06/2015,chinese stocks fall into a bear market,2015-06-30
38308,40047,40048,https://www.nytimes.com/2015/06/30/world/middleeast/israeli-navy-intercepts-ship-sailing-toward-gaza-strip.html,0,2015,30/06/2015,israeli navy intercepts ship sailing toward gaza strip,2015-06-30
38310,40046,40047,https://www.nytimes.com/2015/06/30/world/asia/xi-jinping-of-china-hosts-nations-at-asian-infrastructure-investment-bank-founding.html,0,2015,30/06/2015,xi jinping of china hosts nations at asian infrastructure investment bank founding,2015-06-30
38344,40309,40310,https://www.nytimes.com/politics/first-draft/2015/06/30/supreme-court-to-weigh-dispute-over-union-fees/,0,2015,30/06/2015,supreme court to weigh dispute over union fees,2015-06-30
38370,40037,40038,https://www.nytimes.com/2015/06/30/business/dealbook/ge-to-sell-bulk-of-fleet-financing-business-for-69-billion.html,0,2015,30/06/2015,ge to sell bulk of fleet financing business for 69 billion,2015-06-30
38400,40063,40064,https://www.nytimes.com/2015/06/30/business/dealbook/private-equity-firms-circle-australian-car-finance-company.html,0,2015,30/06/2015,private equity firms circle australian car finance company,2015-06-30
38405,40141,40142,https://www.nytimes.com/2015/06/30/business/dealbook/monetary-controls-in-greece-squeeze-consumers-and-businesses.html,0,2015,30/06/2015,monetary controls in greece squeeze consumers and businesses,2015-06-30
38418,40120,40121,https://www.nytimes.com/2015/06/30/world/europe/european-leaders-insist-greek-deal-is-still-possible.html,117,2015,30/06/2015,european leaders insist greek deal is still possible,2015-06-30
38455,40206,40207,https://www.nytimes.com/2015/06/30/world/europe/russia-officials-meet-on-syrian-crisis.html,0,2015,30/06/2015,russia officials meet on syrian crisis,2015-06-30
38489,40210,40211,https://www.nytimes.com/2015/06/30/business/aol-in-deal-with-microsoft-to-take-over-display-ad-business.html,0,2015,30/06/2015,aol in deal with microsoft to take over display ad business,2015-06-30
38494,40095,40096,https://www.nytimes.com/2015/06/30/business/dealbook/puerto-ricos-bonds-drop-on-governors-warning-about-debt.html,90,2015,30/06/2015,puerto ricos bonds drop on governors warning about debt,2015-06-30
38553,867,868,https://www.nytimes.com/2015/01/07/world/asia/hong-kong-insists-voting-will-abide-by-china-rules.html,0,2015,07/01/2015,hong kong insists voting will abide by china rules,2015-07-01
38554,1091,1092,https://atwar.blogs.nytimes.com/2015/01/07/a-young-private-killed-in-world-war-ii-still-leaps-off-the-page/,0,2015,07/01/2015,a young private killed in world war ii still leaps off the page,2015-07-01
38656,878,879,https://www.nytimes.com/2015/01/07/world/asia/guo-yushan-arrest-china-chen-guangcheng.html,0,2015,07/01/2015,guo yushan arrest china chen guangcheng,2015-07-01
38718,1031,1032,https://www.nytimes.com/2015/01/07/world/africa/fighter-defects-citing-ties-to-joseph-kony-fugitive-african-warlord.html,0,2015,07/01/2015,fighter defects citing ties to joseph kony fugitive african warlord,2015-07-01
38801,8181,8182,https://www.nytimes.com/2015/02/07/world/asia/chinas-fog-weighs-heavily-on-shoulders-of-its-premier-architect.html,0,2015,07/02/2015,chinas fog weighs heavily on shoulders of its premier architect,2015-07-02
38823,8089,8090,https://www.nytimes.com/2015/02/07/world/asia/tony-abbott-australian-premier-vows-to-fight-leadership-challenge.html,0,2015,07/02/2015,tony abbott australian premier vows to fight leadership challenge,2015-07-02
38825,8107,8108,https://www.nytimes.com/2015/02/07/world/asia/transasia-airways-plane-crash-taiwan.html,0,2015,07/02/2015,transasia airways plane crash taiwan,2015-07-02
38829,8129,8130,https://www.nytimes.com/2015/02/07/world/asia/obamas-public-encounter-with-the-dalai-lama-riles-china.html,0,2015,07/02/2015,obamas public encounter with the dalai lama riles china,2015-07-02
38844,8322,8323,https://www.nytimes.com/2015/02/07/world/africa/boko-haram-attacks-town-in-niger-widening-conflict.html,0,2015,07/02/2015,boko haram attacks town in niger widening conflict,2015-07-02
38896,14734,14735,https://www.nytimes.com/2015/03/07/world/asia/china-blocks-web-access-to-documentary-on-nations-air-pollution.html,0,2015,07/03/2015,china blocks web access to documentary on nations air pollution,2015-07-03
38944,14759,14760,https://www.nytimes.com/2015/03/07/world/middleeast/4-nusra-front-leaders-said-to-be-killed-in-syria.html,0,2015,07/03/2015,4 nusra front leaders said to be killed in syria,2015-07-03
39238,28183,28184,https://www.nytimes.com/2015/05/07/business/to-cuba-on-business.html,0,2015,07/05/2015,to cuba on business,2015-07-05
39260,28172,28173,https://www.nytimes.com/2015/05/07/business/putting-out-the-welcome-mat-for-china.html,0,2015,07/05/2015,putting out the welcome mat for china,2015-07-05
39265,28180,28181,https://www.nytimes.com/2015/05/07/world/middleeast/us-iran-tensions-appear-to-ease-in-strait-of-hormuz.html,0,2015,07/05/2015,us iran tensions appear to ease in strait of hormuz,2015-07-05
39310,28229,28230,https://www.nytimes.com/2015/05/07/business/media/producers-turn-to-indiegogo-to-finance-orson-welless-final-film.html,0,2015,07/05/2015,producers turn to indiegogo to finance orson welless final film,2015-07-05
39361,28144,28145,https://www.nytimes.com/2015/05/07/business/media/al-jazeera-america-chief-is-ousted-after-turmoil.html,0,2015,07/05/2015,al jazeera america chief is ousted after turmoil,2015-07-05
39374,28000,28001,https://www.nytimes.com/2015/05/07/world/europe/germanwings-flight-9525-crash-andreas-lubitz.html,0,2015,07/05/2015,germanwings flight 9525 crash andreas lubitz,2015-07-05
39388,28104,28105,https://www.nytimes.com/2015/05/07/business/dealbook/trader-in-2010-flash-crash-case-is-denied-bail-reduction.html,0,2015,07/05/2015,trader in 2010 flash crash case is denied bail reduction,2015-07-05
39410,28135,28136,https://www.nytimes.com/2015/05/07/world/europe/party-leaders-end-british-election-campaign-more-energized-than-voters.html,0,2015,07/05/2015,party leaders end british election campaign more energized than voters,2015-07-05
39412,28120,28121,https://www.nytimes.com/2015/05/07/business/dealbook/corinthian-colleges-lean-business-model-leaves-little-for-creditors.html,0,2015,07/05/2015,corinthian colleges lean business model leaves little for creditors,2015-07-05
39434,28098,28099,https://www.nytimes.com/2015/05/07/business/business-travelers-want-to-be-left-to-their-own-devices.html,0,2015,07/05/2015,business travelers want to be left to their own devices,2015-07-05
39479,34897,34898,https://www.nytimes.com/2015/06/07/world/asia/300-more-bodies-found-in-china-ship-disaster.html,0,2015,07/06/2015,300 more bodies found in china ship disaster,2015-07-06
39728,41616,41617,https://www.nytimes.com/2015/07/07/us/politics/clinton-first-brother-is-wary-chatty-and-still-occasionally-attracting-attention.html,0,2015,07/07/2015,clinton first brother is wary chatty and still occasionally attracting attention,2015-07-07
39739,41606,41607,https://www.nytimes.com/2015/07/07/world/americas/un-chief-calls-for-new-inquiry-into-1961-plane-crash-that-killed-dag-hammarskjold.html,0,2015,07/07/2015,un chief calls for new inquiry into 1961 plane crash that killed dag hammarskjold,2015-07-07
39765,41419,41420,https://www.nytimes.com/2015/07/07/business/international/yanis-varoufakis-abruptly-resigns-as-greek-finance-minister.html,522,2015,07/07/2015,yanis varoufakis abruptly resigns as greek finance minister,2015-07-07
39813,41518,41519,https://www.nytimes.com/2015/07/07/world/europe/angela-merkel-faces-monumental-test-of-leadership-after-greek-vote.html,0,2015,07/07/2015,angela merkel faces monumental test of leadership after greek vote,2015-07-07
39816,41497,41498,https://www.nytimes.com/2015/07/07/business/dealbook/chinese-stocks-still-look-overvalued.html,0,2015,07/07/2015,chinese stocks still look overvalued,2015-07-07
39828,41593,41594,https://www.nytimes.com/2015/07/07/world/asia/global-poverty-drops-sharply-with-china-making-big-strides-un-report-says.html,0,2015,07/07/2015,global poverty drops sharply with china making big strides un report says,2015-07-07
39836,41515,41516,https://www.nytimes.com/2015/07/07/us/politics/hillary-clintons-team-is-wary-as-bernie-sanders-finds-footing-in-iowa.html,436,2015,07/07/2015,hillary clintons team is wary as bernie sanders finds footing in iowa,2015-07-07
39864,46680,46681,https://www.nytimes.com/2015/08/07/business/international/as-china-reduces-local-spending-cities-woo-private-investors.html,0,2015,07/08/2015,as china reduces local spending cities woo private investors,2015-07-08
39873,46638,46639,https://www.nytimes.com/2015/08/07/world/asia/afghanistan-army-helicopter-crashes-in-zabul-killing-all-17-aboard.html,0,2015,07/08/2015,afghanistan army helicopter crashes in zabul killing all 17 aboard,2015-07-08
39881,46594,46595,https://www.nytimes.com/2015/08/07/world/middleeast/iran-state-department-warning.html,0,2015,07/08/2015,iran state department warning,2015-07-08
39889,46621,46622,https://www.nytimes.com/2015/08/07/business/dealbook/cf-industries-to-acquire-businesses-from-oci-for-8-billion.html,0,2015,07/08/2015,cf industries to acquire businesses from oci for 8 billion,2015-07-08
39935,46709,46710,https://www.nytimes.com/2015/08/07/world/asia/pakistan-army-helicopter-crash-gilgit.html,0,2015,07/08/2015,pakistan army helicopter crash gilgit,2015-07-08
39998,46866,46867,https://www.nytimes.com/2015/08/07/world/asia/afghan-wars-convenient-myth-a-living-mullah-omar.html,0,2015,07/08/2015,afghan wars convenient myth a living mullah omar,2015-07-08
40088,52943,52944,https://www.nytimes.com/2015/09/07/business/media/caijing-journalists-shaming-signals-chinas-growing-control-over-news-media.html,0,2015,07/09/2015,caijing journalists shaming signals chinas growing control over news media,2015-07-09
40121,52948,52949,https://www.nytimes.com/2015/09/07/world/german-quota-system-highlights-possible-path-and-pitfalls-for-handling-crisis.html,0,2015,07/09/2015,german quota system highlights possible path and pitfalls for handling crisis,2015-07-09
40198,60068,60069,https://www.nytimes.com/2015/10/07/business/media/warner-chappell-names-jon-platt-its-new-chief.html,0,2015,07/10/2015,warner chappell names jon platt its new chief,2015-07-10
40210,60145,60146,https://www.nytimes.com/2015/10/07/world/middleeast/fears-of-new-intifada-accompany-surge-in-mideast-violence.html,0,2015,07/10/2015,fears of new intifada accompany surge in mideast violence,2015-07-10
40214,60079,60080,https://www.nytimes.com/2015/10/07/world/middleeast/syrian-familys-agony-raises-specter-of-chemical-warfare.html,114,2015,07/10/2015,syrian familys agony raises specter of chemical warfare,2015-07-10
40231,60122,60123,https://www.nytimes.com/2015/10/07/business/dealbook/new-york-attorney-general-examining-private-equity-firms-mortgage-business.html,0,2015,07/10/2015,new york attorney general examining private equity firms mortgage business,2015-07-10
40270,60101,60102,https://www.nytimes.com/2015/10/07/business/dealbook/bank-of-america-conflict-case-could-put-a-chill-on-wall-st.html,0,2015,07/10/2015,bank of america conflict case could put a chill on wall st,2015-07-10
40305,59978,59979,https://www.nytimes.com/2015/10/07/world/asia/trans-pacific-partnership-china-australia.html,108,2015,07/10/2015,trans pacific partnership china australia,2015-07-10
40315,59952,59953,https://www.nytimes.com/2015/10/07/world/asia/indonesia-wreckage-aviastar-plane-crash.html,0,2015,07/10/2015,indonesia wreckage aviastar plane crash,2015-07-10
40336,60177,60178,https://www.nytimes.com/2015/10/07/business/in-a-reunion-bernanke-and-geithner-revisit-the-crisis.html,0,2015,07/10/2015,in a reunion bernanke and geithner revisit the crisis,2015-07-10
40341,60178,60179,https://www.nytimes.com/2015/10/07/world/middleeast/raif-badawi-imprisoned-saudi-blogger-is-awarded-free-speech-prize.html,0,2015,07/10/2015,raif badawi imprisoned saudi blogger is awarded free speech prize,2015-07-10
40388,60159,60160,https://www.nytimes.com/2015/10/07/business/uaw-warns-fiat-chrysler-to-make-deal-or-face-strike.html,0,2015,07/10/2015,uaw warns fiat chrysler to make deal or face strike,2015-07-10
40404,60162,60163,https://www.nytimes.com/2015/10/07/business/teamsters-pension-fund-warns-400000-of-cuts.html,0,2015,07/10/2015,teamsters pension fund warns 400000 of cuts,2015-07-10
40410,60009,60010,https://www.nytimes.com/2015/10/07/world/middleeast/russia-turkey-tensions-rise-over-syria.html,0,2015,07/10/2015,russia turkey tensions rise over syria,2015-07-10
40415,59998,59999,https://www.nytimes.com/2015/10/07/world/asia/china-coal-mines-fushun.html,0,2015,07/10/2015,china coal mines fushun,2015-07-10
40443,67608,67609,https://www.nytimes.com/2015/11/07/us/politics/spotty-intelligence-prompts-us-caution-in-assessing-jet-crash-in-egypt.html,0,2015,07/11/2015,spotty intelligence prompts us caution in assessing jet crash in egypt,2015-07-11
40496,67502,67503,https://www.nytimes.com/2015/11/07/business/dealbook/the-end-of-chapter-11-bankruptcy-protection.html,0,2015,07/11/2015,the end of chapter 11 bankruptcy protection,2015-07-11
40507,67400,67401,https://www.nytimes.com/2015/11/07/business/dealbook/tullett-prebon-in-talks-to-buy-icaps-global-brokering-business.html,0,2015,07/11/2015,tullett prebon in talks to buy icaps global brokering business,2015-07-11
40524,67594,67595,https://www.nytimes.com/2015/11/07/world/africa/west-fears-burundi-is-on-brink-of-conflict.html,0,2015,07/11/2015,west fears burundi is on brink of conflict,2015-07-11
40525,67380,67381,https://www.nytimes.com/2015/11/07/business/dealbook/china-stock-market-ipo.html,0,2015,07/11/2015,china stock market ipo,2015-07-11
40550,67532,67533,https://www.nytimes.com/2015/11/07/world/middleeast/egypt-russian-plane-crash-investigation.html,96,2015,07/11/2015,egypt russian plane crash investigation,2015-07-11
40553,67355,67356,https://www.nytimes.com/2015/11/07/world/asia/china-taiwan-meeting-economy-protests-singapore.html,53,2015,07/11/2015,china taiwan meeting economy protests singapore,2015-07-11
40554,67345,67346,https://www.nytimes.com/2015/11/07/business/international/arcelormittal-steel-china-loss-commodities.html,0,2015,07/11/2015,arcelormittal steel china loss commodities,2015-07-11
40575,73852,73853,https://bits.blogs.nytimes.com/2015/12/07/alphabets-life-sciences-business-has-a-new-name-verily/,0,2015,07/12/2015,alphabets life sciences business has a new name verily,2015-07-12
40647,73614,73615,https://www.nytimes.com/2015/12/07/world/asia/china-xu-ming-dies-prison.html,0,2015,07/12/2015,china xu ming dies prison,2015-07-12
40648,73759,73760,https://www.nytimes.com/politics/first-draft/2015/12/07/elizabeth-warren-shows-support-for-hillary-clintons-wall-street-plan/,0,2015,07/12/2015,elizabeth warren shows support for hillary clintons wall street plan,2015-07-12
40763,42503,42504,https://sinosphere.blogs.nytimes.com/2015/07/13/tsinghua-business-graduates-scrap-market-oriented-slogan/,0,2015,13/07/2015,tsinghua business graduates scrap market oriented slogan,2015-07-13
40857,42404,42405,https://www.nytimes.com/2015/07/13/business/international/with-ban-on-exports-lifted-japan-arms-makers-cautiously-market-wares-abroad.html,47,2015,13/07/2015,with ban on exports lifted japan arms makers cautiously market wares abroad,2015-07-13
40873,42465,42466,https://www.nytimes.com/2015/07/13/business/dealbook/chinas-incendiary-market-is-fanned-by-borrowers-and-manipulation.html,0,2015,13/07/2015,chinas incendiary market is fanned by borrowers and manipulation,2015-07-13
40879,42454,42455,https://www.nytimes.com/2015/07/13/nyregion/world-war-ii-history-captured-in-a-privates-letters-to-his-wife.html,0,2015,13/07/2015,world war ii history captured in a privates letters to his wife,2015-07-13
40904,42744,42745,https://www.nytimes.com/2015/07/14/t-magazine/the-business-of-cosmetic-surgery.html,0,2015,14/07/2015,the business of cosmetic surgery,2015-07-14
40935,42784,42785,https://www.nytimes.com/politics/first-draft/2015/07/14/today-in-politics-once-wary-of-clinton-congressional-democrats-open-their-arms/,0,2015,14/07/2015,today in politics once wary of clinton congressional democrats open their arms,2015-07-14
40979,42691,42692,https://www.nytimes.com/2015/07/14/business/hedge-funds-reassess-china-after-market-free-fall.html,0,2015,14/07/2015,hedge funds reassess china after market free fall,2015-07-14
40984,42697,42698,https://www.nytimes.com/2015/07/14/world/nigeria-military-leaders-faulted-in-fighting-militants-are-fired.html,0,2015,14/07/2015,nigeria military leaders faulted in fighting militants are fired,2015-07-14
41021,42640,42641,https://www.nytimes.com/2015/07/14/world/africa/tunisian-forces-kill-3-senior-leaders-of-insurgent-group.html,0,2015,14/07/2015,tunisian forces kill 3 senior leaders of insurgent group,2015-07-14
41126,42910,42911,https://www.nytimes.com/politics/first-draft/2015/07/15/scott-walker-tries-to-clarify-remarks-on-gay-scout-leaders/,0,2015,15/07/2015,scott walker tries to clarify remarks on gay scout leaders,2015-07-15
41129,42922,42923,https://www.nytimes.com/politics/first-draft/2015/07/15/bobby-jindal-a-late-entry-reports-campaign-finance-filings/,0,2015,15/07/2015,bobby jindal a late entry reports campaign finance filings,2015-07-15
41157,42781,42782,https://www.nytimes.com/2015/07/15/world/asia/chinese-police-say-men-killed-by-officers-were-xinjiang-terrorists.html,0,2015,15/07/2015,chinese police say men killed by officers were xinjiang terrorists,2015-07-15
41169,43027,43028,https://www.nytimes.com/2015/07/16/world/middleeast/syria-increasingly-disintegrates-in-crucible-of-war.html,0,2015,16/07/2015,syria increasingly disintegrates in crucible of war,2015-07-16
41237,43112,43113,https://www.nytimes.com/politics/first-draft/2015/07/16/today-in-politics-a-close-look-at-donors-war-chests-and-burn-rates/,0,2015,16/07/2015,today in politics a close look at donors war chests and burn rates,2015-07-16
41277,43233,43234,https://www.nytimes.com/politics/first-draft/2015/07/16/profit-sharing-makes-good-business-sense-hillary-clinton-says/,0,2015,16/07/2015,profit sharing makes good business sense hillary clinton says,2015-07-16
41319,42870,42871,https://www.nytimes.com/2015/07/16/world/middleeast/a-syrian-parody-features-the-civil-war-and-is-stalked-by-it.html,0,2015,16/07/2015,a syrian parody features the civil war and is stalked by it,2015-07-16
41322,42864,42865,https://www.nytimes.com/2015/07/16/business/international/cooling-of-chinas-stock-market-dents-major-driver-of-economic-growth.html,0,2015,16/07/2015,cooling of chinas stock market dents major driver of economic growth,2015-07-16
41324,42823,42824,https://www.nytimes.com/2015/07/16/world/asia/china-says-detained-tourists-were-watching-terrorist-video.html,0,2015,16/07/2015,china says detained tourists were watching terrorist video,2015-07-16
41348,42929,42930,https://www.nytimes.com/2015/07/16/world/europe/resolving-the-greek-debt-crisis-crucial-next-steps.html,0,2015,16/07/2015,resolving the greek debt crisis crucial next steps,2015-07-16
41366,42932,42933,https://www.nytimes.com/2015/07/16/business/media/netflix-q2-earnings-charter-time-warner-bright-house.html,0,2015,16/07/2015,netflix q2 earnings charter time warner bright house,2015-07-16
41388,43325,43326,https://www.nytimes.com/2015/07/17/world/europe/sea-warming-leads-to-ban-on-fishing-in-the-arctic.html,0,2015,17/07/2015,sea warming leads to ban on fishing in the arctic,2015-07-17
41390,43340,43341,https://www.nytimes.com/2015/07/17/business/in-bankruptcy-filings-maritime-company-says-it-settled-labor-case.html,0,2015,17/07/2015,in bankruptcy filings maritime company says it settled labor case,2015-07-17
41418,43248,43249,https://www.nytimes.com/2015/07/17/world/europe/greek-debt-crisis-highlights-fractures-in-european-union.html,0,2015,17/07/2015,greek debt crisis highlights fractures in european union,2015-07-17
41431,43278,43279,https://www.nytimes.com/2015/07/17/world/asia/wan-li-who-helped-chinas-farmers-emerge-from-mao-era-dies-at-98.html,0,2015,17/07/2015,wan li who helped chinas farmers emerge from mao era dies at 98,2015-07-17
41552,43168,43169,https://www.nytimes.com/2015/07/17/world/asia/china-cremates-body-of-revered-tibetan-monk-tenzin-delek-rinpoche.html,0,2015,17/07/2015,china cremates body of revered tibetan monk tenzin delek rinpoche,2015-07-17
41562,43196,43197,https://www.nytimes.com/2015/07/17/world/asia/violence-flares-in-disputed-kashmir-region-between-india-and-pakistan.html,0,2015,17/07/2015,violence flares in disputed kashmir region between india and pakistan,2015-07-17
41666,43484,43485,https://www.nytimes.com/2015/07/18/business/energy-environment/coal-miners-struggle-to-survive-in-an-industry-battered-by-layoffs-and-bankruptcy.html,0,2015,18/07/2015,coal miners struggle to survive in an industry battered by layoffs and bankruptcy,2015-07-18
41670,43489,43490,https://www.nytimes.com/2015/07/18/world/middleeast/king-salman-of-saudi-arabia-meets-with-hamas-leaders.html,0,2015,18/07/2015,king salman of saudi arabia meets with hamas leaders,2015-07-18
41731,43587,43588,https://www.nytimes.com/2015/07/19/us/politics/trump-belittles-mccains-war-record.html,0,2015,19/07/2015,trump belittles mccains war record,2015-07-19
41733,43604,43605,https://www.nytimes.com/2015/07/19/world/asia/china-2-relatives-of-a-tibetan-monk-who-died-in-prison-have-been-arrested.html,0,2015,19/07/2015,china 2 relatives of a tibetan monk who died in prison have been arrested,2015-07-19
41737,43584,43585,https://www.nytimes.com/2015/07/19/opinion/sunday/if-world-leaders-can-skip-deadlines-why-cant-i.html,0,2015,19/07/2015,if world leaders can skip deadlines why cant i,2015-07-19
41783,43566,43567,https://www.nytimes.com/2015/07/19/world/europe/route-of-migrants-into-europe-shifts-toward-balkans.html,0,2015,19/07/2015,route of migrants into europe shifts toward balkans,2015-07-19
41793,43666,43667,https://artsbeat.blogs.nytimes.com/2015/07/19/ant-man-a-small-superhero-does-big-business-at-the-box-office/,0,2015,19/07/2015,ant man a small superhero does big business at the box office,2015-07-19
41800,43539,43540,https://www.nytimes.com/2015/07/19/world/asia/china-releases-9-tourists-accused-of-watching-terrorist-video-at-hotel.html,0,2015,19/07/2015,china releases 9 tourists accused of watching terrorist video at hotel,2015-07-19
